Order Number,Parcial Identification Number,Name,Applicant Grade,Option Number,Entrance Test Grade,12th year grade,Average of 11th and 10th grades
1,149(...)91,RUI PEDRO BALTAZAR MOTA DA COSTA,"198,1",3,"200,0",197,197
2,152(...)77,CARLOS ANDRÉ GOMES CERQUEIRA,"197,7",2,"197,0",198,198
3,154(...)32,DINIS CORDEIRO ALVARENGA GUARDADO,"196,7",6,"198,0",196,196
4,305(...)71,LEONOR DO ESPÍRITO SANTO SINVAL PEIXOTO FERNANDES,"196,3",6,"195,0",197,197
5,310(...)08,VASCO MIGUEL FIDALGO MARTINS GONÇALVES,"196,3",6,"193,0",198,198
6,302(...)18,DANIEL MOURA E FREITAS,"196,1",2,"200,0",194,194
7,156(...)34,TERESA FREITAS DOS SANTOS,"195,3",3,"192,0",197,197
8,308(...)85,JOÃO EDUARDO OLIVEIRA SANTOS,"195,0",3,"195,0",195,195
9,147(...)04,JOSÉ DINIS RAPOSO OLIVEIRA DA GAMA LOBO,"194,9",2,"191,0",197,197
10,310(...)50,JOÃO PEDRO DO NASCIMENTO LOBÃO,"194,9",5,"189,0",198,198
11,304(...)31,RUI MARTIM BALDAIA VIEIRA MENDES,"194,7",4,"196,0",194,194
11,305(...)41,MARIA CARVALHO LOPES,"194,7",3,"196,0",194,194
13,151(...)39,LARA DA SILVA MOREIRA,"194,4",2,"197,0",193,193
14,149(...)61,ANDRÉ MARTIM MORAIS PINHO,"194,4",2,"195,0",194,194
15,304(...)68,DINIS AFONSO NUNES PINTO,"194,0",4,"192,0",195,195
16,159(...)74,MARTIM OLIVEIRA NEVES,"193,8",2,"186,0",198,198
17,314(...)82,HUGO RIBEIRO ALVES,"193,6",3,"189,0",196,196
18,149(...)65,JOSÉ AMARAL FERREIRA TORRES,"193,5",2,"200,0",190,190
19,158(...)26,GONÇALO DE CARVALHO FERREIRA,"192,9",2,"187,0",196,196
19,303(...)47,TIAGO ABREU MARTINS COSTA LEITE,"192,9",5,"187,0",196,196
21,153(...)74,TIAGO ALEXANDRE DE BOAVENTURA NUNES,"192,6",6,"188,0",195,195
22,309(...)68,INÊS SILVA LEITE RESENDE,"192,5",2,"197,0",190,190
23,305(...)83,NÁDIA VIEIRA DA SILVA,"192,4",2,"195,0",191,191
24,312(...)26,CATARINA DA SILVA GUIMARÃES,"192,3",2,"191,0",193,193
25,304(...)37,EDUARDO TAVARES DE OLIVEIRA,"192,0",5,"190,0",193,193
26,151(...)16,LUÍSA BRITES MACHADO MONTEIRO,"191,6",3,"187,0",194,194
27,303(...)65,FRANCISCO PINTO DA SILVA,"191,3",4,"188,0",193,193
28,310(...)52,JOÃO MIGUEL TEIXEIRA DA SILVA,"191,2",3,"197,0",188,188
29,151(...)35,DIOGO DINIS RIBEIRO,"191,2",3,"186,0",194,194
29,303(...)21,INÊS ROCHA DE OLIVEIRA,"191,2",4,"186,0",194,194
29,304(...)88,DUARTE MIGUEL POMBO MARTINS,"191,2",5,"186,0",194,194
32,149(...)69,MARIA BEATRIZ CARVALHO MARQUES DA SILVA MARTINS,"191,0",4,"189,0",192,192
33,157(...)71,EDUARDO DOMINGUES DE BRITO,"190,7",2,"192,0",190,190
34,309(...)16,DANIEL TAVARES DA SILVA MARQUES,"190,3",2,"187,0",192,192
35,300(...)08,MARIA SOARES AZEVEDO,"190,2",1,"196,0",187,187
36,306(...)93,COSME JOSÉ PINHEIRO DE SOUSA,"189,9",3,"199,0",185,185
37,151(...)10,ARNALDO FERRAZ LOPES,"189,8",6,"180,0",195,195
38,154(...)72,MARTIM ROCHA RIBAS,"189,5",5,"196,0",186,186
39,325(...)61,HENRIQUE SANTANA VILARINHO,"189,3",3,"188,0",190,190
40,306(...)33,TIAGO MIGUEL VEIGA MONTEIRO,"189,2",2,"195,0",186,186
41,145(...)78,RICARDO ANDRÉ OLIVEIRA LEITÃO,"189,0",1,"176,0",196,196
42,308(...)79,PEDRO MANUEL PINTO COELHO,"188,9",3,"196,0",185,185
43,312(...)95,RAFAEL DA SILVA DIAS,"188,9",2,"185,0",191,191
44,315(...)86,MARIA MIGUEL DA SILVA MORAIS,"188,5",4,"182,0",192,192
45,308(...)61,MIGUEL BORGES PEREIRA,"188,3",2,"185,0",190,190
46,308(...)87,EDUARDA GOUVEIA MAGNO,"188,2",5,"170,0",198,198
47,152(...)59,JOÃO PEDRO SANTOS ROCHA,"188,1",6,"166,0",200,200
48,307(...)22,JOSÉ SEBASTIÃO PEREIRA VIZCAÍNO,"188,0",4,"175,0",195,195
49,149(...)55,MARIA CATARINA DOS SANTOS MOREIRA,"187,9",2,"197,0",183,183
50,157(...)63,VASCO ANTONIO LIBERAL RODRIGUES QUEIROS DE SA,"187,7",3,"187,0",188,188
50,313(...)96,VASCO COSTA LEMOS,"187,7",5,"187,0",188,188
52,157(...)93,MARIA BEATRIZ CUNHA LEITE,"187,5",2,"181,0",191,191
53,153(...)92,PEDRO BAPTISTA PEREIRA,"187,4",6,"177,0",193,193
54,154(...)11,RUI MIGUEL NEVES FÉLIX,"187,4",2,"175,0",194,194
54,307(...)39,AFONSO TAVARES FERNANDES DE ALMEIDA SARAIVA,"187,4",4,"175,0",194,194
56,155(...)35,FRANCISCO DA SILVA MOUTA,"187,2",2,"169,0",197,197
57,151(...)59,JOSÉ LOURENÇO REBELO DE BESSA PACHECO,"187,1",5,"176,0",193,193
58,301(...)45,LEANDRO RODRIGO DOS SANTOS SAMPAIO,"187,0",3,"185,0",188,188
58,306(...)51,RODRIGO MIGUEL GERALDES FERNANDES,"187,0",6,"185,0",188,188
58,314(...)98,DINIS BARBOSA DA SILVA,"187,0",3,"185,0",188,188
61,301(...)41,MATILDE DE SÁ NOGUEIRA DE SOUSA,"187,0",2,"172,0",195,195
62,156(...)89,FRANCISCO ALVES DOS SANTOS MOREIRA ANTUNES,"186,9",6,"194,0",183,183
63,230(...)02,CAUE SANTOS CUNHA DA SILVA,"186,9",5,"181,0",190,190
64,306(...)60,GUILHERME MÂNCIO DOS SANTOS OLIVEIRA GAMELAS,"186,8",4,"179,0",191,191
65,149(...)30,AFONSO DE ALMEIDA AMARO,"186,8",5,"177,0",192,192
66,305(...)07,MARIANA BAPTISTA PINTO,"186,7",3,"188,0",186,186
67,304(...)07,FERNANDO BRITO FERREIRA,"186,7",3,"186,0",187,187
68,150(...)17,RAFAEL LUZ CUNHA,"186,5",3,"191,0",184,184
68,300(...)62,DINIS ARAÚJO E COSTA,"186,5",1,"191,0",184,184
70,159(...)65,HENRIQUE RIBEIRO GONCALVES,"186,4",6,"189,0",185,185
71,301(...)71,RODRIGO FERREIRA DA SILVA CAMACHO,"186,4",6,"187,0",186,186
72,315(...)20,BRUNO MANUEL RABAÇAL DUARTE,"186,3",5,"183,0",188,188
73,230(...)01,LUCAS DEL PRETE DE LIMA,"186,2",1,"179,0",190,190
74,309(...)72,JOSÉ BARBOSA REIS,"186,1",4,"188,0",185,185
74,309(...)02,LEANDRO FILIPE PAIS RESENDE,"186,1",2,"188,0",185,185
76,150(...)95,MAFALDA FILIPA MAIA GOMES,"186,1",6,"175,0",192,192
77,315(...)72,TIAGO MOREIRA ARTEIRO,"186,0",2,"184,0",187,187
78,151(...)26,RITA SOFIA BARBOSA NUNES,"185,9",5,"182,0",188,188
79,150(...)06,RUI FILIPE CARDOSO SILVA,"185,9",1,"169,0",195,195
80,150(...)89,NUNO ALEXANDRE FERNANDES GOMES,"185,8",5,"189,0",184,184
81,151(...)62,BEATRIZ ALEXANDRA DIAS COSTA,"185,8",1,"178,0",190,190
82,151(...)72,JOANA AZEVEDO LOURO,"185,7",6,"185,0",186,186
83,148(...)05,SARA MARQUES RIBEIRO,"185,7",2,"172,0",193,193
83,151(...)89,JOÃO GONÇALVES FERREIRA SARAIVA TAVEIRA,"185,7",2,"172,0",193,193
85,312(...)57,BEATRIZ DA SILVA E SILVA,"185,5",5,"192,0",182,182
86,152(...)82,LUÍS MANUEL ZEFERINO DA COSTA,"185,5",3,"190,0",183,183
87,148(...)94,DANIEL RODRIGUES GOMES,"185,5",4,"177,0",190,190
88,152(...)66,ANDRÉ GUILHERME FARIA AMARAL,"185,4",2,"199,0",178,178
89,305(...)47,SIMÃO LUÍS VALINHO MARQUES RIBEIRO,"185,4",2,"188,0",184,184
89,307(...)88,MIGUEL OLIVEIRA DE SÁ,"185,4",3,"188,0",184,184
91,159(...)13,GUILHERME MARIA DO FUNDO RUELA BRANCO CARREIRA,"185,3",5,"195,0",180,180
92,306(...)06,MARISA AFONSO,"185,3",1,"182,0",187,187
93,305(...)18,AFONSO GONÇALVES GUERRA,"185,3",2,"169,0",194,194
94,301(...)76,GUILHERME ANDRADE OLIVEIRA,"185,2",2,"191,0",182,182
94,305(...)69,TIAGO NUNES VIOLANTE,"185,2",6,"191,0",182,182
96,314(...)75,CATARINA ISABEL COSTA BAPTISTA PAIS,"185,2",4,"180,0",188,188
97,306(...)17,FILIPE RAMOS PINHO SOLHA,"185,0",2,"185,0",185,185
97,310(...)79,TOMÁS DE ALMEIDA SILVA PEREIRA,"185,0",4,"185,0",185,185
99,306(...)57,TIAGO RIBEIRO DA SILVA COELHO,"185,0",2,"183,0",186,186
100,150(...)64,PEDRO AFONSO QUESADO PACHECO PEREIRA,"184,9",4,"179,0",188,188
100,304(...)41,JOSÉ PEDRO CASTRO SOUTINHO,"184,9",2,"179,0",188,188
102,150(...)50,ALEXANDRE SANTOS LOBATO VAZ SALEIRO,"184,8",6,"175,0",190,190
102,307(...)72,MARCO MARCELO LAGE PEREIRA RAMOS,"184,8",6,"175,0",190,190
104,159(...)21,TOMÁS MACHADO SALGUEIRO,"184,7",3,"173,0",191,191
105,312(...)28,MATILDE FERREIRA MARTINS,"184,6",4,"182,0",186,186
106,306(...)93,JOSÉ PEDRO MARQUES FERREIRA,"184,6",2,"180,0",187,187
106,306(...)74,AFONSO MIGUEL ANTUNES MORAIS,"184,6",2,"180,0",187,187
108,159(...)40,GUILHERME VALE PINTO,"184,6",6,"167,0",194,194
108,306(...)28,JOÃO CARLOS AFONSO TEIXEIRA,"184,6",3,"167,0",194,194
110,155(...)62,TOMÁS FREITAS LINHARES,"184,4",3,"198,0",177,177
111,151(...)41,HOMERO RUI PEREIRA COUTO,"184,4",1,"185,0",184,184
112,151(...)34,LUCAS ALMEIDA OLIVEIRA,"184,4",3,"172,0",191,191
112,303(...)64,MATILDE DE PINTO MORAIS ALVES,"184,4",5,"172,0",191,191
114,152(...)73,EDUARDO SARABANDO ENES PINTO LOUREIRO,"184,3",4,"194,0",179,179
115,158(...)13,CLAUDIO DANIEL FERREIRA MEIRELES,"184,3",2,"183,0",185,185
116,313(...)65,GUSTAVO PINTO DOS SANTOS,"184,3",2,"170,0",192,192
117,151(...)31,TOMÁS FREIRE NORONHA JARDIM,"184,2",5,"192,0",180,180
118,307(...)15,VASCO RAFAEL DE AZEVEDO,"184,2",1,"177,0",188,188
119,303(...)22,DIANA SOFIA SILVA PEREIRA,"184,0",3,"197,0",177,177
120,150(...)53,PEDRO MIGUEL CASTANHO PEREIRA,"183,9",3,"191,0",180,180
121,153(...)59,MARGARIDA DE SOUSA MACHADO ALVES DE SOUSA,"183,9",3,"180,0",186,186
122,157(...)11,AFONSO MIGUEL FRANCO DE CASTRO CAROLINO,"183,9",5,"178,0",187,187
123,151(...)78,HENRIQUE MENDES DE OLIVEIRA,"183,8",3,"176,0",188,188
124,159(...)07,GUILHERME OLIVEIRA LINHARES,"183,7",4,"185,0",183,183
124,303(...)24,JOANA SAMPAIO MAGALHÃES,"183,7",4,"185,0",183,183
124,324(...)53,MATEUS BATISTA BERTLING COUTINHO,"183,7",2,"185,0",183,183
127,315(...)36,JOSÉ MIGUEL ALVES DA ROCHA,"183,7",5,"170,0",191,191
128,152(...)18,GABRIEL ARCANJO ALVES OLIVEIRA,"183,6",3,"179,0",186,186
129,303(...)32,JOÃO SANTOS OLIVEIRA,"183,6",6,"166,0",193,193
130,152(...)51,SUSANA LIRA MARTINS GONÇALVES FERREIRA,"183,5",6,"162,0",195,195
131,314(...)23,JOSÉ PEDRO SILVA TEIXEIRA,"183,3",2,"193,0",178,178
132,151(...)21,TOMÁS COSTA BARROS,"183,2",2,"178,0",186,186
133,315(...)54,ANTÓNIO PEDRO DE MAGALHÃES DUARTE SANTOS,"183,1",3,"185,0",182,182
134,306(...)54,LEONARDO BARBOSA CARVALHO,"183,0",2,"168,0",191,191
135,305(...)19,ANA LEONOR GARCÊS GOMES,"182,9",6,"179,0",185,185
136,151(...)90,JOÃO PEDRO CÂMARA FURTADO,"182,8",3,"175,0",187,187
136,151(...)04,TOMÁS FERREIRA DA COSTA,"182,8",3,"175,0",187,187
138,153(...)92,DANIEL GONÇALVES PARENTE,"182,7",6,"184,0",182,182
139,157(...)27,PAULO RICARDO CARDOSO CUNHA,"182,6",3,"180,0",184,184
140,303(...)48,GUILHERME AFONSO PEIXOTO MACIEL DE PINHO TRIÃES,"182,6",4,"178,0",185,185
141,314(...)58,FRANCISCO ALEXANDRE CARNEIRO DA SILVA MAIA,"182,6",3,"165,0",192,192
142,152(...)22,RUI FILIPE ROCHA ALVARILHÃO,"182,5",5,"176,0",186,186
142,156(...)26,JOÃO FONTES RIBEIRO CARAPINHA,"182,5",5,"176,0",186,186
144,303(...)80,JOANA DEVESAS CARVALHAL,"182,5",4,"174,0",187,187
145,312(...)40,ANDRÉ DIOGO CAIXEIRINHO COTRIM,"182,3",6,"181,0",183,183
146,305(...)68,HELDER GONÇALO FERREIRA DE ALMEIDA E OLIVEIRA,"182,3",6,"179,0",184,184
147,307(...)99,FRANCISCO MOREIRA TROCADO,"182,2",1,"175,0",186,186
148,152(...)45,MARIANA COELHO CARDOSO,"182,2",5,"164,0",192,192
149,301(...)62,SARA ALVES GARCIA,"182,2",2,"162,0",193,193
150,155(...)46,NUNO FILIPE NUNES COSTA,"182,1",2,"171,0",188,188
151,152(...)11,BÁRBARA CATARINA CERQUEIRA VELOSO GOMES,"182,1",2,"160,0",194,194
152,156(...)92,SANTIAGO DA SILVA FERREIRA,"181,8",6,"185,0",180,180
152,306(...)43,GONÇALO COSTA PEREIRA FONSECA SANTANA,"181,8",2,"185,0",180,180
154,155(...)48,GUILHERME DUARTE ALMEIDA SANTOS,"181,7",2,"155,0",196,196
155,150(...)21,JOAQUIM MANUEL VERDELHO RIBEIRO DA SILVA GUIMARAES,"181,6",3,"179,0",183,183
156,152(...)95,BIA DE ALMEIDA PINTO,"181,5",6,"175,0",185,185
157,307(...)48,NUNO HENRIQUE FERNANDES ASCENÇÃO,"181,5",2,"173,0",186,186
158,157(...)25,CAROLINA ALVES FERREIRA,"181,5",2,"160,0",193,193
158,306(...)26,HUGO ANDRÉ AFONSO RIBEIRO,"181,5",4,"160,0",193,193
160,304(...)77,MARIANA RIBEIRO MARTINS,"181,4",1,"182,0",181,181
160,307(...)97,PEDRO ANDRÉ FREITAS MONTEIRO,"181,4",2,"182,0",181,181
162,306(...)09,CARLOS ANDRÉ BARROSO ARAÚJO,"181,3",4,"180,0",182,182
163,154(...)72,JOÃO PEDRO FERREIRA GOMES,"181,3",3,"178,0",183,183
164,150(...)37,TIAGO VICENTE RODRIGUES,"181,3",2,"165,0",190,190
164,159(...)03,TIAGO DE BARROS SIMÕES,"181,3",1,"165,0",190,190
164,305(...)10,DIOGO FILIPE TEIXEIRA DE SOUSA,"181,3",2,"165,0",190,190
167,157(...)57,EDUARDO BARBOSA FERNANDES,"181,3",2,"152,0",197,197
168,158(...)72,SANDRO EMANUEL FERREIRA DE SOUSA,"181,2",2,"189,0",177,177
169,153(...)87,TIAGO CATELAS RIBEIRO CORREIA,"181,2",2,"187,0",178,178
170,301(...)09,PEDRO MANUEL CERQUEIRA GONÇALVES,"181,2",5,"163,0",191,191
171,150(...)87,MARIO LANDIM MORAES MARQUES PEREIRA,"181,1",3,"170,0",187,187
171,152(...)32,AFONSO CERQUEIRA DE SOUSA GOMES BOUÇA,"181,1",5,"170,0",187,187
173,150(...)45,SOFIA RAQUEL FERREIRA DA COSTA,"181,1",1,"159,0",193,193
174,304(...)87,LUISA CORREIA FERNANDES,"181,0",2,"168,0",188,188
175,306(...)11,LOURENÇO COSTA MARTINS,"180,9",3,"190,0",176,176
176,303(...)24,INÊS MOREIRA DA ROCHA,"180,9",6,"188,0",177,177
177,306(...)27,HENRIQUE DA SILVA MONTEIRO,"180,9",1,"177,0",183,183
178,151(...)84,LUÍS ALEXANDRE MOREIRA SOARES,"180,9",4,"175,0",184,184
179,156(...)48,JOÃO NUNO MAURÍCIO COSTA,"180,8",2,"186,0",178,178
179,159(...)77,TOMÁS BORGES ANDRADE,"180,8",2,"186,0",178,178
181,152(...)30,MARTA MANUELA BASTOS ARAUJO,"180,8",2,"171,0",186,186
181,301(...)55,HUGO MIGUEL GOMES SILVA,"180,8",2,"171,0",186,186
183,308(...)85,RAFAEL DA SILVA PIMENTEL OLIVEIRA,"180,7",2,"169,0",187,187
184,151(...)83,ANA SOFIA VENTURA NOGUEIRA,"180,6",2,"178,0",182,182
185,152(...)87,JOÃO RODRIGUES ALBERTON JÚNIOR,"180,6",3,"176,0",183,183
186,306(...)36,PEDRO MIGUEL GONÇALVES PEREIRA,"180,4",4,"181,0",180,180
187,151(...)24,ANA FRANCISCA FONTES PACHECO,"180,4",2,"170,0",186,186
187,310(...)42,DIOGO PACHECO RODRIGUES,"180,4",3,"170,0",186,186
189,310(...)43,JOSÉ AUGUSTO PEREIRA MOGRÃO TEIXEIRA,"180,4",4,"168,0",187,187
189,312(...)69,HUGO MIGUEL QUEIRÓS NOGUEIRA,"180,4",2,"168,0",187,187
191,307(...)08,DANIEL ANDRÉ FREITAS DUARTE SILVA,"180,3",1,"190,0",175,175
192,157(...)67,TIAGO HENRIQUE OLIVEIRA RIBEIRO,"180,3",2,"179,0",181,181
193,155(...)12,MAFALDA CASTRO ALMEIDA DA COSTA SARAIVA,"180,3",5,"166,0",188,188
194,307(...)26,JOÃO MIGUEL LOPES,"180,2",3,"175,0",183,183
195,159(...)85,TIAGO VASQUES MOREIRA,"180,2",2,"173,0",184,184
196,315(...)72,JOÃO RODRIGUES VILA COVA,"180,1",3,"171,0",185,185
197,153(...)61,LEONOR SILVA BIDARRA,"180,1",3,"169,0",186,186
198,153(...)46,DANIELA BAPTISTA AZEVEDO,"180,1",4,"158,0",192,192
199,151(...)65,HUGO ALEXANDRE LOPES DA SILVA,"180,0",2,"178,0",181,181
200,305(...)84,FILIPE NETO LEÃO,"179,8",3,"185,0",177,177
200,307(...)87,ANTÓNIO PEDRO ALVES PAIS,"179,8",2,"185,0",177,177
202,155(...)70,TIAGO MIGUEL MOREIRA SILVA,"179,8",1,"170,0",185,185
202,156(...)02,GUSTAVO LUÍS ALMEIDA GERAÇO LOURENÇO,"179,8",2,"170,0",185,185
202,158(...)67,BRUNA ALVES SILVA,"179,8",6,"170,0",185,185
205,301(...)22,RÚBEN ALEXANDRE MAGALHÃES AMERICANO,"179,8",2,"159,0",191,191
206,155(...)54,LUIS MIGUEL NEVES COSTA BARROS,"179,7",2,"168,0",186,186
207,307(...)19,GUILHERME MIRRA DE CARVALHO,"179,6",5,"190,0",174,174
208,300(...)38,JOÃO HENRIQUE TEIXEIRA DA SILVA,"179,6",2,"175,0",182,182
209,311(...)62,ANA FRANCISCA LIMA BORGES,"179,5",1,"158,0",191,191
210,151(...)87,HENRIQUE ANDRADE CRAVEIRO FERREIRA,"179,3",1,"176,0",181,181
211,159(...)25,DANIELA OSÓRIO SCOPPIE FORBES BESSA,"179,3",3,"163,0",188,188
212,304(...)22,CRISTIANO MOREIRA CONSTANTE,"179,2",2,"185,0",176,176
213,301(...)64,CAROLINA GONÇALVES MIRRA,"179,1",5,"157,0",191,191
214,148(...)67,LEONOR GONÇALVES OLIVEIRA GOMES,"179,1",1,"155,0",192,192
215,151(...)10,AFONSO MIGUEL ALMEIDA PEREIRA,"179,0",5,"177,0",180,180
215,306(...)20,LUIS ALBERTO MIRANDA CARNEIRO,"179,0",3,"177,0",180,180
215,307(...)08,RAFAEL DE MATOS LOURENÇO LOBÃO,"179,0",3,"177,0",180,180
218,155(...)32,GONÇALO MONTEIRO DA FONSECA,"179,0",4,"164,0",187,187
219,157(...)76,PEDRO ANDRÉ SANTANA RIBAS PINTO,"178,9",2,"175,0",181,181
220,303(...)30,FRANCISCO AMARAL DA CRUZ AMARO,"178,9",4,"162,0",188,188
221,315(...)46,CATARINA RODRIGUES FERNANDES,"178,8",3,"182,0",177,177
222,306(...)67,DIANA SOFIA NEVES MAGRO,"178,8",2,"158,0",190,190
222,309(...)11,JOANA SILVA LEITE RESENDE,"178,8",2,"158,0",190,190
224,150(...)25,TOMÁS MANUEL MAIA DE SOUSA FERREIRA,"178,7",4,"191,0",172,172
225,152(...)08,RAFAEL ESTEVES FERREIRA,"178,6",2,"176,0",180,180
226,306(...)58,MIGUEL GOMES MENA,"178,5",2,"185,0",175,175
227,157(...)64,SIMÃO PEDRO SILVA BARBOSA,"178,5",2,"170,0",183,183
227,308(...)18,DINIS FALEIRO BAHIA CABRAL LIMA,"178,5",3,"170,0",183,183
229,159(...)55,GONÇALO QUEIRÓS COSTA,"178,4",2,"179,0",178,178
230,302(...)16,ANA CATARINA MONTEIRO DE SOUSA,"178,3",2,"175,0",180,180
231,230(...)02,ZHANG YIFAN,"178,2",3,"173,0",181,181
231,314(...)92,FILIPE MIGUEL NETO VISEU,"178,2",2,"173,0",181,181
233,302(...)70,JOÃO MIGUEL PEREIRA DE OLIVEIRA,"178,1",5,"182,0",176,176
233,307(...)93,CARLOS LISBOA CRISTELO,"178,1",3,"182,0",176,176
235,302(...)61,TOMÁS ANDRÉ MANO GANDARELA,"178,1",1,"180,0",177,177
236,312(...)74,BERNARDO PIRES FRIÕES,"178,1",2,"167,0",184,184
237,155(...)59,GUILHERME DA SILVA MOURA,"178,0",6,"191,0",171,171
237,156(...)33,SALVADOR FERNANDES DE AZEVEDO DOS SANTOS CARVALHO,"178,0",3,"191,0",171,171
239,310(...)07,TIAGO DANIEL ALVES COSTA,"178,0",1,"178,0",178,178
240,150(...)33,CÁTIA MARIA MORAIS LOPES,"178,0",4,"165,0",185,185
241,306(...)08,TIAGO JOSÉ FERREIRA FONTES,"178,0",1,"163,0",186,186
241,307(...)91,TOMÁS PEREIRA DA SILVA,"178,0",3,"163,0",186,186
243,151(...)65,GONÇALO TAVARES PINHO MENDES CALVO,"177,8",2,"183,0",175,175
244,307(...)80,NUNO GONÇALO FERREIRA OLIVEIRA,"177,8",5,"170,0",182,182
244,314(...)82,JOSÉ LUÍS DE OLIVEIRA RIBEIRO,"177,8",1,"170,0",182,182
246,307(...)06,JOAO PEDRO MAGALHAES MARQUES,"177,8",3,"168,0",183,183
247,314(...)26,LAURA EUGÉNIA RODRIGUES SANTOS CASTRO VIDEIRA,"177,8",2,"155,0",190,190
248,153(...)99,JOAO DINIS BRANDÃO CARDOSO DE BÁRRIOS CASTRO,"177,7",5,"177,0",178,178
249,306(...)58,TOMÁS SÁ COUTO PINTO MOREIRA,"177,6",1,"175,0",179,179
250,148(...)41,ORLANDO MIGUEL CARVALHO-SOARES,"177,6",5,"162,0",186,186
251,159(...)99,JOÃO OLIVEIRA QUARESMA,"177,5",3,"182,0",175,175
252,303(...)79,PEDRO MIGUEL COSTA MARQUES,"177,5",6,"171,0",181,181
253,308(...)32,LETICIA DA COSTA RODRIGUES,"177,5",6,"169,0",182,182
254,154(...)55,ANA BEATRIZ CASTRO SANTOS,"177,2",5,"157,0",188,188
255,151(...)26,FILIPE SILVA PINTO LOPES,"177,1",5,"181,0",175,175
256,150(...)52,LOURENÇO CIRAVEGNA FONSECA BARROTE,"177,1",3,"179,0",176,176
256,300(...)11,MIGUEL SÃO JOÃO ROQUE,"177,1",2,"179,0",176,176
258,155(...)82,JOAO MARCOS VALLER MOREIRA,"177,0",2,"190,0",170,170
259,306(...)59,RICARDO MIGUEL CORREIA DAS NEVES,"177,0",3,"177,0",177,177
260,153(...)88,PAULO SÉRGIO DA SILVA SAAVEDRA,"177,0",2,"162,0",185,185
261,317(...)82,AMANDA BRITO JAPIASSU,"176,9",3,"173,0",179,179
262,149(...)12,GONÇALO SARABANDA NEVES LOUREIRO,"176,9",1,"171,0",180,180
262,153(...)61,KHUSHAN CALPESO MAUGI,"176,9",5,"171,0",180,180
264,135(...)77,ANDRÉ ALEXANDRE MAGALHÃES AZEVEDO,"176,8",1,"169,0",181,181
264,302(...)34,MARTIM SÃO ROQUE CADILHE,"176,8",5,"169,0",181,181
264,306(...)17,HUGO ARAÚJO CUNHA,"176,8",4,"169,0",181,181
267,152(...)68,VASCO NUNO PINHAL FERREIRA ALVES,"176,5",2,"168,0",181,181
267,310(...)60,DUARTE GABRIEL CASTRO BRANCO,"176,5",3,"168,0",181,181
269,308(...)47,LUÍSA DO NASCIMENTO PINHEIRO GONÇALVES,"176,5",6,"155,0",188,188
270,154(...)78,FRANCISCO MIGUEL CORREIA MALOJO,"176,4",3,"177,0",176,176
270,314(...)79,JOÃO TOMÁS MENDES FERREIRA,"176,4",4,"177,0",176,176
272,312(...)33,CATARINA MENDES RIBEIRO,"176,4",3,"166,0",182,182
273,314(...)72,DIOGO SOUSA CAMPEÃO,"176,3",3,"173,0",178,178
274,300(...)79,DIOGO FILIPE BRANCO DE ALMEIDA CAMPOS,"176,3",2,"160,0",185,185
275,303(...)43,GONÇALO DA CRUZ MARTINS,"176,2",3,"182,0",173,173
276,304(...)09,HELENA BARREIRA MOUTINHO,"176,1",3,"178,0",175,175
277,159(...)12,TIAGO SOUSA OLIVEIRA,"176,0",2,"176,0",176,176
278,306(...)92,FRANCISCO LOPES RIBEIRO,"176,0",1,"163,0",183,183
279,306(...)91,MARIA FRANCISCA GONÇALVES PÓVOAS BRANCO,"176,0",2,"161,0",184,184
280,306(...)40,JOÃO RODRIGO DE ALMEIDA MARQUES,"176,0",4,"150,0",190,190
281,154(...)82,HENRIQUE DA COSTA ALVES,"175,9",1,"185,0",171,171
282,309(...)79,INÊS SANTOS SILVA,"175,9",5,"172,0",178,178
283,307(...)13,RUI RAFAEL PINHEIRO CORDEIRO,"175,8",2,"179,0",174,174
284,303(...)14,RICARDO ALEXANDRE RIBEIRO FERNANDES,"175,8",3,"155,0",187,187
285,154(...)10,BRUNO RODRIGUES NEIVA,"175,7",4,"175,0",176,176
285,308(...)03,MARIA FRANCISCA DE BRITO LIMA MAGALHÃES PAULOS,"175,7",1,"175,0",176,176
287,314(...)49,MARIA REGINA VIEIRA SILVA,"175,7",1,"164,0",182,182
288,312(...)92,JOSÉ ALVES MOREIRA,"175,7",4,"149,0",190,190
289,306(...)44,ADRIANA FERNANDES MEIRA,"175,6",2,"173,0",177,177
290,154(...)21,MARIA EDUARDA SILVA GOMES,"175,6",6,"147,0",191,191
291,150(...)09,LUÍS MIGUEL CAMPOS CARVALHO,"175,6",1,"145,0",192,192
292,307(...)50,BERNARDO GONÇALVES CARDOSO,"175,5",1,"156,0",186,186
293,310(...)52,RICARDO MANUEL MACEDO MEIRELES,"175,4",1,"189,0",168,168
294,309(...)78,PAULO DIOGO DIAS MOURATO,"175,3",2,"146,0",191,191
295,307(...)72,JOÃO MIGUEL MORGADO ALMEIDA,"174,9",2,"171,0",177,177
296,156(...)37,AFONSO DELCA ARAÚJO,"174,9",5,"169,0",178,178
297,158(...)36,FRANCISCO MANUEL REIS DOMINGOS ROCHA,"174,9",3,"156,0",185,185
298,304(...)56,JOSÉ MIGUEL FERNANDES CAÇÃO,"174,8",4,"178,0",173,173
299,303(...)91,CATARINA PEREIRA DE FREITAS LIMA,"174,7",2,"176,0",174,174
300,304(...)88,GABRIELA MORAIS RIBEIRO ESCALHÃO TEIXEIRA,"174,7",2,"150,0",188,188
301,154(...)37,JOÃO DE SOUSA MACHADO BATISTA RAMOS,"174,6",4,"170,0",177,177
302,308(...)94,RODRIGO JORGE DO REGO ROCHA,"174,5",2,"168,0",178,178
303,153(...)94,MARTA CONTENTE ALMEIDA,"174,4",4,"175,0",174,174
303,301(...)41,GABRIELA DIONÍSIA VIEIRA MARINHAS BASTOS VALENTE,"174,4",2,"175,0",174,174
305,157(...)70,ANA SOFIA COSTA CARVALHO,"174,4",5,"151,0",187,187
306,158(...)66,PEDRO MIGUEL MALHÃO DE MEIRELES,"174,3",2,"173,0",175,175
307,306(...)33,JOÃO MIL-HOMENS JORGE,"174,3",1,"171,0",176,176
308,309(...)28,PEDRO DINIS MACHADO ARAÚJO,"174,1",2,"178,0",172,172
309,151(...)65,RUI PEDRO CONSTANTE PINHEIRO,"174,1",4,"163,0",180,180
309,153(...)98,JOSÉ MIGUEL FERREIRA ARCHER,"174,1",4,"163,0",180,180
311,150(...)68,JOANA MARIA TATO COUTINHO PINHO BALDAIA,"174,1",3,"150,0",187,187
312,310(...)66,GONÇALO COPEK BRAGA RODRIGUES,"174,0",2,"161,0",181,181
313,303(...)07,DINIS MIGUEL SAMPAIO ARAÚJO DOS SANTOS SOUSA,"173,9",3,"181,0",170,170
314,309(...)16,NUNO MIGUEL FERREIRA MARTINS,"173,8",2,"192,0",164,164
315,150(...)74,GUSTAVO LUIS GOMMANS AGUIAR TEIXEIRA,"173,8",2,"177,0",172,172
316,306(...)08,GUILHERME GUIMARAES ARAUJO VIDAL,"173,8",3,"166,0",178,178
317,306(...)64,RAFAEL LUÍS ARAÚJO MAIA,"173,7",1,"175,0",173,173
318,304(...)67,NUNO GIL DE MAGALHÃES BALDAIA MENDES,"173,7",4,"173,0",174,174
319,151(...)14,MARIA FRANCISCA OLIVEIRA NUNES,"173,7",3,"160,0",181,181
319,301(...)04,BERNARDO SANTOS SILVA MEDEIROS,"173,7",5,"160,0",181,181
321,151(...)72,GIL DA SILVA COSTA AFONSO,"173,5",3,"167,0",177,177
322,157(...)55,FRANCISCA ALVES FERREIRA,"173,5",4,"152,0",185,185
323,316(...)42,MARIA DE FÁTIMA MARTINS DE CASTRO,"173,5",6,"139,0",192,192
324,303(...)48,JOÃO TOMÁS MACIEL SOUSA,"173,4",3,"189,0",165,165
325,316(...)44,DIOGO ANDRÉ FERREIRA DA COSTA,"173,4",2,"187,0",166,166
326,303(...)33,BRUNO MIGUEL PEREIRA TEIXEIRA,"173,4",2,"161,0",180,180
326,309(...)02,FRANCISCO AZEVEDO FARIA,"173,4",1,"161,0",180,180
328,150(...)56,JOÃO PEDRO PACHECO SEIXAS,"173,4",4,"150,0",186,186
329,307(...)13,GUILHERME MARTIM DE ALMEIDA E SOUSA ALVES FERREIRA,"173,4",1,"148,0",187,187
329,309(...)31,JOANA FILIPA ALMEIDA DE SÁ,"173,4",1,"148,0",187,187
331,151(...)50,RICARDO AFONSO DA SILVA BASTOS SOARES,"173,3",1,"172,0",174,174
331,153(...)22,MARIANA DA SILVA SOUSA,"173,3",1,"172,0",174,174
333,157(...)18,JOÃO MATOS DE CARVALHO,"173,2",5,"192,0",163,163
334,309(...)54,GONÇALO OLIVEIRA DA SILVA,"173,2",4,"168,0",176,176
335,305(...)55,FRANCISCO COUTINHO DE PINHO,"173,2",2,"166,0",177,177
336,150(...)38,MAFALDA CASTRO MELRO,"173,2",2,"153,0",184,184
337,307(...)00,RODRIGO SA COSTA,"173,1",2,"190,0",164,164
338,159(...)63,JOÃO MIGUEL LOPES RIBEIRO,"173,1",1,"177,0",171,171
339,306(...)19,JORGE UBALDO RODRIGUES FERREIRA,"173,1",1,"164,0",178,178
340,156(...)43,MARTA ALEXANDRA PATRÃO MARANHÃO,"173,0",2,"171,0",174,174
340,312(...)42,HUGO MIGUEL TEIXEIRA SILVA,"173,0",2,"171,0",174,174
342,156(...)63,RUI PINA RIBEIRO,"173,0",2,"160,0",180,180
342,305(...)81,JOÃO ALEXANDRE SANTOS PEIXINHO CHAMINÉ,"173,0",4,"160,0",180,180
344,301(...)44,CATARINA MAGNA RODRIGUES OLIVEIRA,"173,0",3,"145,0",188,188
344,313(...)12,SALOMÉ SILVA OLIVEIRA,"173,0",4,"145,0",188,188
346,301(...)57,GONÇALO MANUEL DE OLIVEIRA PIMENTA,"172,9",1,"169,0",175,175
347,304(...)30,AFONSO AGUIAR DE CARVALHO DA SILVA PEREIRA,"172,9",3,"156,0",182,182
348,150(...)70,MIGUEL SÁ DE MIRANDA,"172,8",1,"163,0",178,178
349,156(...)41,RUI FILIPE COUTINHO MENDES,"172,8",3,"150,0",185,185
350,300(...)16,ALEXANDRE MARQUES DIAS DE SOUSA,"172,8",3,"137,0",192,192
351,152(...)31,MARIANA ARAÚJO MOREIRA,"172,7",1,"185,0",166,166
352,156(...)22,DIOGO MIGUEL MONTEIRO PEREIRA,"172,7",2,"159,0",180,180
352,304(...)10,ANDRÉ GABRIEL PATRÃO CUNHA,"172,7",6,"159,0",180,180
354,151(...)32,MATILDE OLIVEIRA SILVA,"172,7",2,"135,0",193,193
355,307(...)20,BERNARDO PAIVA DO NOVO GRANJA CARDOSO,"172,6",1,"157,0",181,181
356,150(...)27,AMÍLCAR FERNANDO CARVALHO MIRANDA,"172,5",2,"177,0",170,170
357,150(...)06,HENRIQUE PERRY SAMPAIO AFONSO SIMONELLA,"172,5",3,"166,0",176,176
357,153(...)91,MARIANA LEITE BRAZÃO GAMBOA,"172,5",1,"166,0",176,176
357,157(...)88,TOMÁS AZEVEDO GONÇALVES,"172,5",1,"166,0",176,176
357,306(...)37,DANIEL AMORIM TIAGO,"172,5",2,"166,0",176,176
361,150(...)05,MÁRCIO SAMUEL VIEIRA FERREIRA,"172,5",2,"151,0",184,184
362,300(...)03,FRANCISCO QUINTAS BARROS,"172,4",2,"186,0",165,165
363,156(...)11,DIOGO MANUEL GIÃO GUEDES,"172,4",3,"173,0",172,172
364,151(...)76,MARIA CAROLINA MONTEIRO SILVA,"172,4",4,"162,0",178,178
364,315(...)03,RICARDO ANDRÉ TOMÉ MORIM,"172,4",2,"162,0",178,178
366,301(...)77,FRANCISCO PAULO DE FIGUEIREDO MOFREITA GAMA DOS SANTOS,"172,4",1,"147,0",186,186
367,301(...)17,ANA JORGE FERREIRA LEAL,"172,4",4,"136,0",192,192
368,319(...)64,FELIPPE BASTASINI DE AZEVEDO,"172,3",1,"171,0",173,173
369,151(...)95,MIGUEL MOREIRA PAIS,"172,2",2,"167,0",175,175
