Order Number,Parcial Identification Number,Name,Applicant Grade,Option Number,Entrance Test Grade,12th year grade,Average of 11th and 10th grades
1,306(...)09,AFONSO FREIRE VERMELHO,"177,2",1,"198,0",166,166
2,308(...)03,MARIA FRANCISCA DE BRITO LIMA MAGALHÃES PAULOS,"175,7",3,"175,0",176,176
3,315(...)53,RODRIGO MIGUEL CARVALHO RODRIGUES,"170,3",2,"167,0",172,172
4,305(...)43,PEDRO MIGUEL PIRES SARAIVA,"170,3",4,"156,0",178,178
5,300(...)88,AFONSO ESPINHA DAS NEVES MONTEIRO MARTINS,"169,2",3,"190,0",158,158
6,312(...)41,CATARINA MONTEIRO RABAÇA,"168,4",6,"158,0",174,174
7,306(...)36,DUARTE MARTIM MINAS MATIAS,"166,8",6,"170,0",165,165
7,306(...)90,FRANCISCO CARVALHO GOUVEIA,"166,8",5,"170,0",165,165
9,154(...)57,IGOR MIGUEL TORRES DA COSTA,"166,6",6,"162,0",169,169
10,303(...)39,DIOGO GALVÃO AGUIAR,"164,1",1,"155,0",169,169
11,305(...)36,GONÇALO DE MATOS PEREIRA,"163,3",4,"149,0",171,171
12,149(...)60,RENATO ALMEIDA DA SILVA,"157,1",2,"148,0",162,162
13,302(...)78,DIOGO DA COSTA SANTOS,"156,9",5,"125,0",174,174
14,306(...)83,MARTIM FREIRE VERMELHO,"156,8",1,"160,0",155,155
15,152(...)09,ANDRÉ HENRIQUES DIAS,"155,6",4,"127,0",171,171
16,303(...)34,DIOGO PAULO VENTURA RODRIGUES AUGUSTO CAÇADOR,"154,5",2,"135,0",165,165
17,303(...)61,LEONARDO MIGUEL DIAS DOS SANTOS,"154,5",5,"96,0",186,186
18,306(...)54,GUILHERME SARAIVA DA SILVA,"152,6",3,"148,0",155,155
19,154(...)05,MAURÍCIO GABRIEL BRANDÃO SARDINHA,"152,5",6,"107,0",177,177
20,306(...)31,BRUNO MIGUEL MARQUES FERREIRA,"152,3",2,"125,0",167,167
21,305(...)32,RODRIGO TALHAS OLAS FONSECA DA SILVA,"152,2",6,"106,0",177,177
22,304(...)46,SIMÃO PAIS ALMEIDA,"151,0",3,"125,0",165,165
23,311(...)03,MAFALDA MARIA AMORIM TEIXEIRA,"151,0",5,"110,0",173,173
24,306(...)99,XAVIER DUARTE BRITES,"150,1",3,"128,0",162,162
25,153(...)37,RITA BARREIROS DOS REIS,"149,8",6,"116,0",168,168
26,153(...)65,SALOMÃO PEREIRA MARTINS,"147,0",6,"121,0",161,161
27,300(...)62,AFONSO ALMEIRÃO LOPES,"147,0",3,"106,0",169,169
28,303(...)43,GABRIEL FILIPE FIGUEIREDO SOARES,"145,5",2,"165,0",135,135
29,153(...)02,ALEXANDRE CORREIA DA SILVA,"145,3",6,"105,0",167,167
30,303(...)08,DUARTE JUNQUEIRA MENDES PEREIRA,"145,2",6,"99,0",170,170
31,310(...)08,RODRIGO MORGADO ALEXANDRE,"144,6",3,"153,0",140,140
32,303(...)50,GONÇALO MANUEL SARDINHA SERRA,"144,1",6,"109,0",163,163
33,154(...)09,TIAGO NEVES FIGUEIREDO,"144,1",4,"96,0",170,170
34,313(...)62,LUCAS ALFREDO MARQUES PINTO,"143,9",4,"138,0",147,147
35,305(...)25,CARLOS ALBERTO MOREIRA BARBOSA,"143,1",5,"121,0",155,155
36,308(...)79,ROMEU SANTOS PINTO,"143,1",5,"108,0",162,162
37,310(...)49,RODRIGO ALEXANDRE COSTA OLIVEIRA,"142,9",3,"98,0",167,167
38,305(...)79,ANA LEONOR FIGUEIREDO ALMEIDA,"142,7",2,"116,0",157,157
39,303(...)25,ALEXANDRE DE MATOS PATINHO SOARES,"142,6",3,"140,0",144,144
40,147(...)41,DANIEL FILIPE FERREIRA PAULO,"142,6",4,"125,0",152,152
41,300(...)87,RÚBEN FILIPE NUNES FARINHA,"142,3",2,"178,0",123,123
42,307(...)98,LUCAS DUARTE AMARAL DOS SANTOS,"142,3",4,"126,0",151,151
43,305(...)16,DANIEL FILIPE AGOSTINHO BRANCO,"142,1",6,"120,0",154,154
44,306(...)45,MATILDE PINTO SEQUEIRA,"141,9",5,"125,0",151,151
45,315(...)11,LEANDRO ROCHA DA COSTA,"141,0",6,"102,0",162,162
46,307(...)16,ALEXANDRE MARQUES ANDRADE,"140,8",2,"105,0",160,160
47,157(...)76,MARTIM GAMANHO ANTUNES ESTEVES DE CARVALHO,"139,8",4,"130,0",145,145
48,147(...)60,JOÃO PEDRO MARIA MANÉ,"139,7",4,"165,0",126,126
49,152(...)09,TIAGO FILIPE DE ALMEIDA RODRIGUES,"139,2",6,"119,0",150,150
50,152(...)16,MIGUEL RODRIGUES GONÇALVES,"139,0",5,"137,0",140,140
51,303(...)29,JOÃO DIONISIO SANTOS RITA,"138,2",3,"118,0",149,149
52,300(...)95,TOMÁS MELO DA MOTA,"137,9",6,"106,0",155,155
53,300(...)79,DANIEL LOPES DE ALMEIDA,"137,8",6,"115,0",150,150
54,301(...)98,EDGAR GRANJO LERCAS,"137,7",3,"126,0",144,144
55,158(...)05,TOMÁS AFONSO GONÇALVES,"137,6",2,"96,0",160,160
56,306(...)89,GONÇALO MIGUEL GONÇALVES DA SILVA,"136,8",2,"129,0",141,141
57,159(...)51,FRANCISCO JOSÉ COSTA LOUREIRO,"136,0",3,"134,0",137,137
58,300(...)55,HUGO ALEXANDRE COSTA PEREIRA,"135,8",1,"115,0",147,147
59,308(...)91,ALEXANDRE BENOLIEL CABRAL,"135,4",5,"110,0",149,149
60,301(...)10,TOMÁS DE ALMEIDA PINHEIRO MORGADO MOREIRA,"135,0",6,"122,0",142,142
61,301(...)09,RÚBEN MARQUES RODRIGUES,"134,8",4,"99,0",154,154
62,157(...)36,BEATRIZ SERRA ANTUNES,"134,4",6,"98,0",154,154
63,304(...)66,RODRIGO DE OLIVEIRA LOPES,"134,1",5,"136,0",133,133
64,150(...)27,GONÇALO FILIPE CUNHA ALMEIDA,"133,9",5,"130,0",136,136
65,301(...)72,FÁBIO ANDRÉ BIDARRA HORTA,"133,7",2,"122,0",140,140
66,300(...)72,DIOGO MARQUES MORAIS,"132,6",3,"115,0",142,142
67,301(...)64,GABRIEL LOPES DOS SANTOS,"132,1",6,"95,0",152,152
68,305(...)99,RAFAEL AMARAL RODRIGUES,"131,7",4,"105,0",146,146
69,310(...)59,DIOGO ALEXANDRE MOITA BATISTA,"131,5",2,"125,0",135,135
70,156(...)92,RAFAEL ALEXANDRE VICENTE LOPES,"131,4",3,"108,0",144,144
71,159(...)15,PAULO ANDRÉ LOPES APARÍCIO,"131,0",5,"118,0",138,138
72,314(...)30,RUBEN SIMÕES CARVALHO,"130,8",4,"95,0",150,150
73,310(...)48,BEATRIZ SILVA MATIAS,"130,6",2,"100,0",147,147
74,304(...)77,JOÃO PEDRO DA SILVA LIMA,"130,4",5,"107,0",143,143
75,305(...)08,JORGE DANIEL PEREIRA ROCHA,"130,2",3,"97,0",148,148
76,149(...)84,DANIEL FILIPE REI LOPES,"130,1",4,"119,0",136,136
77,145(...)73,NELSON DANIEL DE SOUSA FREITAS,"129,8",6,"109,0",141,141
78,304(...)87,FRANCISCA SENA MONTEIRO,"129,7",5,"116,0",137,137
79,303(...)96,RICARDO DO VALE CARDOSO,"129,4",6,"119,0",135,135
80,150(...)90,AFONSO FRANCISCO ALMEIDA MELO RODRIGUES,"129,2",3,"109,0",140,140
81,314(...)37,CAROLINA VICENTE SIMÕES,"129,2",6,"96,0",147,147
82,315(...)88,RAFAEL RIBEIRO JÚLIO,"129,1",4,"105,0",142,142
83,157(...)11,TIAGO RAFAEL SILVA VALENTE,"129,0",3,"103,0",143,143
84,306(...)17,JOSÉ PEDRO SILVA COSTA,"128,4",6,"116,0",135,135
85,306(...)29,RODRIGO JOSÉ BRÁS RODRIGUES,"127,5",5,"121,0",131,131
86,302(...)78,RAGNER JOSÉ SAGRADAS TOVAR,"127,5",3,"106,0",139,139
87,308(...)29,BEATRIZ SOFIA ALMEIDA SANTOS,"126,9",3,"95,0",144,144
88,306(...)72,GABRIEL SARAIVA DA SILVA,"126,6",2,"96,0",143,143
89,151(...)49,DIOGO VIDEIRA CARDOSO,"126,5",1,"107,0",137,137
90,301(...)97,DIOGO SILVA GOMES,"126,2",2,"108,0",136,136
91,156(...)34,RAFAEL DIOGO DA ROCHA SOARES VICENTE,"126,0",4,"113,0",133,133
92,306(...)23,ANTÓNIO GUILHERME RODRIGUES BALULA,"125,9",5,"96,0",142,142
93,308(...)07,RICARDO ANDRÉ DA QUINTA MACEDO,"125,8",4,"105,0",137,137
94,155(...)44,PEDRO TEIXEIRA MONTEIRO,"125,6",1,"95,0",142,142
95,302(...)62,RICARDO MANUEL LOURENÇO FIGUEIREDO,"125,2",5,"105,0",136,136
96,154(...)64,MARTIM TIAGO TEIXEIRA LAMEIRO,"124,4",6,"99,0",138,138
96,305(...)35,RODRIGO SENA PEREIRA,"124,4",6,"99,0",138,138
98,313(...)69,MIGUEL AFONSO DO ROSÁRIO E ARAÚJO,"124,1",6,"102,0",136,136
99,303(...)44,MARTIM MARQUES NORONHA,"123,2",5,"105,0",133,133
100,301(...)93,TIAGO AFONSO CONSTÂNCIO MAIO,"123,1",6,"99,0",136,136
101,312(...)53,MARIA SILVA DE CARVALHO,"123,0",2,"95,0",138,138
102,158(...)18,FRANCISCO JOSE MONTEIRO DE ALMEIDA,"122,9",2,"106,0",132,132
103,309(...)26,DIOGO RAFAEL CUNHA CERQUEIRA,"122,2",3,"117,0",125,125
104,151(...)68,DAVID NASCIMENTO MENDES,"122,2",3,"102,0",133,133
105,310(...)50,TIAGO FILIPE SANTOS MARTINS,"120,8",6,"100,0",132,132
106,153(...)15,LUÍS MIGUEL ALMEIDA CÂMARA,"120,7",6,"109,0",127,127
107,304(...)59,MARTIM MONTEIRO OLIVEIRA DUARTE,"120,2",6,"100,0",131,131
108,311(...)38,ANTÓNIO ALEXANDRE BORGES FERREIRA CASTANHEIRA MARQUES,"118,5",2,"97,0",130,130
109,307(...)80,ANDRÉ AUGUSTO MELO CARREIRA,"117,8",1,"95,0",130,130
110,306(...)70,PEDRO MIGUEL FERREIRA VAZ,"116,7",5,"105,0",123,123
111,307(...)87,TIAGO CARDOSO TAVARES,"116,3",4,"102,0",124,124
112,230(...)36,RODRIGO PORCHAT CURY,"116,0",4,"101,0",124,124
113,305(...)16,FRANCISCO FIGUEIREDO LOPES,"115,8",3,"95,0",127,127
114,150(...)35,FÁBIO NUNO DOS SANTOS MESTRE DIONÍSIO,"114,6",4,"110,0",117,117
115,301(...)18,NUNO ANTÓNIO SIMÕES ABRUNHEIRO,"109,1",4,"100,0",114,114
116,303(...)14,GUSTAVO JORGE ALVES COUTO,"108,4",3,"96,0",115,115
