370,151(...)46,MATILDE DA SILVA E OLIVEIRA VALENTE,"172,2",3,"128,0",196,196
371,153(...)25,PEDRO HENRIQUE CARRIÇO PEREIRA,"172,1",1,"176,0",170,170
371,310(...)61,JOÃO CARLOS CARDOSO CRUZ,"172,1",1,"176,0",170,170
373,149(...)21,MARTIM DE CARVALHO DIAS,"172,1",2,"161,0",178,178
374,305(...)40,JOSÉ PEDRO BARROS DO COUTO,"172,1",1,"150,0",184,184
375,300(...)63,RAFAEL FILIPE VIEGAS BARBOSA,"172,1",1,"148,0",185,185
376,159(...)28,JOÃO TIAGO FERRAZ MONTEIRO,"172,0",1,"185,0",165,165
377,150(...)45,RUI ANTÓNIO SILVA BICHO,"172,0",2,"170,0",173,173
378,155(...)54,JOÃO MIGUEL GOMES PEREIRA FONTES,"172,0",1,"157,0",180,180
378,302(...)75,RITA ROCHA TAVARES,"172,0",1,"157,0",180,180
380,159(...)16,RUI ALBERTO RAMOS LAPA,"171,8",1,"175,0",170,170
381,321(...)29,MÁRCIO EDUARDO DE ALMEIDA LOURENÇO,"171,7",5,"186,0",164,164
382,230(...)06,EMANUEL DA SILVA ALMEIDA,"171,6",1,"167,0",174,174
382,304(...)08,MARTIM NUNES CASTRO DE SOUSA,"171,6",1,"167,0",174,174
382,309(...)80,TIAGO ALEXANDRE CRISTÓVÃO DA SILVA,"171,6",2,"167,0",174,174
385,153(...)85,MARIA CATARINA FREITAS CAMANHO,"171,6",4,"154,0",181,181
386,304(...)14,JOÃO PAULO OLIVEIRA TAVARES VIEIRA,"171,5",1,"139,0",189,189
387,157(...)87,MARIANA CATARINA DE QUINA SARMENTO,"171,4",4,"161,0",177,177
387,308(...)57,BRUNO MIGUEL OLIVEIRA PEREIRA,"171,4",1,"161,0",177,177
387,312(...)44,GONÇALO RICARDO PEREIRA TAVARES,"171,4",3,"161,0",177,177
390,306(...)83,PEDRO RAFAEL BESSA GOMES,"171,4",5,"148,0",184,184
391,151(...)66,TIAGO PINTO SOARES,"171,3",1,"170,0",172,172
391,303(...)86,RODRIGO SOARES CARNEIRO BARBOSA,"171,3",1,"170,0",172,172
393,306(...)99,EDUARDO NOVO ARAÚJO,"171,3",3,"168,0",173,173
394,152(...)02,DIOGO SANTOS CORREIA,"171,3",1,"155,0",180,180
395,307(...)93,DAVID GONÇALVES COSTA,"171,3",1,"142,0",187,187
396,152(...)89,BRUNO GRANJA MAIA,"171,2",4,"151,0",182,182
397,307(...)72,MAFALDA OLIVEIRA MOREIRA,"171,1",2,"160,0",177,177
398,153(...)25,GONÇALO PEREIRA DIAS,"171,1",6,"147,0",184,184
399,300(...)01,TIAGO FILIPE AZEVEDO TEIXEIRA,"171,0",6,"169,0",172,172
400,303(...)98,AFONSO SAMUEL SOARES DE MELO,"171,0",2,"145,0",185,185
400,312(...)27,FRANCISCO BARRADAS LEMOS LOUSADA,"171,0",1,"145,0",185,185
402,154(...)25,DIOGO ANDRADE FERREIRA,"171,0",3,"143,0",186,186
403,159(...)10,JOÃO PEDRO CARNEIRO SILVA,"170,9",1,"178,0",167,167
404,151(...)58,RITA ALMEIDA OLIVEIRA,"170,9",5,"167,0",173,173
404,314(...)19,DIOGO MIGUEL SILVA GONÇALVES,"170,9",2,"167,0",173,173
406,230(...)01,CARLOS ALBERTO MORENO ORTEGA,"170,9",4,"165,0",174,174
406,230(...)04,DANYLO STOTSKYY,"170,9",6,"165,0",174,174
408,152(...)06,GUILHERME OLIVEIRA ABRANTES,"170,9",1,"152,0",181,181
409,304(...)45,GONÇALO FILIPE ISIDORO AREIAS,"170,9",1,"141,0",187,187
410,303(...)83,AFONSO MIGUEL CARVALHO DE JESUS QUARTAS,"170,8",2,"189,0",161,161
411,153(...)91,MARCO DANIEL PRESA LIMA,"170,8",1,"148,0",183,183
411,306(...)05,TIAGO LIMA BAPTISTA SOUSA,"170,8",2,"148,0",183,183
413,149(...)17,ANA BEATRIZ SOUSA PINTO,"170,8",2,"122,0",197,197
414,304(...)73,DIOGO MESQUITA COSTA,"170,6",4,"179,0",166,166
414,312(...)16,FRANCISCO MANUEL SILVA OLIVEIRA,"170,6",1,"179,0",166,166
416,300(...)02,DIOGO FILIPE MARQUES VEIROS,"170,6",3,"168,0",172,172
417,159(...)00,MIGUEL ALEXANDRE MENDES PIRES,"170,5",5,"177,0",167,167
418,149(...)06,ANDRÉ EDUARDO DE AMORIM DA SILVA VIEIRA,"170,5",1,"175,0",168,168
418,151(...)58,SALVADOR AZEVEDO DA GRAÇA CÉSAR MACHADO,"170,5",4,"175,0",168,168
418,311(...)96,TIAGO GOMES PEREIRA,"170,5",4,"175,0",168,168
421,323(...)43,SOFIA PEREIRA MILER,"170,5",2,"151,0",181,181
422,305(...)50,MARCO ROCHA FERREIRA,"170,5",3,"138,0",188,188
423,153(...)47,LUÍS GUILHERME LEITE DO VALE,"170,4",1,"171,0",170,170
424,311(...)96,MIGUEL NOGUEIRA MADALENA DO VALE NEVES,"170,3",1,"180,0",165,165
425,307(...)41,SAMUEL JOSÉ SOUSA VENTURA DA SILVA,"170,3",3,"156,0",178,178
426,310(...)44,BRUNO DUARTE MARTINS PIRES BABO DE CARVALHO,"170,3",2,"130,0",192,192
427,301(...)79,JOSÉ HENRIQUE CARDOSO TEIXEIRA,"170,2",2,"176,0",167,167
427,312(...)29,AFONSO DE SÁ LUIS VAZ,"170,2",1,"176,0",167,167
427,315(...)00,GABRIEL JOSÉ DOS SANTOS SOTTO MAYOR,"170,2",1,"176,0",167,167
430,153(...)63,GONÇALO CARDOSO DA SILVA,"170,2",2,"163,0",174,174
431,307(...)39,DANIEL MARTINS GONÇALVES,"170,2",4,"150,0",181,181
432,307(...)66,MARISA ALEXANDRA PREGAL ADELINO,"170,2",2,"139,0",187,187
433,152(...)35,ROBERTO DA SILVA,"170,1",6,"159,0",176,176
434,301(...)83,JOÃO PEDRO SÁ MAIA,"170,1",5,"148,0",182,182
435,306(...)45,JOÃO RICARDO ALMEIDA DA FONSECA,"170,1",1,"146,0",183,183
436,151(...)95,JOÃO PEDRO PINHEIRO RIBEIRO,"170,0",2,"155,0",178,178
436,306(...)63,JOÃO PEDRO LOURENÇO ALVES,"170,0",2,"155,0",178,178
438,151(...)84,ROMEU FILIPE TRINDADE DOS SANTOS,"169,9",2,"138,0",187,187
438,152(...)75,MATILDE MIRANDA RICARDO,"169,9",2,"138,0",187,187
440,150(...)10,DIOGO BARBOSA NAVIO,"169,8",6,"162,0",174,174
440,307(...)03,MARTA DOMINGUES ALVES,"169,8",1,"162,0",174,174
442,156(...)22,GUILHERME ALVES PINTO COELHO,"169,8",1,"149,0",181,181
442,307(...)96,MARIA MARTINS ROCHA MONJARDIM QUELHAS,"169,8",2,"149,0",181,181
444,301(...)49,HELENA MOURO DE SOUSA,"169,8",2,"147,0",182,182
445,300(...)65,NUNO ANTÓNIO SANTOS SILVA PICAVET,"169,7",4,"132,0",190,190
446,304(...)68,RODRIGO AMARO COSTA GOMES,"169,6",2,"180,0",164,164
447,302(...)17,CAMILA JERÓNIMO BARBOSA,"169,6",1,"154,0",178,178
448,159(...)02,MARIO MIGUEL BARRETO TAVARELA VELOSO,"169,6",5,"141,0",185,185
449,150(...)46,TIAGO DE FARIAS CORREIA,"169,6",5,"139,0",186,186
450,307(...)96,JOÃO AMÉRICO BATISTA OLIVEIRA,"169,5",3,"176,0",166,166
451,300(...)83,TOMÁS FERREIRA ALVES TEIXEIRA,"169,5",1,"150,0",180,180
451,304(...)26,RENATO REIS MAROMBAL,"169,5",3,"150,0",180,180
453,153(...)12,TOMÁS MONTES LEAL DE SÁ E SOUSA,"169,4",1,"172,0",168,168
454,150(...)41,GONÇALO MIGUEL TEIXEIRA DA COSTA BRANCO,"169,4",1,"159,0",175,175
454,158(...)30,DANIEL BORGES FERREIRA,"169,4",2,"159,0",175,175
456,151(...)20,PEDRO MARIA SILVA PEREIRA,"169,4",1,"157,0",176,176
456,155(...)56,JOÃO RODRIGO PINTO RIBEIRO,"169,4",1,"157,0",176,176
458,149(...)24,IGOR CAMPOS COUTINHO,"169,4",1,"146,0",182,182
458,156(...)80,LUÍS PAULO SILVA MERÊNCIO,"169,4",2,"146,0",182,182
460,310(...)86,JOÃO PAULO GOMES SANTOS,"169,3",2,"168,0",170,170
461,157(...)38,LEANDRO ANTÓNIO GONÇALVES ANTUNES,"169,3",2,"155,0",177,177
462,309(...)97,MAGDA RIESENBERGER COUCEIRO,"169,3",2,"153,0",178,178
463,302(...)39,CAROLINA OLIVEIRA GONÇALVES,"169,2",4,"149,0",180,180
464,305(...)16,INÊS DIAS PINHEIRO SÁ COSTA,"169,2",3,"136,0",187,187
465,304(...)91,DAVID DUARTE OSÓRIO POLIDO,"169,1",6,"147,0",181,181
466,151(...)11,PEDRO MIGUEL DAMASCENO MARTINS,"169,1",2,"145,0",182,182
466,301(...)71,PEDRO MIGUEL RODRIGUES BARROS,"169,1",1,"145,0",182,182
468,306(...)73,TIAGO DANIEL ARAÚJO LIMA,"169,1",1,"134,0",188,188
469,158(...)08,VICENTE MARTINS DA SILVA,"169,0",1,"195,0",155,155
470,152(...)05,FRANCISCO SANTOS DE ALMEIDA COSTA E CARVALHO,"168,9",5,"165,0",171,171
471,148(...)68,EDUARDO AMORIM DA SILVA,"168,9",1,"137,0",186,186
471,307(...)90,MARTA ADRIANA MOURA PEREIRA,"168,9",4,"137,0",186,186
473,153(...)89,TOMÁS LEAL MEIRA FERNANDES,"168,8",1,"148,0",180,180
474,316(...)59,ALEXANDRE DIAS TEIXEIRA,"168,8",2,"133,0",188,188
475,308(...)10,RICARDO SÉRGIO VASCO SOBRAL,"168,7",4,"157,0",175,175
476,304(...)23,LUIS MIGUEL MOREIRA DA COSTA GONZALEZ,"168,7",1,"155,0",176,176
477,306(...)58,JOÃO DINIS CORREIA LEITE,"168,7",3,"142,0",183,183
478,307(...)86,GUILHERME FRIAS MARQUES,"168,6",4,"179,0",163,163
479,156(...)52,RÚBEN ALEXANDRE ABREU FREITAS,"168,6",1,"151,0",178,178
479,305(...)90,LARA RAFAELA RODRIGUES SOARES,"168,6",1,"151,0",178,178
481,314(...)21,RAFAEL OLIVEIRA COSTA,"168,5",1,"175,0",165,165
482,154(...)79,TIAGO MONTEIRO PINHEIRO,"168,5",5,"160,0",173,173
483,150(...)88,JOSÉ PEDRO ARAÚJO OLIVEIRA,"168,4",6,"169,0",168,168
483,310(...)30,MÁRIO JORGE MATOS COSTA,"168,4",1,"169,0",168,168
485,154(...)20,JOSÉ EDUARDO PASCOAL SILVESTRE,"168,4",5,"158,0",174,174
485,156(...)47,FRANCISCA FILIPE ARAÚJO ALMEIDA CASTRO TEIXEIRA,"168,4",1,"158,0",174,174
487,159(...)91,RODRIGO FALCÃO ARAÚJO CASIMIRO DA SILVA,"168,4",3,"145,0",181,181
488,300(...)27,PAULO SÉRGIO FERREIRA NUNES,"168,3",1,"165,0",170,170
488,307(...)35,DAVID DE CASTRO COELHO,"168,3",3,"165,0",170,170
488,308(...)42,FRANCISCO MIGUEL TAVARES PINTO RODRIGUES,"168,3",6,"165,0",170,170
491,151(...)27,JOSÉ RAFAEL PEREIRA DE OLIVEIRA,"168,3",1,"139,0",184,184
492,307(...)09,DIOGO MOTA MOREIRA,"168,2",2,"176,0",164,164
493,153(...)21,MIGUEL ROCHA DIEGUES,"168,2",2,"174,0",165,165
494,154(...)98,DIOGO MARIA BRITO E FARO DE ALMEIDA GARRETT,"168,2",1,"163,0",171,171
495,158(...)04,RICARDO LUÍS RAMOS CHETA,"168,2",2,"148,0",179,179
496,301(...)41,TOMÁS MANUEL BRANCO FRANCISCO,"168,2",3,"135,0",186,186
497,308(...)71,MARCOS VINICIUS LOUREIRO DE CARVALHO MARTINS,"168,1",2,"170,0",167,167
498,153(...)57,NUNO JOSÉ CARRILHO LOUREIRO,"168,1",5,"159,0",173,173
499,308(...)18,TIAGO JOSÉ RAMOS BOUCINHA,"168,1",4,"157,0",174,174
500,150(...)02,INÊS CARLOS MARTINHO,"168,0",2,"179,0",162,162
500,152(...)89,ANDRÉ FERNANDO DA SILVA FERREIRA,"168,0",3,"179,0",162,162
502,314(...)10,PEDRO MIGUEL SANTOS SILVA ANJO,"168,0",4,"155,0",175,175
503,306(...)81,RODRIGO COSTA DE SOUSA,"167,9",1,"175,0",164,164
504,154(...)50,RITA SEVERINO PINTO RIBEIRO,"167,9",5,"138,0",184,184
505,300(...)27,GUILHERME DA FONSECA MIRANDA,"167,8",5,"160,0",172,172
505,306(...)15,TOMÁS DANTAS MATOS,"167,8",3,"160,0",172,172
507,314(...)86,ANA SOFIA CORTINHAS FERNANDES,"167,7",2,"182,0",160,160
508,301(...)49,BRUNO MIGUEL LOPES,"167,7",3,"180,0",161,161
509,306(...)77,DIOGO HENRIQUE DUARTE AMORIM,"167,7",1,"169,0",167,167
510,157(...)37,LARA FUNICO GUERRA,"167,7",3,"167,0",168,168
511,150(...)28,FILIPA CANGUEIRO GONÇALVES,"167,7",2,"156,0",174,174
512,304(...)39,JOÃO CARLOS CARNEIRO DE SOUSA,"167,7",2,"141,0",182,182
513,150(...)13,GONÇALO GUIMARÃES FARIA,"167,5",1,"187,0",157,157
514,309(...)59,TIAGO MIGUEL OLIVEIRA MOREIRA,"167,5",3,"161,0",171,171
515,311(...)60,CLAUDIO DANIEL CRUZ COSTA,"167,5",1,"159,0",172,172
516,149(...)52,TIAGO MANUEL DA SILVA PITA,"167,4",4,"170,0",166,166
517,304(...)83,PEDRO FILIPE SILVA OLIVEIRA,"167,4",1,"155,0",174,174
518,151(...)82,GONÇALO DUARTE FERNANDES,"167,4",2,"142,0",181,181
518,312(...)13,AFONSO TEIXEIRA RICARDO,"167,4",4,"142,0",181,181
520,154(...)68,JOÃO LUCAS FERREIRA AZEVEDO,"167,3",3,"151,0",176,176
521,156(...)13,RICARDO JORGE SILVA REIS,"167,3",3,"138,0",183,183
522,150(...)35,TIAGO PEDROSO SILVA,"167,2",1,"173,0",164,164
523,152(...)43,JOSÉ DUARTE NORONHA DA ROCHA ALVES,"167,2",1,"162,0",170,170
524,304(...)73,TOMÁS DA COSTA FERREIRA,"167,2",6,"160,0",171,171
524,310(...)19,RUI FILIPE DIAS BARBOSA,"167,2",1,"160,0",171,171
526,304(...)94,DAVID GUSTAVO DA COSTA LEAL,"167,2",4,"149,0",177,177
527,153(...)74,VASCO FERREIRA LEITE,"167,2",4,"147,0",178,178
528,314(...)98,JOÃO PEDRO SANTOS JORGE,"167,2",1,"121,0",192,192
529,151(...)99,INÊS FERREIRA RIBEIRO,"167,1",2,"171,0",165,165
530,312(...)00,CARLOS DANIEL LOPES CUNHA,"166,9",2,"176,0",162,162
530,313(...)42,JOÃO FERNANDO HONRADO PEREIRA,"166,9",1,"176,0",162,162
532,159(...)82,JOÃO PEDRO MONTEIRO CARVALHO,"166,8",4,"172,0",164,164
533,305(...)48,DIOGO GOMES VILELA,"166,8",1,"146,0",178,178
534,305(...)10,VITOR DANIEL MATOS RODRIGUES,"166,7",5,"168,0",166,166
535,301(...)48,PEDRO FILIPE CAVALEIRO NATÁRIO,"166,7",2,"142,0",180,180
536,300(...)89,MARTIM MENDES DA ROCHA,"166,7",4,"140,0",181,181
537,159(...)16,MARTIM MARQUES VALADAR,"166,6",5,"151,0",175,175
538,150(...)58,PEDRO MIGUEL CARDOSO RIBEIRO,"166,6",6,"138,0",182,182
538,309(...)64,GUILHERME AFONSO DE MELO VELOSO PEREIRA,"166,6",2,"138,0",182,182
540,152(...)65,BRUNO MICAEL ALVES TEIXEIRA,"166,6",1,"136,0",183,183
541,303(...)78,AFONSO GONÇALVES DE SOUSA,"166,5",3,"147,0",177,177
542,316(...)47,INÊS GOMES OLIVEIRA,"166,5",4,"121,0",191,191
543,151(...)14,SIMÃO RAFAEL DA SILVA MOREIRA,"166,4",5,"130,0",186,186
544,150(...)41,TOMÁS FILIPE FERREIRA PRADA,"166,3",2,"176,0",161,161
545,154(...)29,LEONOR FERRAZ MARINHO,"166,3",2,"165,0",167,167
545,301(...)30,MARIA CLARA MEIRELES SAMEIRO,"166,3",5,"165,0",167,167
545,312(...)14,PEDRO ALEXANDRE SOUSA BARBOSA,"166,3",2,"165,0",167,167
545,315(...)59,DIOGO LINHARES CAMPOS,"166,3",2,"165,0",167,167
549,150(...)06,CARLOS EDUARDO JORGE CARNEIRO,"166,3",3,"152,0",174,174
549,159(...)70,RUI JORGE PEREIRA RUA,"166,3",4,"152,0",174,174
549,306(...)16,MIGUEL PEDRO RODRIGUES DE ABREU RUFINO OLIVEIRA,"166,3",5,"152,0",174,174
552,307(...)39,FÁBIO RODRIGUES DA SILVA,"166,2",3,"185,0",156,156
553,152(...)00,RITA MAGALHÃES BRITO,"166,2",3,"146,0",177,177
553,306(...)82,FRANCISCO JOSÉ SALVADOR ALVES,"166,2",1,"146,0",177,177
555,154(...)42,JOSÉ MÁRIO JARDIM NUNES DE OLIVEIRA CADILHE,"166,2",5,"135,0",183,183
556,311(...)59,MARTIM ABREU MONTEIRO,"166,1",1,"181,0",158,158
557,314(...)79,ANDRÉ BARROS DE CARVALHO,"166,1",4,"168,0",165,165
558,305(...)95,RAFAEL BARBOSA MOREIRA,"166,1",1,"144,0",178,178
559,157(...)87,JOSÉ BERNARDO DA SILVA CRUZ MARTINS DE SOUSA,"166,0",1,"140,0",180,180
560,152(...)53,LARA LISA MACHADO GONÇALVES,"165,9",4,"147,0",176,176
561,156(...)17,JOÃO LUÍS FERNANDES SILVA,"165,8",6,"169,0",164,164
562,306(...)67,SALVADOR NEVES DA SILVA,"165,8",3,"158,0",170,170
563,306(...)72,DIOGO FILIPE DUARTE SOARES,"165,8",1,"156,0",171,171
564,151(...)93,INÊS RIBEIRO BATISTA,"165,8",5,"145,0",177,177
565,230(...)06,MARIA EDUARDA TOIGO,"165,7",1,"180,0",158,158
566,147(...)24,AFONSO JOSÉ SÁ SAMPAIO,"165,7",1,"167,0",165,165
567,301(...)43,MARIA EDUARDA MEIRELES SAMEIRO,"165,7",2,"165,0",166,166
568,307(...)57,MARIA LOUREIRO PERES,"165,7",3,"139,0",180,180
568,309(...)44,GUSTAVO XAVIER BARROS BARROSO,"165,7",1,"139,0",180,180
570,313(...)90,PEDRO ANDRÉ SILVA PINHO GONÇALVES,"165,6",4,"187,0",154,154
571,307(...)16,GONÇALO JOSE ESTEVES PINHEIRO,"165,6",1,"163,0",167,167
572,151(...)27,MIGUEL BECK MOTA CARDOSO GOMES DA COSTA,"165,6",1,"150,0",174,174
572,152(...)55,TIAGO JOÃO CONCEIÇÃO SAMPAIO,"165,6",2,"150,0",174,174
572,153(...)14,DIOGO FILIPE ALVES BENTES FERNANDES CABRAL,"165,6",2,"150,0",174,174
572,300(...)96,PEDRO AFONSO FERNANDES CARDOSO,"165,6",3,"150,0",174,174
576,230(...)04,MARIANA HIRAKAWA BISSACOT,"165,6",3,"148,0",175,175
577,306(...)53,ANA FILIPA COELHO BARREIRA CALHEIROS ALVES,"165,6",1,"135,0",182,182
578,148(...)25,JOSÉ LUÍS DA COSTA PIRES,"165,6",2,"109,0",196,196
579,308(...)76,BEATRIZ DE VASCONCELOS CORREIA MESQUITA,"165,5",4,"118,0",191,191
580,151(...)80,MARIA MOTA ROCHA,"165,4",3,"129,0",185,185
581,304(...)58,RITA TAVARES GOMES,"165,3",2,"136,0",181,181
582,307(...)70,EDUARDO PEREIRA RODRIGUES,"165,2",1,"160,0",168,168
583,307(...)77,RAFAEL SANTOS FARIA,"165,2",1,"145,0",176,176
584,303(...)42,HUGO JOÃO NEVES RAMOS,"165,1",1,"167,0",164,164
585,157(...)63,ALEXANDRE MAGALHÃES MARQUES,"165,1",1,"141,0",178,178
586,154(...)72,GONÇALO DE CARVALHO FERNANDES BRANQUINHO MOTA,"165,0",1,"165,0",165,165
587,158(...)24,RUI EDUARDO PEREIRA GOMES,"165,0",2,"163,0",166,166
588,151(...)08,TIAGO MINGHELLI MACHADO,"164,9",3,"159,0",168,168
588,306(...)34,LARA LEONOR FERREIRA MARTINS,"164,9",4,"159,0",168,168
590,156(...)72,FRANCISCO DE JESUS SOUSA,"164,9",1,"148,0",174,174
591,314(...)11,SOFIA CRISTINA PIRES DA ROCHA,"164,8",1,"181,0",156,156
592,230(...)22,NELSON ANTONIO DAIHA NETO,"164,8",5,"155,0",170,170
592,313(...)83,LEONOR GOMES TORRES VIEIRA DE LIMA,"164,8",2,"155,0",170,170
594,307(...)03,JOANA CORREIA VILAS BOAS,"164,8",1,"118,0",190,190
595,150(...)06,DIOGO LUÍS RODRIGUES MENDES,"164,7",2,"164,0",165,165
596,304(...)04,JOSÉ DIOGO DA COSTA CORREIA,"164,7",1,"153,0",171,171
597,153(...)38,RITA BEATRIZ RIBEIRO MACHADO,"164,7",1,"140,0",178,178
598,152(...)19,PEDRO AFONSO FERREIRA BRANCO DA SILVA,"164,6",5,"160,0",167,167
599,305(...)96,TOMÁS MOSQUEIRO CORREIA FERREIRA MARTINS,"164,6",1,"149,0",173,173
600,303(...)67,GUILHERME DA CRUZ CAMPELOS RODRIGUES NOGUEIRA,"164,5",1,"169,0",162,162
601,307(...)21,PEDRO DE FREITAS NOYA,"164,5",1,"158,0",168,168
602,152(...)80,BRUNO AMARAL DA CUNHA BARROS,"164,5",1,"145,0",175,175
602,153(...)95,JOÃO AIRES DE ABREU GONÇALVES RAPOSO,"164,5",1,"145,0",175,175
602,159(...)37,GUILHERME JOSÉ RODRIGUES PORTELA,"164,5",2,"145,0",175,175
602,303(...)11,SUSANA MAGALHÃES LOUREIRO,"164,5",1,"145,0",175,175
606,156(...)77,AFONSO DOS SANTOS BASTOS,"164,5",3,"143,0",176,176
607,307(...)68,LEONARDO FERRAZ BARBOSA,"164,4",4,"165,0",164,164
608,152(...)59,PAULO FILIPE SOARES OLIVEIRA,"164,3",5,"161,0",166,166
608,157(...)13,RUI PEDRO ABREU GUIMARAES,"164,3",2,"161,0",166,166
608,309(...)59,GONÇALO DINIS MOTA,"164,3",1,"161,0",166,166
611,314(...)81,RICARDO FERNANDO TEIXEIRA DA COSTA,"164,3",4,"148,0",173,173
612,310(...)89,RICARDO DANIEL FERREIRA SA LOURENCO,"164,2",1,"159,0",167,167
613,306(...)68,JOÃO PEDRO PEREIRA PIRES,"164,2",2,"146,0",174,174
614,312(...)46,SEBASTIÃO LUÍS MENDES MOREIRA,"164,1",1,"166,0",163,163
615,149(...)22,DIOGO NEVES ARAÚJO,"164,1",1,"153,0",170,170
615,315(...)84,ARTUR SILVANO CAPELOSSI,"164,1",1,"153,0",170,170
617,154(...)49,CATARINA DE SOUSA SANTOS SILVA,"164,1",1,"129,0",183,183
618,312(...)81,PEDRO FILIPE GILVAIA FONTES,"164,0",2,"175,0",158,158
619,153(...)49,JOSE NUNO VAZ MOURA,"164,0",3,"151,0",171,171
620,157(...)13,MAFALDA ALEXANDRA SANTOS BORGES,"164,0",2,"149,0",172,172
621,155(...)75,FILIPE ALEXANDRE TAVEIRA DAS NEVES,"164,0",3,"138,0",178,178
621,314(...)55,MARTA PEON DOS SANTOS,"164,0",6,"138,0",178,178
623,306(...)24,LUÍS GONÇALO OLIVEIRA SANTOS NUNES,"163,9",1,"171,0",160,160
624,230(...)76,MARIA LUIZA DE ALMEIDA PEREIRA,"163,8",1,"156,0",168,168
625,152(...)38,JOANA RODRIGUES GOMES,"163,7",2,"139,0",177,177
626,155(...)12,SARA AZEVEDO COUTINHO,"163,6",2,"161,0",165,165
626,314(...)84,PAULO GABRIEL MOURA VILAR,"163,6",1,"161,0",165,165
628,158(...)22,GABRIEL DIAS DE CASTRO,"163,6",1,"146,0",173,173
628,312(...)50,GUSTAVO SOUSA FERREIRA,"163,6",2,"146,0",173,173
630,303(...)67,RODRIGO DE ALMEIDA MANÃO,"163,5",2,"157,0",167,167
631,303(...)70,RODRIGO PINTO AGUIAR,"163,5",5,"118,0",188,188
632,313(...)56,LUCAS FILIPE REGAL FELISBERTO,"163,4",2,"166,0",162,162
633,157(...)84,JOÃO PEDRO RODRIGUES FRANCISCO,"163,4",1,"138,0",177,177
634,149(...)58,GUSTAVO BARBOSA VIEIRA DOS SANTOS,"163,2",1,"169,0",160,160
634,300(...)03,SALOMÉ LAURINDA CARDOSO BATISTA,"163,2",2,"169,0",160,160
636,149(...)35,PEDRO DUARTE MONTEIRO TEIXEIRA DE CARVALHO,"163,2",1,"145,0",173,173
637,315(...)41,JOÃO SALVADOR DE MAGALHÃES SILVA COELHO,"163,2",6,"132,0",180,180
638,149(...)20,HENRIQUE MARIA DE SOUSA CARVALHO,"163,1",3,"180,0",154,154
639,311(...)14,MARIANA DIAS MAGALHÃES,"163,1",3,"139,0",176,176
640,157(...)09,DIOGO ANTÓNIO GONÇALVES CRUZ,"163,0",1,"137,0",177,177
640,302(...)01,CAROLINA ALVES DA SILVA FERNANDES,"163,0",1,"137,0",177,177
642,309(...)96,JOSÉ BENTO DE MOURA BARBOSA,"163,0",1,"135,0",178,178
643,314(...)48,NUNO MIGUEL DA SILVA COSTA,"163,0",5,"122,0",185,185
644,159(...)42,ANDRÉ TEIXEIRA,"162,9",3,"172,0",158,158
645,156(...)85,FILIPE MANUEL DUARTE PARAFITA,"162,9",1,"159,0",165,165
646,151(...)83,BRUNO ALEXANDRE MOTA FERNANDES,"162,9",1,"146,0",172,172
647,305(...)17,BIANCA DOS ANJOS PEREIRA,"162,8",3,"155,0",167,167
648,301(...)79,LUÍS MIGUEL AGUIAR MACIEL,"162,8",5,"153,0",168,168
649,305(...)39,ANDRÉ MEIRELES BALÃO DA SILVA,"162,8",1,"127,0",182,182
650,304(...)06,MARTIM GRAÇA MANO,"162,7",1,"177,0",155,155
651,300(...)35,HENRIQUE MIGUEL GOMES DA SILVA,"162,7",1,"175,0",156,156
652,151(...)64,ANA FILIPA PINA DAMASCENO DE OLIVEIRA,"162,7",1,"149,0",170,170
653,304(...)47,DINIS VICENTE DE MAGALHAES RIBEIRO,"162,6",1,"147,0",171,171
654,158(...)56,JOÃO PEDRO DUARTE LEITE,"162,5",2,"156,0",166,166
654,304(...)57,DAVID GIRGIN TEIXEIRA,"162,5",3,"156,0",166,166
656,151(...)94,MANUEL CARVALHO DINIS DE CASTRO VIEIRA,"162,5",1,"143,0",173,173
657,306(...)20,FRANCISCO PINHO DE ALMEIDA MAXIMO,"162,4",3,"178,0",154,154
658,149(...)00,TELMO MIGUEL GONÇALVES GRADE,"162,4",1,"176,0",155,155
659,153(...)77,GUSTAVO DE CAMPOS BASTOS,"162,4",1,"152,0",168,168
660,153(...)12,BERNARDO PINHEIRO MONTEIRO,"162,4",1,"137,0",176,176
660,154(...)38,VASCO ROCHA OLIVEIRA,"162,4",2,"137,0",176,176
660,155(...)86,TOMAS GABRIEL FERREIRA SONIM,"162,4",3,"137,0",176,176
663,313(...)77,MADALENA MIRANDA CANDEIAS,"162,4",6,"100,0",196,196
664,151(...)19,JOÃO ALBUQUERQUE RODRIGUES ESTEVES,"162,3",1,"161,0",163,163
664,230(...)13,VINICIUS FRANZE SANCHEZ PERES,"162,3",1,"161,0",163,163
666,312(...)73,JOÃO GONÇALO MOREIRA VIEIRA,"162,3",2,"146,0",171,171
667,230(...)11,PEDRO DONG MO,"162,3",2,"135,0",177,177
668,306(...)81,RICARDO JOSÉ ELVAS DOMINGUES,"162,2",4,"157,0",165,165
669,150(...)89,TOMÁS FERREIRA QUEIRÓS GIL COUTINHO,"162,2",2,"155,0",166,166
669,153(...)30,RUI PEDRO CARDOSO PINTO,"162,2",3,"155,0",166,166
669,301(...)63,BRUNO RODRIGUES PIRES,"162,2",1,"155,0",166,166
669,306(...)13,PEDRO ALEXANDRE HENRIQUES FERREIRA,"162,2",2,"155,0",166,166
669,315(...)45,JOSÉ GABRIEL FERNANDO E SILVA,"162,2",2,"155,0",166,166
674,306(...)15,IVO DANIEL BASTOS BRENHA,"162,1",6,"179,0",153,153
675,312(...)04,JOSÉ CARLOS ARAÚJO FERREIRA,"162,1",1,"164,0",161,161
676,306(...)41,JOÃO FRANCISCO SOUSA OLIVEIRA,"162,1",2,"153,0",167,167
677,152(...)95,DAVID VENTURA MENDES DE SÁ,"162,0",2,"162,0",162,162
677,154(...)16,FRANCISCO MANUEL PACHECO MOREIRA,"162,0",1,"162,0",162,162
677,306(...)03,RICARDO FERNANDES DE ALMEIDA,"162,0",4,"162,0",162,162
680,314(...)00,ANA DO MAR SILVA ALMEIDA,"162,0",4,"160,0",163,163
681,305(...)90,ANTÓNIO RIBEIRO ALVES,"162,0",6,"136,0",176,176
682,151(...)46,VASCO ARTEIRO RODRIGUES DOS SANTOS,"161,9",1,"169,0",158,158
682,303(...)95,EDUARDO BARROS COELHO,"161,9",1,"169,0",158,158
682,306(...)06,TIAGO MACEDO DIAS,"161,9",3,"169,0",158,158
685,151(...)55,RITA MARIA OLIVEIRA MOREIRA,"161,9",1,"156,0",165,165
686,308(...)29,FRANCISCO FERREIRA MARTINS,"161,9",2,"145,0",171,171
687,149(...)68,BRUNO SAMUEL MOREIRA CASTRO,"161,8",1,"178,0",153,153
688,312(...)16,RODRIGO MARTINS DA COSTA,"161,8",3,"141,0",173,173
689,304(...)52,GONÇALO FILIPE LOUREIRO DO AMARAL,"161,7",1,"137,0",175,175
690,312(...)95,VICENTE NUNO MARQUES DE AMORIM,"161,7",3,"109,0",190,190
691,230(...)01,PAULO ZHENG LIN,"161,6",4,"170,0",157,157
692,156(...)08,JOÃO LUIS CORREIA FREIRE,"161,6",1,"146,0",170,170
693,302(...)90,GONÇALO MOREIRA ALVES,"161,5",2,"155,0",165,165
694,313(...)32,EDUARDO SOUSA CARDOSO,"161,5",1,"153,0",166,166
695,301(...)75,HENRIQUE DE SOUSA MONTEIRO,"161,5",1,"142,0",172,172
695,306(...)84,DIOGO MIGUEL VILAÇA GONÇALVES,"161,5",3,"142,0",172,172
697,300(...)98,GONÇALO DANIEL DA SILVA PEREIRA,"161,4",1,"162,0",161,161
698,148(...)11,RODRIGO MIGUEL ANTÃO,"161,4",1,"138,0",174,174
699,157(...)95,LUÍS HENRIQUE MORAIS GONÇALVES,"161,4",3,"136,0",175,175
700,156(...)73,PEDRO GOMES FERNANDES BARBOT OLIVEIRA,"161,4",1,"125,0",181,181
700,305(...)97,GUILHERME SILVA LOPES DA ROCHA,"161,4",1,"125,0",181,181
702,154(...)28,ANDRÉ SOUSA RODRIGUES,"161,3",1,"158,0",163,163
703,156(...)50,SARA DOMINGUES MOURA,"161,3",1,"145,0",170,170
703,158(...)39,VÍTOR JOSÉ FERREIRA DA SILVA,"161,3",2,"145,0",170,170
705,312(...)95,LUÍS PEDRO RIBEIRO GARCÊS,"161,2",2,"154,0",165,165
706,159(...)74,TIAGO MACHADO TEIXEIRA,"161,2",1,"143,0",171,171
707,156(...)65,DUARTE SOUSA E SILVA REIS,"161,2",2,"141,0",172,172
708,305(...)27,MANUEL FERNANDES NUNES,"161,1",6,"139,0",173,173
709,158(...)16,BERNARDO DOS REIS FERREIRA,"161,1",4,"137,0",174,174
709,301(...)18,MATILDE REBELO RODRIGUES,"161,1",4,"137,0",174,174
711,304(...)10,MANUEL DUARTE PEREIRA MARRAMAQUE SOTTOMAYOR NEGRÃO,"161,0",2,"161,0",161,161
712,154(...)05,TIAGO SAMUEL SILVA VIEIRA,"161,0",3,"133,0",176,176
713,152(...)14,DANIEL ANTÓNIO MARTINS TELLES MENDES,"160,9",2,"157,0",163,163
714,154(...)37,JOÃO RODRIGO DOS SANTOS SILVA E SOUSA,"160,9",6,"142,0",171,171
715,150(...)61,EDGAR NEVES SILVA,"160,8",1,"177,0",152,152
716,314(...)65,FRANCISCO ALVES TEIXEIRA,"160,8",3,"166,0",158,158
717,301(...)74,AFONSO JOSÉ AZEVEDO FERREIRA ARAÚJO,"160,8",1,"153,0",165,165
718,307(...)29,DUARTE FILIPE PARENTE FRANCO,"160,8",4,"138,0",173,173
719,153(...)07,TOMÁS PEREIRA CARNEIRO,"160,8",4,"125,0",180,180
719,306(...)55,MARIANA SOFIA NOGUEIRA DOS SANTOS,"160,8",2,"125,0",180,180
721,306(...)89,RÚBEN MIGUEL SOARES MORAIS,"160,7",2,"160,0",161,161
722,307(...)33,ANDRÉ PINHO SANTOS,"160,7",1,"136,0",174,174
723,303(...)38,PEDRO AZEVEDO ALVES DA CUNHA,"160,6",1,"158,0",162,162
723,308(...)47,FÁBIO CAMPOS FERNANDES,"160,6",2,"158,0",162,162
725,152(...)65,RODRIGO SÉRGIO FERREIRA SÁ,"160,6",2,"156,0",163,163
726,307(...)45,BERNARDO LEITE DOMINGUES LEAL DE OLIVEIRA,"160,5",1,"139,0",172,172
727,141(...)64,CARLOS MIGUEL MENDES FERNANDES,"160,5",1,"126,0",179,179
728,310(...)58,FRANCISCO MIGUEL PEREIRA OLIVEIRA,"160,4",1,"161,0",160,160
729,310(...)72,BRUNO DANIEL RAMOS SOUSA,"160,4",1,"148,0",167,167
730,159(...)35,JOÃO PEDRO VILA POMAR,"160,4",1,"135,0",174,174
731,151(...)42,MARTINHO BORGES COGUMBREIRO,"160,3",3,"157,0",162,162
731,308(...)98,JOÃO PEREIRA LEITE,"160,3",1,"157,0",162,162
733,154(...)71,PEDRO LEÃO LAREDO DE SOUSA,"160,3",1,"146,0",168,168
734,314(...)45,EMANUEL MAIA SILVA,"160,3",1,"131,0",176,176
735,157(...)68,JOÃO PEDRO SOUSA CALHETA,"160,3",2,"118,0",183,183
736,158(...)29,ANA CAROLINA COPOLECCHIA CARVALHAL,"160,3",3,"105,0",190,190
737,154(...)58,DAVID MARTIM RODRIGUES MONTEIRO,"160,2",2,"168,0",156,156
738,306(...)82,GUSTAVO DE CARDOSO E ABRANTES,"160,2",1,"155,0",163,163
738,306(...)48,FRANCISCO TADEU SIMÕES BARRETO DE SEABRA,"160,2",1,"155,0",163,163
740,158(...)62,ANA LEONOR ATAIDE PEDROSO SOARES,"160,2",1,"142,0",170,170
740,303(...)39,VASCO PEIXOTO ARAÚJO,"160,2",1,"142,0",170,170
742,158(...)93,PEDRO DINIS DE SOUSA,"160,2",3,"140,0",171,171
