Order Number,Parcial Identification Number,Name,Applicant Grade,Option Number,Entrance Test Grade,12th year grade,Average of 11th and 10th grades
1,303(...)62,HENRIQUE CANTEIRO MALVA,"191,9",4,"199,0",188,188
2,155(...)15,FRANCISCO GONÇALVES MALVA,"190,2",1,"185,0",193,193
3,302(...)47,VITOR HUGO FARIA BARBOSA,"185,6",3,"181,0",188,188
4,308(...)69,ANDRÉ FILIPE MAGALHÃES DA SILVA,"185,0",3,"185,0",185,185
5,153(...)93,PEDRO SOUSA DA COSTA,"184,6",6,"180,0",187,187
6,150(...)98,ANDRÉ MIGUEL MARTINHO DE MELO,"181,7",4,"181,0",182,182
7,313(...)39,HUGO SANTOS RIBEIRO,"181,4",4,"195,0",174,174
8,156(...)53,DUARTE DINIS PEREIRA,"180,7",3,"195,0",173,173
9,306(...)04,RODRIGO QUADROS DA COSTA,"180,6",4,"191,0",175,175
10,156(...)75,JOÃO PEDRO MARIANO CASCAIS,"180,5",2,"185,0",178,178
11,148(...)66,MIGUEL PINTO DE SANTOS,"180,3",3,"179,0",181,181
12,303(...)70,DUARTE LIMA ROSAS,"178,9",6,"186,0",175,175
12,303(...)26,GONÇALO JOSÉ CARRAJOLA GAIO,"178,9",2,"186,0",175,175
14,302(...)91,GUSTAVO FERREIRA XIMENES SOARES,"178,7",3,"180,0",178,178
15,301(...)47,DAVID CAMEIJO PINHEIRO,"178,7",5,"165,0",186,186
16,306(...)61,MANUEL BERNARDO NAZARÉ DE OLIVEIRA RODRIGUES DA SILVA,"178,6",6,"187,0",174,174
17,150(...)78,MARTA LEONOR ANDRADE DE PEIXOTO,"178,3",6,"151,0",193,193
18,302(...)66,DIOGO PEDRO SILVA GOMES,"177,8",5,"168,0",183,183
19,303(...)16,BÁRBARA SOUSA TRINDADE,"176,7",1,"165,0",183,183
20,304(...)64,TIAGO ANDRÉ LOPES MENDES,"176,3",2,"186,0",171,171
21,310(...)21,FILIPE MANUEL FERNANDES PEREIRA MARQUES,"175,7",3,"164,0",182,182
22,147(...)75,CÉSAR ALVES VIDEIRA,"175,6",6,"171,0",178,178
23,159(...)27,DÉBORA PRISCILA DE ALMEIDA ALVES,"175,4",4,"178,0",174,174
24,145(...)68,JOÃO PEDRO VENTURA BOTELHO,"174,9",5,"171,0",177,177
25,147(...)71,GABRIEL ALEXANDRE NASCIMENTO DUARTE,"174,8",1,"165,0",180,180
26,142(...)45,CÁTIA FILIPA SIMÕES FERNANDES,"174,7",1,"189,0",167,167
27,149(...)36,CHRISTIAN ALEXANDER MONTEIRO FERNANDES,"174,3",3,"197,0",162,162
28,308(...)51,LUANA CAROLINA CUNHA REIS,"174,1",2,"191,0",165,165
29,149(...)63,ALEXANDRE KAZUYA DIAS PEREIRA,"173,9",4,"170,0",176,176
30,311(...)27,GONÇALO SANTIAGO FERREIRA,"173,4",1,"176,0",172,172
31,148(...)13,MAFALDA SILVA ALVES MOREIRA,"172,6",6,"157,0",181,181
32,308(...)27,PEDRO FILIPE MANETA PINTO,"172,4",5,"175,0",171,171
33,300(...)83,HENRIQUE MIGUEL ALMEIDA MATIAS,"172,2",2,"167,0",175,175
34,302(...)90,ANDRÉ CASTRO PEREIRA,"171,7",4,"186,0",164,164
35,152(...)96,JOEL ESTEVES COSTA,"170,8",2,"176,0",168,168
36,152(...)70,GONÇALO DA SILVA ARAÚJO,"170,3",5,"141,0",186,186
37,300(...)89,MÁRIO RUI FARIA PEREIRA,"169,9",2,"127,0",193,193
38,310(...)47,DUARTE JOSÉ ANTUNES SILVA,"169,8",2,"160,0",175,175
39,156(...)35,TIAGO GABRIEL VIEIRA AFONSO DE ALMEIDA,"169,8",1,"149,0",181,181
40,305(...)43,DANIEL GANDARINHO LOUREIRO,"169,5",6,"174,0",167,167
41,310(...)39,JOÃO MANUEL MACHADO DA CUNHA,"169,2",5,"162,0",173,173
42,152(...)65,PEDRO DE SEABRA VIEIRA,"169,1",6,"171,0",168,168
43,151(...)27,DUARTE FILIPE MELO LOPES,"168,7",4,"155,0",176,176
44,312(...)84,JOÃO ANTÓNIO FAUSTINO VAZ,"168,5",5,"160,0",173,173
45,147(...)24,MANUEL ANTÓNIO DE SOUSA MECO,"167,9",6,"188,0",157,157
46,156(...)55,DIOGO RUBEN JERÓNIMO DE GOUVEIA,"167,6",2,"137,0",184,184
47,305(...)60,DIOGO GUERREIRO FERREIRA JOAQUIM,"167,3",2,"177,0",162,162
48,304(...)49,JOÃO GUILHERME DA COSTA GALVÃO,"167,2",3,"175,0",163,163
49,310(...)10,DUARTE OLIVEIRA CURTO,"166,8",6,"159,0",171,171
50,149(...)71,DIOGO DUARTE FARIA DOS SANTOS,"166,7",5,"166,0",167,167
51,311(...)33,JOSÉ ANTÓNIO MOTA PINTO,"166,7",6,"155,0",173,173
52,310(...)95,PEDRO GABRIEL SILVA FONSECA,"166,6",4,"175,0",162,162
53,312(...)48,JOSÉ DIOGO CARVALHO BARREIRA MIRANDA FERNANDES,"166,5",4,"160,0",170,170
54,309(...)17,FRANCISCO BATISTA OLIVEIRA,"166,5",5,"147,0",177,177
55,301(...)90,FRANCISCO JOSÉ FERNANDES CAETANO,"166,4",3,"169,0",165,165
56,147(...)19,MARIANA RODRIGUES BERNARDO DE SOUSA,"166,4",6,"167,0",166,166
57,152(...)61,RAFAEL ALBANO SILVA BRANDÃO,"166,3",5,"150,0",175,175
58,150(...)61,GUILHERME FILIPE REIS ABADESSO,"166,2",5,"172,0",163,163
59,302(...)99,MIGUEL FILIPE DE ALBUQUERQUE CARDOSO GOMES,"165,8",3,"182,0",157,157
60,310(...)82,JOEL LOURENÇO RODRIGUES,"165,7",3,"154,0",172,172
61,312(...)09,RENATO MARQUES REIS,"165,4",4,"155,0",171,171
62,301(...)24,CARLOS FILIPE NEVES FIGUEIREDO,"165,3",3,"151,0",173,173
63,300(...)60,JOÃO BERNARDO CORTESÃO CARDOSO,"165,2",6,"171,0",162,162
64,312(...)06,RAFAEL ROCHA MARQUES,"164,8",6,"142,0",177,177
65,300(...)03,RODRIGO ARAÚJO QUINTÃO,"164,7",1,"166,0",164,164
66,306(...)08,INÊS MATOS SILVA,"164,5",6,"195,0",148,148
67,310(...)38,VASCO ANTÓNIO PEREIRA DUARTE,"164,5",5,"130,0",183,183
68,145(...)57,DIOGO PIRES PINHEIRO,"164,4",5,"180,0",156,156
69,313(...)06,TIAGO ANDRÉ MACHADO COSTA,"164,2",4,"146,0",174,174
70,146(...)07,TIAGO NUNO DE MEDEIROS TEIXEIRA VASCONCELOS NUNES,"163,9",1,"147,0",173,173
71,314(...)24,RODRIGO MARTINS BOTELHO,"163,9",4,"145,0",174,174
72,305(...)79,FRANCISCO SOARES PEREIRA,"163,5",2,"157,0",167,167
73,151(...)33,TIAGO PERALTA RODRIGUES,"163,3",4,"175,0",157,157
74,150(...)62,TIAGO PEREIRA DA COSTA E SILVA,"163,3",5,"147,0",172,172
75,308(...)68,RUI FILIPE OLIVEIRA MONTEIRO,"163,2",1,"158,0",166,166
76,304(...)29,MIGUEL SIMÕES PONTES,"163,2",6,"145,0",173,173
77,309(...)88,JOSÉ RAFAEL DE FREITAS PACHECO,"162,9",4,"159,0",165,165
78,312(...)48,EUGÉNIO RAFAEL DA SILVA RODRIGUES,"162,9",1,"131,0",180,180
79,303(...)46,SIMÃO DE ALMEIDA CAMPANUDO,"162,8",3,"155,0",167,167
80,311(...)51,TOMÁS PINTO LOUREIRO,"162,5",3,"156,0",166,166
81,303(...)51,CRISTIANO DAVID NASCIMENTO DOMINGUES SANTOS,"162,3",5,"148,0",170,170
82,151(...)55,HUGO MIGUEL BORGES NEVES,"162,3",2,"146,0",171,171
83,149(...)91,LEONOR FERREIRA RIBEIRO,"162,2",5,"144,0",172,172
84,148(...)23,PEDRO ALEXANDRE SERRA MONTEIRO,"162,0",3,"162,0",162,162
84,155(...)92,GUSTAVO OLIVEIRA PINTO,"162,0",6,"162,0",162,162
86,150(...)42,DAVID GASPAR DOS REIS,"161,9",4,"145,0",171,171
87,307(...)93,ARTUR RODRIGUES CORTEZÃO GONÇALVES,"161,7",1,"161,0",162,162
88,304(...)78,FRANCISCO JOSÉ PAULOS ALVES,"161,7",2,"150,0",168,168
89,307(...)19,JOÃO FRANCISCO GOMES SIMÕES,"161,6",1,"172,0",156,156
90,310(...)24,PEDRO LINO NEVES FANECA,"161,6",2,"159,0",163,163
91,313(...)09,JOHNNY ANTÓNIO HENRIQUEZ PATAIAS,"161,6",2,"157,0",164,164
92,148(...)39,LUÍS HENRIQUE ALVES PALMA,"161,6",5,"146,0",170,170
93,154(...)74,GUILHERME FERNANDES RODRIGUES,"161,4",3,"162,0",161,161
94,301(...)10,DANIEL PINTO VIEIRA,"161,4",5,"151,0",167,167
95,300(...)65,FRANCISCO VIEIRA MONTEIRO DE QUEIRÓS,"161,3",4,"145,0",170,170
96,153(...)78,EDUARDO JOSÉ VERÍSSIMO CABETE,"161,2",3,"169,0",157,157
97,303(...)41,TIAGO MARTINS MARÇAL,"161,2",4,"150,5",167,167
98,156(...)58,JOÃO PEDRO ALMEIDA PIRES,"161,0",4,"135,0",175,175
99,303(...)53,CARLOS MANUEL GOMES DA FONSECA AUGUSTO PEREIRA,"160,9",2,"155,0",164,164
100,145(...)50,DIOGO RIBEIRO TEIXEIRA,"160,7",5,"160,0",161,161
101,152(...)34,JOÃO MIGUEL GARCIA ALMEIDA SANTOS ROSA,"160,6",1,"145,0",169,169
102,148(...)12,MARIA JOÃO CORREIA,"160,4",6,"161,0",160,160
103,303(...)39,EMA GABRIEL GODINHO,"160,4",3,"148,0",167,167
104,155(...)84,LEANDRO REIS PEREIRA,"160,2",4,"166,0",157,157
105,148(...)62,LUCAS MIGUEL FREITAS NEVES,"160,2",3,"140,0",171,171
106,158(...)78,RICARDO DUARTE RODRIGUES,"160,1",3,"151,0",165,165
107,309(...)19,FRANCISCO JOSÉ COSTA PESTANA,"160,0",3,"132,0",175,175
108,157(...)66,JOAO MARIA MOREIRA DIAS,"159,9",6,"154,0",163,163
109,307(...)00,EDUARDO SILVA PAIS,"159,8",2,"150,0",165,165
110,306(...)14,NUNO MIGUEL FERREIRA DA SILVA,"159,7",1,"159,0",160,160
111,156(...)73,GONÇALO DANIEL OLIVEIRA,"159,5",4,"190,0",143,143
112,307(...)70,DAVID FILIPE NOITE CURADO SEQUEIRA,"159,5",2,"166,0",156,156
113,302(...)41,PEDRO MIGUEL SEIXAS E CUNHA,"159,3",5,"145,0",167,167
114,304(...)11,GONÇALO COELHO DE SOUSA,"159,2",3,"165,0",156,156
115,300(...)04,MIGUEL ALEXANDRE LOURO SIMÕES,"159,2",1,"152,0",163,163
116,312(...)35,JOÃO DIOGO VENÂNCIO MARQUES ZARCOS PALMA,"158,9",3,"142,0",168,168
117,324(...)16,THIAGO SANTI TAVARES,"158,8",1,"175,0",150,150
118,303(...)68,MARGARIDA CATITA DELGADO,"158,8",2,"151,0",163,163
119,305(...)89,ANDRÉ GONÇALO DA SILVA TAVARES BOUÇA LOPES,"158,8",1,"138,0",170,170
120,302(...)49,DUARTE LOPES GOMES DA COSTA,"158,7",4,"173,0",151,151
121,303(...)88,GUILHERME FILIPE DE SEIÇA PRATAS,"158,7",2,"147,0",165,165
122,303(...)73,RAFAEL FERNANDES DOS REIS,"158,6",4,"167,0",154,154
123,156(...)07,MARIANA COUTO MAIA,"158,4",4,"146,0",165,165
124,310(...)31,CARLOS EDUARDO LEAL CRAVO,"158,4",3,"135,0",171,171
125,152(...)76,BEATRIZ SOFIA DE JESUS ALVES,"158,1",4,"143,5",166,166
126,308(...)06,RICARDO RODRIGUES DUARTE,"158,0",1,"132,0",172,172
127,154(...)73,GONÇALO NUNO PEDROSO BORGES,"157,9",5,"180,0",146,146
128,302(...)89,DIOGO DA SILVA PALAIO,"157,9",5,"165,0",154,154
128,306(...)49,MIGUEL ALEXANDRE PONTES CALADO,"157,9",3,"165,0",154,154
130,307(...)94,RICARDO RIBEIRO VALES DA MOTA FREITAS,"157,8",5,"135,0",170,170
131,158(...)19,DANIEL FILIPE DA SILVA FERREIRA,"157,8",6,"111,0",183,183
132,154(...)11,AFONSO DINIS SANTOS REIS,"157,6",3,"140,0",167,167
133,158(...)06,BEATRIZ ALEXANDRA AZEITONA MOURATO,"157,5",3,"175,0",148,148
133,159(...)49,DAVID SILVA GRAÇA,"157,5",1,"175,0",148,148
135,150(...)56,LUCAS DA SILVA QUEIROGA,"157,4",2,"158,0",157,157
136,156(...)50,PEDRO DANIEL BRANCO SILVA,"157,4",5,"145,0",164,164
137,307(...)69,RITA PINTO SILVA COSTA,"157,4",3,"141,5",166,166
138,308(...)08,TOMÁS MARTINS BOIALVO,"157,3",5,"143,0",165,165
139,304(...)36,DIOGO RAFAEL OLIVEIRA NUNES,"157,2",3,"152,0",160,160
139,313(...)83,JOSÉ HENRIQUE LIMA NECHO,"157,2",1,"152,0",160,160
141,305(...)73,GUILHERME JOSÉ SIMÃO MARTINS,"157,1",5,"148,0",162,162
141,309(...)66,JOSÉ CARLOS MOTA MAGALHÃES MOURA,"157,1",5,"148,0",162,162
143,301(...)26,MARIA INÊS MELO TEIXEIRA MAGALHÃES,"157,1",2,"122,0",176,176
144,155(...)18,DANIEL MELO E SILVA,"157,0",5,"142,0",165,165
145,149(...)02,DUARTE JORGE FERREIRA RODRIGUES,"157,0",6,"131,0",171,171
146,303(...)84,PEDRO MIGUEL MARTINS JÁCOME,"156,9",1,"127,0",173,173
147,307(...)65,TIAGO MATOS DA SILVA,"156,8",3,"160,0",155,155
148,155(...)53,TIAGO DA COSTA SOUSA,"156,8",1,"108,0",183,183
149,148(...)93,FRANCISCO RIBEIRO GONÇALVES,"156,7",4,"158,0",156,156
150,310(...)62,DIOGO MIGUEL RODRIGUES JESUS,"156,6",3,"141,0",165,165
151,157(...)27,TIAGO HENRIQUE FERREIRA MATIAS,"156,6",2,"139,0",166,166
152,156(...)87,LUCAS DE OLIVEIRA COUCEIRO,"156,5",1,"150,0",160,160
153,304(...)64,EDUARDO RIBEIRO NEVES JACINTO,"156,4",1,"185,0",141,141
154,304(...)93,MIGUEL BORGES PEREIRA SILVÉRIO,"156,4",3,"172,0",148,148
155,158(...)63,DANIEL FILIPE SILVA BRÁS,"156,2",4,"138,0",166,166
156,151(...)28,JOÂO AFONSO DA MOTA VIEIRA TAVARES,"155,9",6,"139,0",165,165
157,313(...)95,RICARDO ANTÓNIO RIBEIRO MIGUEL,"155,8",2,"135,0",167,167
158,304(...)26,SANDRO KURTESI DE SOUSA,"155,7",2,"155,0",156,156
159,308(...)61,PEDRO MIGUEL VIEIRA MARIANO,"155,6",3,"140,0",164,164
160,301(...)80,DAVID LOPES DOS SANTOS,"155,5",2,"162,0",152,152
161,150(...)58,DAVID MARQUES LOURENÇO,"155,5",2,"147,0",160,160
162,151(...)75,LEONARDO LEVI LOURENCO VACAREAN,"155,4",3,"156,0",155,155
162,303(...)77,MADALENA QUEIROS DA SILVA FILIPE,"155,4",3,"156,0",155,155
164,304(...)88,TOMAS MOURA MARTINS DOS SANTOS FERREIRA,"155,4",4,"145,0",161,161
165,153(...)04,RODRIGO GOMES MARTINS,"155,4",5,"119,0",175,175
166,310(...)01,SAMUEL SÁ OLIVEIRA CARUNCHO,"155,4",3,"106,0",182,182
167,314(...)40,ALEXANDRE DANIEL MARINHEIRO MARQUES,"155,3",3,"165,0",150,150
168,311(...)40,JOAO GUILHERME PILAR DE FIGUEIREDO,"155,2",6,"176,0",144,144
169,311(...)22,CLAUDIO MIGUEL DE ALMEIDA VAZ JORGE,"155,2",2,"150,0",158,158
170,149(...)96,GUILHERME DE PINHO DOMINGOS,"155,2",1,"137,0",165,165
171,301(...)81,JOÃO PEDRO BISPO NEVES,"155,0",2,"155,0",155,155
172,220(...)07,JOÃO SU,"155,0",5,"140,0",163,163
172,307(...)22,GUSTAVO ALEXANDRE DA GRAÇA BASTOS,"155,0",3,"140,0",163,163
174,149(...)97,JOAQUIM JOSÉ FERNANDES MARTINS,"155,0",4,"116,0",176,176
175,305(...)34,EDUARDO JOSÉ CRUZ SOUSA,"154,9",1,"138,0",164,164
176,159(...)18,MARIA INÊS DE OLIVEIRA DIAS,"154,9",1,"136,0",165,165
177,300(...)11,RODRIGO SIMÕES GONÇALVES,"154,9",1,"125,0",171,171
178,158(...)51,PEDRO MARCELO SANTOS PINHO,"154,9",2,"99,0",185,185
179,304(...)90,HUGO GONÇALVES GUIMARÃES,"154,6",3,"126,0",170,170
180,303(...)80,PEDRO FRANCISCO DA SILVA VIEIRA,"154,6",4,"111,0",178,178
181,301(...)91,GONÇALO MIGUEL CORREIA DA SILVA,"154,5",5,"159,0",152,152
182,307(...)00,GONÇALO TAVARES TORRES,"154,5",5,"120,0",173,173
183,148(...)05,GUSTAVO DA SILVA CALÇARÃO,"154,4",2,"155,0",154,154
184,309(...)58,JOÃO PEDRO GONÇALVES VENTURA BARATA,"154,4",5,"129,0",168,168
185,151(...)00,GUILHERME RODRIGUES MENESES,"154,3",1,"140,0",162,162
186,150(...)61,TIAGO ANDRÉ SANTOS GOMES,"154,3",1,"138,0",163,163
187,318(...)73,PEDRO DA COSTA SHERRING,"154,2",1,"162,0",150,150
188,154(...)83,JOÃO FRANCISCO MATIAS COUTO,"154,0",2,"165,0",148,148
189,149(...)90,FILIPE MANUEL DE SOUSA ROSÁRIO E DIAS NUNES,"154,0",3,"152,0",155,155
190,300(...)87,GONÇALO MIGUEL SANTOS DA SILVA,"154,0",3,"115,0",175,175
191,300(...)19,RAUL MANUEL BREGIEIRO DA SILVA CAVALEIRO,"153,9",6,"135,0",164,164
191,313(...)94,FRANCISCO JOSÉ CORDEIRO PIRES,"153,9",2,"135,0",164,164
193,305(...)44,TOMAS DUARTE SOARES,"153,7",2,"129,0",167,167
194,302(...)90,MARTIM FERREIRA DE OLIVEIRA,"153,7",1,"116,0",174,174
195,154(...)75,JOÃO CARLOS BASTOS PINHO,"153,6",6,"149,0",156,156
196,155(...)41,SOFIA CORREIA TORRES LEFEUVRE,"153,5",4,"147,0",157,157
196,159(...)01,RICARDO MANUEL DOS SANTOS SOUSA,"153,5",4,"147,0",157,157
198,151(...)81,PEDRO MONTEIRO RIBEIRO,"153,4",4,"141,0",160,160
199,150(...)89,JOÃO PINHO MARQUES,"153,3",6,"176,0",141,141
200,151(...)63,TOMÁS ALEXANDRE DIAS LARANJEIRA,"153,3",1,"150,0",155,155
201,304(...)19,FILIPE PINA DE SOUSA,"153,3",4,"133,5",164,164
202,313(...)01,MARGARIDA PASCOAL NUNES,"153,2",1,"133,0",164,164
203,157(...)02,FRANCISCO JOSÉ VENTURA RIBEIRO,"153,0",3,"138,0",161,161
204,303(...)30,ANDRÉ MIGUEL RICARDO MORTÁGUA,"152,9",1,"147,0",156,156
205,146(...)10,PEDRO DANIEL PEREIRA SANTOS,"152,9",5,"121,0",170,170
206,300(...)35,ANA RITA PINHO FONSECA,"152,8",1,"145,0",157,157
207,150(...)91,TIAGO DOMINGUES ESTEVES,"152,8",6,"126,5",167,167
208,157(...)43,TOMAS TAVARES DE CAMPOS,"152,7",1,"191,0",132,132
209,311(...)43,GABRIEL RODRIGUES FERNANDES,"152,7",3,"139,0",160,160
210,310(...)45,VICENTE NUNO DE MATOS E CUNHA,"152,6",4,"135,0",162,162
210,311(...)50,RICARDO MIGUEL BRÁS DUARTE,"152,6",3,"135,0",162,162
212,150(...)84,MIGUEL SARAMAGO TAVARES CANINHAS,"152,5",2,"146,0",156,156
213,152(...)82,PEDRO ANTÓNIO FERNANDES MARTINS,"152,4",3,"101,0",180,180
214,307(...)01,PEDRO MAIA NEVES,"152,3",5,"138,0",160,160
215,300(...)16,AFONSO RODRIGO BARBOSA DE CASTRO,"152,3",2,"136,0",161,161
216,150(...)89,GONÇALO FERNANDES ANDRÉ,"152,2",4,"160,0",148,148
217,302(...)70,AFONSO DA CUNHA OLIVEIRA,"152,2",6,"145,0",156,156
218,147(...)98,DAVID FILIPE NEVES VIEIRA,"152,1",6,"148,5",154,154
219,325(...)81,OLIVER BIAZOTO CERVEIRA,"152,1",3,"124,5",167,167
220,151(...)68,MARIANA MENDES TRINDADE ALVES CORREIA,"152,0",4,"165,0",145,145
221,308(...)55,XAVIER SOUSA OLIVEIRA,"152,0",1,"152,0",152,152
222,307(...)93,MIGUEL CAEIRO DA SILVA,"152,0",3,"137,0",160,160
223,159(...)62,TOMÁS DE CASTRO DAUBNEY,"151,9",2,"159,0",148,148
224,303(...)55,RODRIGO AFONSO DIAS FERRÃO,"151,9",6,"133,0",162,162
225,313(...)76,AFONSO MIGUEL RAMOS AGANTE,"151,8",6,"142,0",157,157
226,300(...)78,TOMÁS STRECHT BARROS CUNHA,"151,8",5,"118,0",170,170
226,306(...)18,JOÃO PEDRO SILVEIRA DA COSTA,"151,8",4,"118,0",170,170
228,302(...)88,JOSÉ FRANCISCO SPÍNOLA MARQUES TÔCO,"151,8",1,"116,0",171,171
229,146(...)55,LEONOR FIDALGO EVANGELISTA,"151,7",2,"125,0",166,166
230,152(...)26,TIAGO FERREIRA NUNES,"151,5",5,"145,0",155,155
230,152(...)81,JOSÉ LUÍS FIGUEIREDO MENDES,"151,5",1,"145,0",155,155
232,308(...)38,GONÇALO JOSÉ DE ALMEIDA DIAS,"151,5",2,"130,0",163,163
233,306(...)98,TOMAS FARIA RAMOS,"151,4",1,"152,0",151,151
234,150(...)63,JOÃO PEDRO HERDEIRO SEQUEIRA CAVACO CARDOSO,"151,4",2,"139,0",158,158
235,303(...)29,RICARDO MIGUEL FREITAS DE OLIVEIRA,"151,3",3,"163,0",145,145
235,305(...)85,FAUSTO MANUEL GENS LUÍS,"151,3",2,"163,0",145,145
237,144(...)21,NICHOLAS KLEMAN SANTOS,"151,3",3,"150,0",152,152
238,302(...)31,DAVID SANTOS VAZ,"151,3",3,"148,0",153,153
238,304(...)03,DIOGO SIMÃO TAVARES DE OLIVEIRA,"151,3",2,"148,0",153,153
240,308(...)33,TIAGO FERNANDO VALENTE SOUSA CARVALHO,"151,3",4,"124,0",166,166
241,306(...)46,JOSÉ DE JESUS FÉLIX MOREIRA,"151,2",5,"146,0",154,154
242,156(...)73,ANA CAROLINA ABRUNHEIRO PARDAL,"151,2",1,"131,0",162,162
243,312(...)42,RUI FILIPE ALMEIDA VAZ SEQUEIRA,"151,2",1,"118,0",169,169
244,308(...)27,GONÇALO CARDOSO GOMES,"151,1",3,"142,0",156,156
245,149(...)35,DANIEL JORGE MARTINS MARQUES,"151,1",2,"129,0",163,163
246,307(...)64,FILIPE FERNANDES GOMES,"151,0",3,"151,0",151,151
247,156(...)33,NUNO AFONSO DE SOUSA LEAL,"151,0",3,"149,0",152,152
247,303(...)68,DAVID POETA PELICANO,"151,0",4,"149,0",152,152
249,147(...)01,GONÇALO LOPES PEREIRA PINTO,"151,0",4,"138,0",158,158
250,152(...)25,PEDRO MANUEL BARRETO DIAS DOS SANTOS,"150,9",6,"147,0",153,153
251,305(...)01,CARLOS AUGUSTO RAMOS CASTELO,"150,9",4,"134,0",160,160
252,155(...)00,LARA DA COSTA MARQUES,"150,9",5,"132,0",161,161
252,303(...)24,JOÃO LUÍS BAIRRAS DO AMARAL MORAIS FERREIRA,"150,9",6,"132,0",161,161
254,302(...)90,RAFAEL FILIPE RODRIGUES PEREIRA,"150,8",1,"156,0",148,148
255,303(...)58,TIAGO JAULINO OLIVEIRA ANTUNES,"150,8",6,"130,0",162,162
256,304(...)33,TIAGO JOSÉ GASPAR OLIVEIRA,"150,7",1,"165,0",143,143
257,152(...)35,LUCAS SILVA ALVES,"150,6",2,"161,0",145,145
258,307(...)59,DUARTE XAVIER DE OLIVEIRA SANTOS,"150,6",1,"133,0",160,160
259,302(...)34,ALEXANDRE MARTINS GRIFO,"150,5",3,"157,0",147,147
260,313(...)08,BRUNO MIGUEL PEREIRA NETO,"150,5",3,"155,0",148,148
261,306(...)73,MARIA JOÃO MARINHO DE SOUSA,"150,5",2,"103,0",176,176
262,159(...)72,JOSÉ MANUEL ROQUE SANTOS,"150,4",3,"99,0",178,178
263,146(...)33,GONÇALO CORREIA SILVA,"150,2",2,"143,0",154,154
264,147(...)20,PAULO ALEXANDRE TEIXEIRA BROCHADO,"150,1",4,"126,0",163,163
265,152(...)99,MIGUEL DA COSTA ALVES,"150,0",3,"135,0",158,158
266,312(...)86,GONÇALO ALEXANDRE FONTES DE ALMEIDA,"150,0",1,"122,0",165,165
267,300(...)04,ALEXANDRE DUARTE NEVES,"149,9",3,"118,0",167,167
268,159(...)96,JULIANA SILVA TEIXEIRA,"149,8",4,"116,0",168,168
269,159(...)51,RÚBEN FILIPE GONÇALVES EIRAS,"149,7",5,"136,0",157,157
270,159(...)60,MARCO ANTÓNIO HENRIQUES PORTUGAL,"149,6",3,"158,0",145,145
271,307(...)43,GUILHERME SILVA VICENTE,"149,6",6,"134,0",158,158
272,306(...)76,RODRIGO ALEXANDRE ALMEIDA GONÇALVES,"149,5",2,"154,0",147,147
273,220(...)01,ERIC ALVES SENA,"149,5",4,"143,0",153,153
274,306(...)75,MIGUEL FERREIRA CARDOSO,"149,5",2,"128,0",161,161
275,306(...)51,DIOGO RAFAEL RIBEIRO DE SOUSA,"149,4",6,"152,0",148,148
276,314(...)84,TOMAS FIGUEIREDO PEDROSO,"149,2",2,"129,0",160,160
277,147(...)03,GUILHERME PROENÇA MAIA ARAUJO,"149,1",2,"140,0",154,154
278,302(...)49,BRUNO TIAGO FERREIRA MARTINS,"149,1",1,"127,0",161,161
279,152(...)40,DIOGO SOUSA RODRIGUES,"149,1",3,"119,5",165,165
280,310(...)71,MARTIM ALEXANDRE VIEIRA ANTUNES,"149,1",1,"108,5",171,171
281,146(...)93,GUILHERME DIAS NUNES,"149,0",3,"121,0",164,164
282,220(...)04,PAULO GABRIEL CANGUSSU RODRIGUES,"149,0",6,"108,0",171,171
283,148(...)93,SIMÃO DA SILVA E SANTOS,"148,8",5,"152,0",147,147
284,154(...)43,JOÃO PEDRO BENTO RODRIGUES,"148,7",2,"161,0",142,142
285,155(...)30,JOÃO RODRIGO DE VASCONCELOS SOUSA E AZEVEDO,"148,7",5,"124,0",162,162
286,151(...)47,TOMÁS SANTOS ALMEIDA,"148,6",1,"146,0",150,150
287,147(...)81,FÁBIO OLIVEIRA,"148,5",2,"155,0",145,145
288,312(...)38,RAFAEL JOSÉ OLIVEIRA ANTUNES,"148,5",2,"142,0",152,152
289,310(...)72,VASCO PINHEIRO COELHO,"148,4",5,"136,0",155,155
290,157(...)51,MIGUEL ANTONIO NAVARRO DA COSTA,"148,3",2,"158,0",143,143
291,153(...)51,DUARTE MACHADO GOIS,"148,3",2,"145,0",150,150
291,220(...)12,GUILHERME FARIAS COSTA,"148,3",6,"145,0",150,150
293,153(...)56,PEDRO RAFAEL SILVA MARQUES,"148,3",4,"132,0",157,157
294,302(...)73,JOSÉ SOUSA PORTUGAL,"148,2",2,"141,0",152,152
295,307(...)33,RÚBEN MIGUEL ALMEIDA COELHO,"148,2",6,"130,0",158,158
296,312(...)92,VITOR VAZ COSTA,"148,2",2,"117,0",165,165
297,153(...)16,RAFAEL GOMES PINTO,"148,1",3,"150,0",147,147
297,156(...)93,EDUARDO DANIEL JORGE LARANJEIRO,"148,1",1,"150,0",147,147
299,151(...)67,MARIA LOPES MALATO,"148,0",2,"148,0",148,148
299,156(...)58,DAVID ABEL DOS REIS OLIVEIRA,"148,0",3,"148,0",148,148
301,150(...)86,NUNO GUILHERME SAMPAIO REBELO,"148,0",2,"135,0",155,155
302,144(...)35,GUILHERME NUNO OLIVEIRA CAETANO CARVALHO,"148,0",6,"133,0",156,156
303,159(...)27,DIOGO DE ABREU RIBEIRO,"148,0",1,"122,0",162,162
303,310(...)44,JOÃO PEDRO COSTA FERREIRA,"148,0",4,"122,0",162,162
305,152(...)80,FÁBIO MATIAS NETO,"147,8",1,"125,0",160,160
306,152(...)87,TIAGO MANUEL VIEIRA PEREIRA,"147,6",4,"156,0",143,143
307,148(...)38,NUNO ANDRE RAMOS DE LEMOS,"147,5",4,"165,0",138,138
308,312(...)02,LUÍS FILIPE CARVALHO MARTINS,"147,4",5,"111,0",167,167
309,143(...)16,JOÃO FRANCISCO VENTURA ROSA PAIS,"147,3",1,"170,0",135,135
310,157(...)18,RODRIGO SARAMAGO OLIVEIRA GONÇALVES DA SILVA,"147,3",2,"105,0",170,170
311,152(...)15,NUNO JOSÉ RODRIGUES GOUVEIA,"147,2",4,"142,0",150,150
311,303(...)08,TOMÁS AZÓIA MORAIS,"147,2",2,"142,0",150,150
311,308(...)98,BRUNO SU DU,"147,2",5,"142,0",150,150
314,154(...)70,RODRIGO ORTIGA,"147,2",2,"140,0",151,151
315,158(...)22,DANIEL DUARTE PINHO,"147,1",5,"151,0",145,145
316,156(...)78,GONÇALO FILIPE CARDOSO VIEIRA,"147,1",5,"149,0",146,146
317,154(...)35,SIMÃO PEDRO CARDOSO SANTIAGO,"147,1",5,"136,0",153,153
317,303(...)19,FÁBIO ALEXANDRE DE JESUS DIAS,"147,1",2,"136,0",153,153
319,151(...)97,BRUNO DA SILVA PINTO,"147,1",3,"123,0",160,160
320,152(...)87,DUARTE SEGURO PEREIRA,"147,1",1,"112,0",166,166
320,301(...)92,CARLOS PIMENTEL MARTINS,"147,1",1,"112,0",166,166
320,313(...)23,JOAO MIGUEL MACHADO MOUTINHO SANTOS,"147,1",5,"112,0",166,166
323,310(...)91,LUÍS ANDRÉ CASTRO LEMOS,"147,1",6,"110,0",167,167
324,144(...)71,JOÃO BERNARDO RAMOS CORREIA DA FONSECA,"147,0",2,"145,0",148,148
325,306(...)96,SÉRGIO JOAQUIM TEIXEIRA VIEIRA,"147,0",5,"119,0",162,162
326,309(...)46,GONÇALO ALMEIDA RIBEIRO,"146,9",1,"156,0",142,142
327,155(...)17,EDUARDO JORGE DIAS CARVALHO,"146,9",4,"130,0",156,156
328,304(...)37,TIAGO FILIPE SOUSA MONTEIRO,"146,8",2,"126,0",158,158
329,308(...)89,VASCO JORGE PEREIRA FERNANDES,"146,7",3,"148,0",146,146
330,304(...)85,MATILDE MESQUITA PINTO,"146,7",3,"146,0",147,147
331,158(...)68,GUILHERME TOSTE BIZARRO,"146,7",2,"135,0",153,153
332,151(...)44,FÁBIO FERNANDO AZENHA LEAL,"146,7",1,"107,0",168,168
332,312(...)53,TIAGO MIGUEL TEIXEIRA LOPES,"146,7",3,"107,0",168,168
334,309(...)61,MIGUEL ANDRÉ VIEGAS GUERREIRO,"146,6",4,"155,0",142,142
335,301(...)70,GUILHERME BELCHIOR FERREIRA,"146,6",1,"131,0",155,155
336,149(...)78,RODRIGO FALCÃO ROMA LAUREANO TEJO,"146,6",3,"129,0",156,156
337,147(...)74,DINIS OLIVEIRA SILVA,"146,5",4,"140,0",150,150
337,159(...)60,JOÃO MIGUEL MANETA PEIXOTO,"146,5",2,"140,0",150,150
339,152(...)48,IGOR SILVA FREITAS,"146,5",4,"125,0",158,158
340,311(...)17,HUGO MARQUES CALHEIROS,"146,5",3,"106,5",168,168
341,304(...)82,AFONSO RODRIGUES GAUDÊNCIO PEREIRA,"146,3",5,"139,5",150,150
342,150(...)38,MIGUEL RIBEIRO PEREIRA,"146,2",5,"152,0",143,143
343,304(...)71,JOÃO DUARTE PEREIRA PINTO,"146,1",3,"124,0",158,158
344,156(...)01,ISA CAROLINA BELGRANO DOS SANTOS,"146,1",4,"118,5",161,161
345,301(...)84,MIGUEL ALVES CARREIRA,"146,1",2,"98,0",172,172
346,303(...)74,DUARTE MIGUEL ARANHA BATISTA,"146,0",1,"125,5",157,157
347,148(...)31,DAVID LAGES PAIVA,"145,9",3,"155,0",141,141
348,303(...)54,DUARTE FILIPE GONÇALVES RISCADO,"145,9",3,"142,0",148,148
349,302(...)85,INÊS MARIA COSTA NISA,"145,9",4,"129,0",155,155
350,312(...)28,BEATRIZ FILIPA SANTOS MARQUES,"145,8",2,"136,0",151,151
351,303(...)54,CAROLINA MARCELA SIMÕES AMÂNDIO,"145,8",1,"123,0",158,158
352,307(...)11,BRUNO PEREIRA NETO,"145,7",4,"145,0",146,146
353,148(...)45,JOÃO TOMÁS DE MOTA NUNES,"145,7",1,"132,0",153,153
354,312(...)02,EDUARDO ANDRÉ PINTO FERREIRA,"145,7",4,"106,0",167,167
355,152(...)78,RÚBEN PINTO SOUSA,"145,6",4,"156,0",140,140
356,148(...)77,JOÃO MIGUEL DA GAMA MARTINS COELHO,"145,6",4,"117,0",161,161
357,151(...)10,MARCOS AFONSO DA SILVA FREITAS,"145,6",5,"115,0",162,162
358,311(...)55,RODRIGO ALMEIDA NUNES DOS REIS,"145,5",1,"100,0",170,170
359,308(...)88,TIAGO JOSÉ PEREIRA OLIVEIRA,"145,4",3,"133,0",152,152
360,149(...)14,LUCAS BOTELHO CÂMARA,"145,4",2,"114,5",162,162
361,310(...)97,RÚBEN MATOS ARAÚJO,"145,4",1,"109,0",165,165
362,305(...)88,BERNARDO PEREIRA GODINHO,"145,2",2,"125,0",156,156
363,307(...)47,TOMÁS MIGUEL SIMÕES LOPES,"145,1",1,"160,0",137,137
364,302(...)40,BRUNO MIGUEL RESENDE ROCHA,"145,1",5,"136,0",150,150
365,304(...)08,PEDRO RICARDO ZAMBUJO TAVARES,"145,1",2,"121,0",158,158
366,306(...)31,MANUEL BOLOTA CORREIA MONTEIRO MACHADO,"145,1",2,"117,5",160,160
367,148(...)49,ANTÓNIO PEDRO RIBEIRO DOMINGUES,"145,0",2,"130,0",153,153
367,151(...)51,GONÇALO CABRAL CARVALHO,"145,0",5,"130,0",153,153
367,300(...)28,JOSÉ LUIS MARQUES BISPO,"145,0",3,"130,0",153,153
370,308(...)04,DIEGO ANDRE CASIMIRO CARDOSO,"144,9",5,"113,0",162,162
371,312(...)08,FRANCISCO DUARTE DA COSTA,"144,8",1,"148,0",143,143
372,153(...)72,AFONSO DA SILVA MAIA,"144,8",1,"122,0",157,157
373,146(...)53,DINIS MIGUEL BARBOSA DE OLIVEIRA,"144,7",5,"157,0",138,138
374,147(...)98,JOÃO AFONSO HENRIQUES DE SOUSA,"144,7",2,"120,0",158,158
375,302(...)52,MAXIM RYBYUK,"144,6",1,"110,5",163,163
376,220(...)01,DANIEL QUEIROZ CHAGAS,"144,5",4,"125,0",155,155
