Order Number,Parcial Identification Number,Name,Applicant Grade,Option Number,Entrance Test Grade,12th year grade,Average of 11th and 10th grades
1,156(...)91,JOSÉ PEDRO PASSOS BERNARDO,"195,8",4,"199,0",194,194
2,152(...)71,TIMEN ALEXANDRO CANEZ VAN DEN BROEKE,"186,9",4,"194,0",183,183
3,149(...)25,SARA MORGADO DE SOUSA VIEGAS,"186,6",6,"171,0",195,195
4,302(...)18,JOSÉ PEDRO DA COSTA BAGAGEM,"186,4",3,"189,0",185,185
5,315(...)91,TIAGO ANDRÉ PEREIRA TOMÉ,"181,5",1,"188,0",178,178
6,311(...)52,MIGUEL ALEXANDRE ALBUFEIRA ALVITO,"179,6",1,"190,0",174,174
7,307(...)42,RICARDO GUILHERME DELGADO FERNANDES,"179,2",1,"187,0",175,175
8,152(...)63,RAFAEL DOS SANTOS RODRIGUES,"178,9",6,"175,0",181,181
9,152(...)12,MIGUEL GUERREIRO ESTEVES,"178,4",6,"181,0",177,177
10,154(...)04,AFONSO MENDONÇA RIBEIRO,"178,3",6,"175,0",180,180
11,305(...)46,BRUNO JOSÉ CORREIA GONÇALVES,"176,9",2,"186,0",172,172
12,301(...)73,PEDRO SIMAO DOS SANTOS PINTO,"175,4",1,"163,0",182,182
13,303(...)72,JOÃO RAFAEL BATISTA PAIVA,"175,0",5,"188,0",168,168
14,307(...)01,BEATRIZ FILIPA GIL SILVA,"174,0",5,"174,0",174,174
15,306(...)85,NICOLE ALEXANDRA DE CARVALHO E REIS,"173,3",1,"157,0",182,182
16,154(...)79,ÂNGELO JOSÉ NUNES DA FONSECA,"171,7",1,"160,0",178,178
17,303(...)31,TIAGO MIGUEL VIEGAS OLIVEIRA,"171,3",1,"155,0",180,180
18,139(...)30,BERNARDO MANUEL RATO ROSADO RAPOSO,"171,2",4,"151,0",182,182
19,159(...)10,TIAGO FILIPE MARTINS DE JESUS,"170,7",1,"185,0",163,163
20,306(...)90,DAVID DANIEL MOZULENKO GUEDES,"170,3",1,"169,0",171,171
21,307(...)24,RAQUEL ALEXANDRA VIEGAS NUNES,"170,2",1,"163,0",174,174
22,301(...)26,PEDRO EMANUEL SALVADOR DIAS,"167,9",2,"164,0",170,170
23,154(...)04,AFONSO GUILHERME FÉLIX CARVALHO,"167,7",4,"180,0",161,161
24,159(...)31,MIGUEL VALENTIM FERRAMACHO DOS SANTOS,"167,4",3,"157,0",173,173
25,305(...)83,EDUARDO ALEXANDRE SANTOS LUIS,"167,3",1,"179,0",161,161
26,148(...)39,DUARTE DIOGO XAVIER,"167,3",1,"151,0",176,176
27,149(...)01,INÊS AFONSO PEDROSO,"167,2",4,"160,0",171,171
28,154(...)22,JOÃO SOARES DA LUZ,"166,8",4,"157,0",172,172
29,152(...)00,RITA MAGALHÃES BRITO,"166,2",1,"146,0",177,177
30,301(...)20,TIAGO MIGUEL ALVES DOS SANTOS,"165,9",1,"175,0",161,161
31,150(...)92,JOÃO VASCO DA SILVA CABRAL,"165,6",5,"150,0",174,174
32,230(...)33,ARTHUR RIBEIRO DA SILVA,"165,4",6,"155,0",171,171
33,150(...)05,PEDRO FILIPE SABINO CORREIA,"165,0",6,"150,0",173,173
34,303(...)67,GUILHERME DA CRUZ CAMPELOS RODRIGUES NOGUEIRA,"164,5",5,"169,0",162,162
35,308(...)04,DANIEL DOMINGOS BARBOSA,"164,4",1,"154,0",170,170
36,159(...)17,TIAGO FILIPE ANTUNES POEIRA,"164,4",2,"141,0",177,177
37,306(...)27,MIGUEL EUGÉNIO GORGULHO,"163,7",6,"152,0",170,170
38,303(...)97,MARIANA ISABEL BAPTISTA FERREIRA,"162,5",2,"154,0",167,167
39,305(...)53,ABEL FILIPE DE CARVALHO DIAS,"162,1",2,"138,0",175,175
40,159(...)93,DUARTE MIGUEL SILVA MARQUES,"161,7",5,"161,0",162,162
41,306(...)16,ALEXANDRE RODRIGUES DE OLIVEIRA,"161,7",1,"135,0",176,176
41,307(...)52,BEATRIZ VALENTE ALVES,"161,7",4,"135,0",176,176
43,156(...)15,LILIANA MARIA FLORÊNCIO JUNQUEIRA,"161,3",1,"145,0",170,170
44,305(...)85,MAURO FILIPE DOS REIS SIMÕES,"160,7",1,"147,0",168,168
44,313(...)02,ALEXANDRE CORREIA MENINO,"160,7",1,"147,0",168,168
46,314(...)35,RITA MIGUEL PIPA GODINHO,"159,8",5,"150,0",165,165
47,307(...)88,DIOGO MANUEL COSTA DA SILVA,"159,6",1,"168,0",155,155
48,304(...)12,RICARDO ROCHA COSTA,"158,9",6,"142,0",168,168
49,148(...)41,DAVID DIOGO XAVIER,"158,6",1,"130,0",174,174
50,303(...)65,TIAGO MIGUEL LAMPREIA ALVES,"158,4",4,"161,0",157,157
51,151(...)33,JAIME MANUEL CHITONHO VERA CRUZ,"158,1",6,"123,0",177,177
52,301(...)93,DIOGO HENRIQUE FOREID BELAS RUAS,"158,1",3,"95,0",192,192
53,309(...)03,ANDRÉ LUÍS SILVA DIAS ROLLA,"158,0",1,"145,0",165,165
54,314(...)74,MARIN CEPELEAGA,"157,8",6,"148,0",163,163
55,150(...)99,RUI GABRIEL SANTOS BERNARDO,"157,7",1,"170,0",151,151
56,318(...)95,KOSTIANTYN VLADYMYROV,"157,6",6,"129,0",173,173
57,150(...)67,BERNARDO PACHECO CHARNECA,"157,1",3,"161,0",155,155
58,149(...)84,PEDRO BORBA DA COSTA,"156,5",4,"150,0",160,160
58,322(...)67,DANIEL PANTYUKHOV,"156,5",1,"150,0",160,160
60,317(...)57,ADRIANO ARMANDO MUNCACIU,"156,4",1,"131,0",170,170
61,158(...)31,PEDRO NETO MELITA,"156,3",5,"155,0",157,157
62,306(...)30,MARIA BEATRIZ RODRIGUES MACHADO,"156,3",3,"140,0",165,165
63,307(...)95,GUILHERME LOURENÇO ROSA ANTUNES GRAÇA,"156,3",5,"116,0",178,178
64,306(...)06,RICARDO MANUEL VITORIA CAMPANICO,"156,2",1,"138,0",166,166
65,144(...)54,ANA BEATRIZ DE SOUSA DO NASCIMENTO,"156,2",2,"125,0",173,173
66,149(...)61,TIAGO CAVACO VARGUES,"156,1",1,"160,0",154,154
67,301(...)45,PAULO RICARDO VIEGAS RODRIGUES,"156,1",1,"147,0",161,161
68,308(...)42,DAVID GONÇALVES DOMINGOS,"155,9",1,"152,0",158,158
69,154(...)87,GUSTAVO ALEXANDRE MARTINS SEQUEIRA JERONIMO,"155,7",6,"155,0",156,156
70,150(...)48,TIAGO FERNANDES DE BASTOS,"154,9",5,"138,0",164,164
71,308(...)26,TOMÁS GRAÇA ALCOBIA,"154,7",3,"117,0",175,175
72,305(...)63,PEDRO MIGUEL SILVA DIAS,"154,3",2,"140,0",162,162
73,320(...)88,GABRIEL SAVIGNON DE SAVIGNON,"154,2",4,"147,0",158,158
74,152(...)32,GONÇALO DINIS RODRIGUES SANTINHO,"154,2",1,"136,0",164,164
75,230(...)01,ELINE SNIJDER,"153,8",2,"157,0",152,152
76,159(...)64,CRISTIANO REGO CASCARRINHO,"153,7",3,"155,0",153,153
77,311(...)92,RÚBEN CARVALHO BALSAS,"153,7",6,"142,0",160,160
78,154(...)93,DINIS MALHADO VAZ BERNARDO,"153,5",6,"147,0",157,157
79,153(...)88,GONÇALO EMANUEL FERNANDES LOPES,"153,2",5,"146,0",157,157
80,328(...)60,SARA BORGES DE ARAÚJO DOS SANTOS,"152,9",1,"136,0",162,162
81,306(...)54,GUILHERME SARAIVA DA SILVA,"152,6",6,"148,0",155,155
82,304(...)73,RAFAEL DE BRITO ALMEIDA,"152,2",2,"145,0",156,156
83,152(...)25,MIGUEL DELFINO PEREIRA PINTO,"152,1",6,"130,0",164,164
84,301(...)32,ALEXANDRE FERNANDES GRADE,"152,0",2,"137,0",160,160
85,230(...)21,LEONARDO CANTACHINI DE LIMA,"151,9",1,"146,0",155,155
86,305(...)89,GUSTAVO MARTINS CLEMENTE DA SILVA,"151,4",1,"113,0",172,172
87,313(...)87,DAVID ANDRÉ SANTANA,"151,3",1,"148,0",153,153
88,306(...)51,MIGUEL HENRIQUES SIMOES,"151,0",4,"149,0",152,152
89,151(...)10,MARCOS RAFAEL PONTES DE ALMEIDA SABINO,"151,0",1,"138,0",158,158
90,312(...)05,CARLOS SAMUEL LEITE BATISTA,"150,9",2,"134,0",160,160
91,230(...)04,NARCIS GABRIEL MOCIRAN,"150,7",5,"137,0",158,158
92,309(...)10,TOMÁS MIGUEL VENTURA MELO,"149,9",2,"131,0",160,160
93,231(...)01,GUSTAVO QUEIROZ DA COSTA,"149,7",2,"136,0",157,157
94,152(...)07,RODRIGO MARIA GRANADEIRO RAMOS,"149,5",6,"117,0",167,167
95,305(...)66,GUILHERME ALEXANDRE COSTA SANTOS,"149,4",4,"137,0",156,156
96,308(...)10,BRANDON ANTONIO CORREIA MEJIA,"149,2",1,"103,0",174,174
97,154(...)42,NUNO FILIPE FERNANDES DE MOURA,"148,5",1,"114,0",167,167
98,159(...)52,DANIEL FILIPE SERRANO RIBEIRO,"148,3",3,"119,0",164,164
99,305(...)69,MARIA ANA FILIPE CARVALHO,"148,1",6,"98,0",175,175
100,300(...)65,IVO MATOS TEIXEIRA,"148,0",3,"107,0",170,170
101,230(...)10,ISAQUE DE OLIVEIRA CAPRA,"147,9",6,"131,0",157,157
102,154(...)63,DIOGO ANDRÉ FILIPE RODRIGUES FERREIRA,"147,6",5,"130,0",157,157
103,304(...)05,JOAQUIM SALVADOR DA LUZ MENDES,"147,5",1,"128,0",158,158
104,151(...)64,TOMÁS DOS SANTOS MACHADO,"147,3",1,"146,0",148,148
105,307(...)70,VALENTIM MANUEL SILVA RAMOS,"147,0",5,"121,0",161,161
106,230(...)04,GEORGE GABRIEL CORBU,"146,9",1,"115,0",164,164
107,316(...)94,LEONARDO ANDRONESI,"146,5",1,"166,0",136,136
108,153(...)45,ANA MARGARIDA FRÓIS GOMES,"145,7",2,"119,0",160,160
109,149(...)48,VICENTE ALEIXO PICANÇO HENRIQUES VAZ,"145,3",1,"142,0",147,147
110,308(...)34,CAROLINA MARREIROS COSTA,"145,3",5,"105,0",167,167
111,159(...)84,FRANCISCO LUIS DA SILVA MELO,"145,0",2,"130,0",153,153
112,150(...)53,JOÃO MIGUEL GUERREIRO COELHO,"144,9",1,"139,0",148,148
113,152(...)18,BRUNO GONÇALVES HORTA,"144,9",3,"126,0",155,155
114,157(...)52,GUILHERME BEIRA SALVADOR,"144,8",4,"135,0",150,150
115,150(...)02,MIGUEL FELGUEIRAS AZEVEDO,"144,7",4,"107,0",165,165
116,154(...)67,BERNARDO VIEIRA HENRIQUES,"144,5",4,"112,0",162,162
117,305(...)57,MATILDE FERREIRA QUITÉRIO,"144,4",4,"106,0",165,165
118,158(...)39,AFONSO PINHEIRO SILVA BUSATORI,"144,0",3,"129,0",152,152
119,304(...)76,RODRIGO CONSTANTE SIMÕES,"143,8",6,"147,0",142,142
120,304(...)27,RAFAEL BARÃO DA SILVA,"143,7",5,"119,0",157,157
121,302(...)44,DINIS FARRAJOTA CORDEIRO,"143,6",4,"126,0",153,153
122,140(...)01,JOÃO PEDRO ALVES SOARES,"143,2",1,"112,0",160,160
123,302(...)33,DANIEL FILIPE VENTURA SANTANA,"143,1",3,"119,0",156,156
124,301(...)61,SIMÃO RODRIGUES SANTOS ZAMBUJO,"142,9",6,"111,0",160,160
125,153(...)72,FRANCISCO JOSÉ REIS DE OLIVEIRA,"142,7",6,"103,0",164,164
126,149(...)70,AFONSO BERNARDO BAPTISTA MONTEIRO,"142,6",4,"127,0",151,151
127,154(...)90,MARTIM RODRIGUES ANDRÉ,"142,4",4,"106,0",162,162
128,307(...)98,LUCAS DUARTE AMARAL DOS SANTOS,"142,3",6,"126,0",151,151
129,306(...)81,DUARTE RIBEIRO DE ALMEIDA LOPES JUNQUEIRA,"141,7",6,"141,0",142,142
130,151(...)39,JOÃO PEDRO SEROL FITAS,"141,6",3,"139,0",143,143
131,306(...)73,BEATRIZ MARIA CANHOTO CALDEIRINHA,"141,4",4,"131,0",147,147
132,304(...)38,GUSTAVO GUERREIRO SILVA,"140,9",1,"98,0",164,164
133,305(...)40,RUI PEDRO RODRIGUES ANDREZ,"140,8",6,"131,0",146,146
134,153(...)13,TIAGO PEREIRA AFONSO,"140,3",1,"111,0",156,156
135,150(...)20,NUNO TOMÁS CORREIA ARSÉNIO,"140,2",5,"133,0",144,144
136,304(...)09,PAULO PEREIRA GUERREIRO SALVADOR,"140,1",2,"103,0",160,160
137,303(...)33,TIAGO MENDES CAMPOS,"140,0",4,"138,0",141,141
138,158(...)69,THOMAS TRINCHEIRAS SOARES,"140,0",3,"112,0",155,155
139,304(...)68,TIAGO JOSÉ VIEIRA TEIXEIRA,"139,5",1,"107,0",157,157
140,155(...)52,LUCAS ANDRÉ CONCEIÇÃO CRUZ,"139,3",1,"125,0",147,147
141,306(...)65,JULIANA MARIA GIL FERREIRA,"139,2",4,"119,0",150,150
141,313(...)88,ALEXANDRE FELICIANO PEREIRA,"139,2",4,"119,0",150,150
143,305(...)13,PEDRO AFONSO MORGADO RODRIGUES,"138,8",5,"118,0",150,150
144,304(...)08,SOFIA CORREIA ALMEIDA OLIVEIRA,"138,4",4,"102,0",158,158
145,230(...)39,MATHEUS MARTINS OLIVEIRA,"138,3",3,"124,0",146,146
146,230(...)03,DANIEL XIMENES COELHO FILHO,"138,3",5,"111,0",153,153
147,318(...)93,MAXIMO MIKHYEYEV,"138,3",1,"109,0",154,154
148,151(...)79,ANDRÉ MIGUEL CORREIA DE SOUSA,"138,3",1,"98,0",160,160
149,306(...)36,LUÍS GUILHERME AFONSO DIAS,"138,1",2,"116,0",150,150
150,330(...)38,ARTHUR ALEXANDRE LANNES DE PAIVA CHAVES,"138,0",5,"110,0",153,153
151,309(...)62,GUILHERME CANÁRIO SILVESTRE,"137,9",3,"132,0",141,141
152,153(...)47,ALEXANDRE MIGUEL GUERRA MACHADO,"137,9",3,"108,0",154,154
153,306(...)32,PEDRO MIGUEL DA SILVA CARMO,"137,8",4,"128,0",143,143
154,306(...)25,RENATO LOUREIRO MIRANDA,"137,7",2,"111,0",152,152
155,304(...)98,DAVID GABRIEL CORREIA SILVESTRE,"137,6",1,"120,0",147,147
156,230(...)03,PEDRO HENRIQUE TAVEIRA DE CARVALHO ALVES,"137,5",6,"131,0",141,141
157,300(...)83,DANIELA BRANCO GOMES,"137,3",5,"95,0",160,160
157,306(...)73,TOMÁS CORREIA NUNES,"137,3",1,"95,0",160,160
159,150(...)20,RICARDO FILIPE FERREIRA SILVESTRE,"137,2",6,"106,0",154,154
160,302(...)66,RUI PEDRO CAIXEIRO CERQUEIRA,"137,0",6,"135,0",138,138
161,151(...)84,LEONOR MARIA MAIA CHIBELES,"137,0",2,"111,0",151,151
162,311(...)64,LUÍS GABRIEL TELES SOUSA,"136,6",3,"106,0",153,153
163,146(...)65,MANUEL ANTÓNIO FERREIRA FREITAS,"136,4",3,"126,0",142,142
164,304(...)25,BERNARDO CANDEIAS PEDRO,"136,3",3,"109,0",151,151
165,153(...)35,SELMA DA CRUZ SOUSA PONTES,"136,1",6,"114,0",148,148
166,153(...)75,GONÇALO FILIPE DE SOUSA GONÇALVES,"135,8",2,"128,0",140,140
167,306(...)11,RODRIGO GIL PEREIRA,"135,2",5,"102,0",153,153
168,312(...)37,ALEXANDRE CORREA GIL,"135,1",4,"111,0",148,148
169,305(...)47,DIOGO MIGUEL MARQUES MESTRE,"135,1",3,"100,0",154,154
170,150(...)18,MARIANA ALVES BARBOSA ROSA,"135,0",2,"96,0",156,156
170,304(...)05,AFONSO NUNES GRAÇA,"135,0",3,"96,0",156,156
172,303(...)05,MIGUEL MIRANDA REBOUÇO,"134,9",5,"105,0",151,151
173,151(...)99,VASCO MOURÃO HILÁRIO,"134,6",6,"117,0",144,144
173,314(...)49,VICTOR MANUEL GOMES CORREIA,"134,6",6,"117,0",144,144
175,158(...)88,MIGUEL ALEXANDRE FELÍCIA ROCHA,"134,4",6,"135,0",134,134
176,152(...)54,SIMÃO CANDEIAS VAN DE POLL,"134,4",1,"124,0",140,140
177,152(...)17,DINIS FILIPE CARREIRA COSTA,"134,4",4,"111,0",147,147
178,150(...)48,MARIA TOSCANO GOMES,"134,0",1,"119,0",142,142
179,305(...)26,LUCAS ROCHA BREA,"133,8",1,"100,0",152,152
180,301(...)72,FÁBIO ANDRÉ BIDARRA HORTA,"133,7",5,"122,0",140,140
181,153(...)96,DIOGO BRITO DA PALMA,"133,5",1,"99,0",152,152
182,310(...)26,ANTÓNIO NOBRE GOTE DE SOUSA MATOSO,"133,2",3,"102,0",150,150
183,157(...)57,ANDRÉ HENRIQUES FIGUEIRA,"133,1",3,"96,0",153,153
184,158(...)54,BEATRIZ MESTRE RODRIGUES,"133,0",3,"105,0",148,148
185,306(...)02,DANIEL FILIPE BALSAS CAMOESAS,"132,7",1,"95,0",153,153
186,230(...)14,RAUL VASILE GEORGIAN JURJ,"132,5",2,"98,0",151,151
187,300(...)42,FRANCISCO COUTINHO GUERREIRO,"132,4",3,"109,0",145,145
188,153(...)32,ALEXANDRE CORREIA GONÇALVES,"132,2",1,"127,0",135,135
189,230(...)10,RODRIGO YING,"132,1",4,"123,0",137,137
190,157(...)84,TIAGO ROBERTO EPALANGA,"132,1",3,"95,0",152,152
191,300(...)05,TIAGO FILIPE PIRES VIEIRA,"131,4",1,"132,0",131,131
192,301(...)90,TIAGO MIGUEL ROSA RODRIGUES,"131,4",2,"108,0",144,144
193,147(...)36,ÂNGELO MIGUEL HOLOVRYAK LANÇA TERESA,"131,4",2,"106,0",145,145
193,151(...)58,GUILHERME GROMICHO CONDE,"131,4",5,"106,0",145,145
195,149(...)31,LUCAS NEVES PEREIRA,"131,3",3,"115,0",140,140
195,302(...)39,RICARDO SANTOS ESTÊVÃO,"131,3",1,"115,0",140,140
197,302(...)04,CAROLINA MARIA RODRIGUES MONTEIRO GONÇALVES,"131,2",4,"100,0",148,148
198,153(...)02,BRUNO MIGUEL CUPERTINO PALMA RODEIA,"131,1",5,"96,0",150,150
199,154(...)67,RODRIGO ANDRÉ CORREIA LINHAS,"130,4",1,"107,0",143,143
200,308(...)39,RICARDO PALMIRA BACALHAU,"130,0",6,"102,0",145,145
201,311(...)39,GUILHERME AMANTE VIANA,"129,7",1,"105,0",143,143
202,153(...)45,GUILHERME JOSE FERREIRA BENTO MACHADO DE JESUS,"129,5",6,"95,0",148,148
203,305(...)94,RAFAEL DINIS LOURENÇO RODRIGUES,"129,3",4,"100,0",145,145
204,314(...)37,CAROLINA VICENTE SIMÕES,"129,2",3,"96,0",147,147
205,300(...)57,RAFAEL ALEXANDRE PORTÁSIO SOARES,"128,9",5,"125,0",131,131
206,301(...)75,SOFIA NOVAIS BRAZIO CAEIRO CHAMBEL,"128,7",6,"104,0",142,142
207,301(...)49,DIOGO ALEXANDRE SANTIAGO FIALHO,"128,3",2,"99,0",144,144
208,308(...)48,FRANCISCO CHAMIÇA DIAS VENÂNCIO LEÃO,"128,2",2,"95,0",146,146
209,150(...)57,PEDRO DE MATOS BANAZOL CARAPETO,"128,0",1,"115,0",135,135
210,306(...)80,MIGUEL CRISTOVÃO BÁRBARA LIBÂNIO,"127,9",4,"98,0",144,144
211,147(...)76,NICIA FILIPA SILVA JESUS,"127,4",1,"115,0",134,134
212,309(...)47,TIAGO FILIPE GUILHERMINO LOPES,"127,1",4,"116,0",133,133
213,306(...)88,GUILHERME ALEXANDRE AURÉLIO GUERREIRO,"126,9",5,"108,0",137,137
214,152(...)30,LEANDRO DA SILVA REI,"126,7",4,"100,0",141,141
215,315(...)36,SIMÃO NARCISO GONÇALVES,"126,5",1,"107,0",137,137
216,230(...)11,SANJOG KANDEL,"126,4",1,"129,0",125,125
217,314(...)14,DANIEL PEDRO ABEL GONÇALVES,"126,2",1,"95,0",143,143
218,301(...)63,BRUNO FILIPE ROSA ORTIZ,"125,4",2,"115,0",131,131
219,305(...)57,SIMÃO RAFAEL CAVACO SOUSA,"125,3",1,"96,0",141,141
220,304(...)74,FRANCISCO DOS SANTOS DUARTE BATALHA,"124,9",3,"106,0",135,135
221,156(...)24,MIGUEL PLES,"124,8",4,"115,0",130,130
222,146(...)40,MARGARIDA SANTOS LAPA,"124,6",5,"96,0",140,140
223,154(...)62,MIGUEL DUARTE TRINDADE VENÂNCIO,"124,3",4,"95,0",140,140
224,149(...)88,DIEGO HENRIQUE TAVARES DE MATOS,"123,9",1,"107,0",133,133
225,308(...)26,ALEXANDRE URSU,"123,8",5,"103,0",135,135
226,154(...)20,RAFAEL EFIGÉNIO DA PALMA SANTOS,"123,0",1,"95,0",138,138
226,312(...)53,MARIA SILVA DE CARVALHO,"123,0",3,"95,0",138,138
228,147(...)22,RICARDO AFONSO RIBEIRO,"122,6",6,"118,0",125,125
229,306(...)33,RENATO CORVO CHUMBINHO,"122,4",1,"97,0",136,136
230,154(...)40,DANIEL ALEXANDRE FERNANDES BATISTA,"121,1",2,"112,0",126,126
231,153(...)16,DIOGO ROBERTO CAMPOS DOMINGUES,"121,0",4,"108,0",128,128
232,148(...)74,AFONSO RODRIGO NÓBREGA DA FONSECA,"120,4",5,"95,0",134,134
233,312(...)97,MARTIM LOURENÇO NUNES,"119,7",5,"95,0",133,133
234,230(...)30,BIBEK GNAWALI,"119,1",2,"97,0",131,131
235,157(...)75,RENATA RODRIGUES DOS SANTOS,"119,1",3,"95,0",132,132
236,154(...)25,NUNO FILIPE CONCEIÇÃO SAUDE,"118,0",1,"105,0",125,125
237,310(...)70,RICARDO DIAS GUILHERME,"116,8",1,"96,0",128,128
238,159(...)63,DIOGO MIRANDA MONTEIRO,"115,9",4,"99,0",125,125
239,302(...)17,TITO LUIS MARTINS CARVALHEIRA,"114,6",1,"97,0",124,124
240,301(...)04,JOÃO PEDRO FREIRE MATOS,"113,5",1,"107,0",117,117
