743,306(...)20,RAFAEL MEDEIROS FERREIRA,"160,2",1,"129,0",177,177
744,150(...)20,GABRIEL SANTIAGO ENCARNAÇÃO DA COSTA,"160,2",1,"127,0",178,178
744,300(...)80,EDUARDO ALEXANDRE ALCOBIA TIMÓTEO,"160,2",3,"127,0",178,178
746,308(...)04,JOÃO FILIPE DA SILVA FIGUEIREDO,"160,1",1,"112,0",186,186
747,304(...)58,HUGO HENRIQUE COELHO ARAÚJO,"160,0",5,"158,0",161,161
748,150(...)85,YOUNÉS ANDRÉ MARQUES DE ALMEIDA BOUAYAD,"160,0",1,"147,0",167,167
749,153(...)40,RAFAEL ANTÓNIO GONÇALVES TEIXEIRA,"160,0",1,"145,0",168,168
749,306(...)56,PEDRO EDUARDO REBELO FERNANDES,"160,0",1,"145,0",168,168
751,306(...)71,MÓNICA ANDREIA LOPES SIMÕES,"160,0",2,"134,0",174,174
752,153(...)42,MARTIM MARIA DA SILVA,"160,0",1,"108,0",188,188
753,230(...)39,RAPHAEL YOSHIO BARBOSA DOS SANTOS KUWAE,"159,9",1,"169,0",155,155
754,150(...)26,LORENZO PERRY SAMPAIO AFONSO SIMONELLA,"159,9",4,"154,0",163,163
755,306(...)81,GABRIEL BRANCO RAMOS,"159,9",1,"130,0",176,176
756,304(...)31,FRANCISCO LEMOS DA SILVA,"159,8",1,"165,0",157,157
757,307(...)83,IVO DE ANTUNES DINIS,"159,8",3,"126,0",178,178
758,149(...)29,GONÇALO LOPES DO VALE,"159,7",1,"148,0",166,166
758,304(...)39,RODRIGO ALEXANDRE COELHO DA SILVA,"159,7",2,"148,0",166,166
760,304(...)10,TIAGO JOSÉ DA SILVA PONTES,"159,7",1,"146,0",167,167
761,303(...)38,JOÃO AFONSO MARINHO PINTO,"159,5",2,"151,0",164,164
762,305(...)14,PEDRO AFONSO DE MORAIS,"159,5",2,"138,0",171,171
762,306(...)46,FRANCISCO DINIS SANTOS LIMA,"159,5",1,"138,0",171,171
764,158(...)76,LEONEL ELIAS MACHADO E SILVA,"159,5",2,"127,0",177,177
765,313(...)47,MARIA EDUARDA OLIVEIRA DE MAGALHÃES,"159,5",5,"125,0",178,178
766,303(...)22,PEDRO NOGUEIRA FERREIRA,"159,4",1,"149,0",165,165
767,306(...)16,ALEXANDRE MIGUEL ALVES FIDALGO,"159,4",3,"147,0",166,166
768,300(...)70,GONÇALO LOPES FIGUEIREDO PAIXÃO,"159,4",1,"136,0",172,172
769,149(...)55,DANY PINHEIRO MONTEIRO,"159,4",1,"121,0",180,180
770,150(...)54,MARGARIDA NETO MARTINS,"159,3",1,"158,0",160,160
771,306(...)17,MARCO PAULO GONÇALVES FERREIRA,"159,3",1,"145,0",167,167
772,300(...)52,FÁBIO DANIEL DOS SANTOS MARTINHO,"159,3",2,"130,0",175,175
773,155(...)72,GONÇALO OLIVEIRA BARBOSA,"159,2",2,"152,0",163,163
774,150(...)30,CARLOS AFONSO RIBAS CUNHA,"159,2",1,"139,0",170,170
774,313(...)02,LUIS PAULO TEIXEIRA OLIVEIRA,"159,2",1,"139,0",170,170
776,314(...)91,DIOGO ALMEIDA VENTURA,"159,2",1,"128,0",176,176
777,154(...)63,HUGO DE TORRES MONTEIRO,"159,1",2,"137,0",171,171
778,301(...)59,RODRIGO RAMOS MOREIRA LOUREIRO,"159,0",4,"146,0",166,166
779,154(...)61,HUGO AFONSO DE TAVARES LOPES,"159,0",1,"131,0",174,174
780,157(...)76,JOÃO MIGUEL BORGES NEVES,"158,9",1,"153,0",162,162
781,308(...)41,VASCO COSTA OSIECKI DE CARVALHO,"158,8",4,"162,0",157,157
782,149(...)23,MADALENA MESQUITA CEREJEIRA AMARO DIOGO,"158,8",1,"149,0",164,164
783,158(...)67,GUILHERME DÍNIS ROCHA DA CUNHA,"158,8",1,"138,0",170,170
784,154(...)54,INÊS GONÇALVES COIMBRA,"158,8",1,"125,0",177,177
785,154(...)17,PAULO HENRIQUE MONIZ CARIDADE,"158,6",2,"156,0",160,160
786,306(...)09,GUSTAVO DA SILVA FARIA,"158,6",2,"130,0",174,174
787,302(...)00,EDUARDO CLEMENTE CARDOSO,"158,6",1,"128,0",175,175
788,312(...)12,EDUARDO GOMES MOREIRA PINTO RAMOS,"158,6",1,"115,0",182,182
789,312(...)23,ARTUR RAFAEL DA ROCHA MOREIRA,"158,5",1,"150,0",163,163
790,148(...)90,RODRIGO PAIM FARIA,"158,5",2,"137,0",170,170
791,300(...)51,TIAGO MÁXIMO DURÃES,"158,5",1,"111,0",184,184
792,159(...)28,JOÃO ÁLVARO OLIVEIRA DURÃES,"158,4",2,"148,0",164,164
792,312(...)93,RODRIGO NETO DA COSTA,"158,4",1,"148,0",164,164
794,301(...)60,MÁRIO ALEXANDRE SANTOS DE FARIA,"158,4",6,"135,0",171,171
794,310(...)45,SALVADOR REI DE CARVALHO FIDALGO DA SILVA,"158,4",1,"135,0",171,171
796,312(...)60,FRANCISCO STANISLAU MOREIRA MARTINS TEIXEIRA,"158,4",1,"133,0",172,172
797,313(...)10,TIAGO JOSÉ OLIVEIRA BORGES,"158,3",1,"116,0",181,181
797,315(...)90,GUILHERME MARQUES PEREIRA,"158,3",1,"116,0",181,181
799,150(...)88,VASCO GONÇALVES NETO,"158,2",2,"179,0",147,147
800,153(...)56,FÁBIO GABRIEL MOREIRA RODRIGUES,"158,2",4,"164,0",155,155
801,305(...)32,VASCO MARTINS COTA,"158,2",5,"153,0",161,161
801,305(...)80,RUI PEDRO PEREIRA SERRA,"158,2",1,"153,0",161,161
803,150(...)03,RODRIGO ROCHA MIRANDA,"158,2",2,"140,0",168,168
804,303(...)36,LEONARDO PINTO LOURENÇO,"158,2",2,"127,0",175,175
805,152(...)09,ALEX CARVALHO PEREIRA,"158,2",1,"125,0",176,176
805,159(...)76,RUI PEDRO VIEIRA MACHADO,"158,2",1,"125,0",176,176
807,309(...)15,RAFAEL GOMES CALVO,"158,1",1,"147,0",164,164
808,153(...)41,SALVADOR GARCIA DA SILVA GOMES,"158,0",2,"158,0",158,158
809,150(...)60,PEDRO MIGUEL CARVALHO CASTRO ROCHA,"158,0",1,"145,0",165,165
809,304(...)53,GONÇALO FREITAS RIBEIRO,"158,0",4,"145,0",165,165
809,307(...)25,ANDRÉ BARROS REIS,"158,0",1,"145,0",165,165
812,149(...)19,JOÃO PEDRO SIMÕES RAPOSO MIRANDA,"157,9",2,"126,0",175,175
813,154(...)36,JOAO ANTONIO ANTUNES NATALIO,"157,8",4,"148,0",163,163
814,159(...)93,LUÍS ANDRÉ NUNES MORAIS,"157,8",1,"135,0",170,170
815,309(...)72,GONÇALO MAIA VIEIRA,"157,6",2,"153,0",160,160
816,303(...)96,SOFIA GUIMARÃES FERREIRA MENDES GAMITO,"157,6",5,"129,0",173,173
817,158(...)19,MARGARIDA LOUREIRO DA SILVA MOREIRA RAMIRO,"157,6",4,"127,0",174,174
817,307(...)89,RÚBEN DA CRUZ SANTIAGO FERREIRA,"157,6",4,"127,0",174,174
819,154(...)13,ANTÓNIO TOMÁS MERGULHÃO COSTA OLIVEIRA,"157,5",1,"164,0",154,154
820,309(...)58,ANA RAQUEL RIBEIRO CARVALHO,"157,5",1,"138,0",168,168
821,303(...)58,ANA RITA DA SILVA CORREIA,"157,5",2,"125,0",175,175
822,306(...)64,LUÍS FILIPE CARVALHO MIGUEL,"157,4",2,"147,0",163,163
823,159(...)09,ANDRÉ NOGUEIRA DA SILVA,"157,4",1,"145,0",164,164
824,311(...)45,DANIELA PACHECO MONTEIRO,"157,4",3,"132,0",171,171
825,304(...)36,GONÇALO JOSÉ COSTA SILVA,"157,3",1,"141,0",166,166
826,157(...)79,DIOGO PINTO GONÇALVES,"157,3",2,"115,0",180,180
827,158(...)19,JOHNNY RIBEIRO PEDROSA,"157,2",1,"165,0",153,153
828,307(...)30,JOÃO PEDRO AUGUSTO PALMEIRO,"157,2",1,"152,0",160,160
829,151(...)05,SARA RAQUEL BAPTISTA FLÓRIDO,"157,2",3,"150,0",161,161
830,304(...)11,AFONSO MARTIM CARVALHO LEITE,"157,2",3,"139,0",167,167
831,302(...)73,RODRIGO DE FARIA NOVAIS,"157,2",2,"126,0",174,174
832,156(...)23,MARIA JOÃO ROCHA RAMOS,"157,1",1,"135,0",169,169
833,307(...)46,FILIPE CRUZ FILIPE,"157,0",1,"155,0",158,158
834,154(...)78,LUÍS MIGUEL RIBEIRO DA SILVA RODRIGUES,"156,9",1,"151,0",160,160
835,159(...)65,FILIPE DANIEL SALGADO SIMÕES,"156,9",2,"140,0",166,166
836,151(...)89,TOMÁS PINHEIRO SAMPAIO,"156,8",4,"149,0",161,161
837,303(...)81,TIAGO LOURENÇO AZEVEDO CARDOSO DA CUNHA,"156,8",2,"121,0",176,176
837,306(...)72,IVAN MIGUEL OLIVEIRA COSTA,"156,8",1,"121,0",176,176
839,302(...)70,GONÇALO RIBEIRO PAIVA,"156,7",2,"156,0",157,157
840,303(...)73,ANDRÉ MIGUEL SIMÃO CUNHA,"156,7",4,"145,0",163,163
841,157(...)97,DIOGO FÉLIX MOURA RODRIGUES REMELGADO,"156,7",3,"132,0",170,170
842,302(...)04,TIAGO FILIPE MARQUES DURAES,"156,6",4,"165,0",152,152
843,312(...)90,JOSÉ PEDRO VIEIRA BARBOSA,"156,6",2,"126,0",173,173
844,150(...)56,DAVID SILVA MARTINS,"156,5",3,"161,0",154,154
845,149(...)84,PEDRO BORBA DA COSTA,"156,5",3,"150,0",160,160
846,306(...)20,GONÇALO MONTEIRO FERREIRA,"156,5",4,"137,0",167,167
847,307(...)51,TIAGO MANUEL ALVES CORREIA,"156,4",2,"159,0",155,155
848,317(...)57,ADRIANO ARMANDO MUNCACIU,"156,4",4,"131,0",170,170
849,304(...)45,PEDRO GABRIEL BARBOSA DA ROCHA,"156,2",1,"162,0",153,153
850,149(...)61,BERNARDO SOUSA CRAVEIRO,"156,2",1,"138,0",166,166
850,306(...)36,JOÃO FERREIRA SANTOS PINTO,"156,2",1,"138,0",166,166
850,310(...)36,TOMÁS BERNARDES PEREIRA,"156,2",1,"138,0",166,166
853,152(...)94,JOÃO MANUEL PEREIRA GOMES DE AMORIM,"156,2",1,"136,0",167,167
853,153(...)59,SEBASTIÃO CÉSAR FREITAS,"156,2",1,"136,0",167,167
853,314(...)75,GONÇALO NUNO MACHADO MONTEIRO,"156,2",1,"136,0",167,167
856,306(...)20,PEDRO SIMÃO VALENTE SOUSA,"156,1",1,"145,0",162,162
857,307(...)47,MIGUEL AFONSO BESSA RIBEIRO PEREIRA PEDROSA,"155,9",2,"165,0",151,151
858,308(...)20,ANA RITA BARRETO DOS SANTOS,"155,9",4,"126,0",172,172
858,314(...)32,JOÃO PEDRO ALMEIDA SILVA,"155,9",6,"126,0",172,172
860,157(...)81,DANIEL BOIAN ZAMURCA,"155,8",1,"148,0",160,160
861,305(...)98,AFONSO MARIA NOGUEIRA BERNARDO FONSECA PAIVA,"155,8",1,"135,0",167,167
861,315(...)18,GUILHERME AUGUSTO DE MIRANDA E REBELO DA SILVA,"155,8",3,"135,0",167,167
863,307(...)78,MANUEL TOMÁS OLIVEIRA MONTEIRO,"155,7",1,"129,0",170,170
864,315(...)35,DIOGO CAMPOS DOS SANTOS,"155,7",4,"116,0",177,177
865,301(...)01,RICARDO MILHAZES DE SOUSA,"155,6",2,"138,0",165,165
866,314(...)07,RUI MIGUEL CASTRO MENDES,"155,6",1,"112,0",179,179
867,304(...)27,FRANCISCO SILVEIRA RODRIGUES,"155,5",2,"175,0",145,145
868,315(...)86,RENATO JOSÉ FERNANDES OLIVEIRA,"155,5",1,"136,0",166,166
869,304(...)65,GONÇALO DA SILVA JARDIM,"155,4",6,"104,0",183,183
870,302(...)34,DUARTE NETO OLIVEIRA DA SILVA,"155,2",6,"150,0",158,158
871,148(...)51,INÊS MARIA MARQUES DELGADO,"155,2",1,"135,0",166,166
872,152(...)12,ALEXANDRE RAFAEL SOARES TEIXEIRA,"155,2",1,"109,0",180,180
872,156(...)54,RUI MIGUEL PINTO MOUTINHO,"155,2",4,"109,0",180,180
874,309(...)76,RAFAEL GOMES DA COSTA,"155,1",1,"159,0",153,153
875,152(...)57,TIAGO ALEXANDRE VITORIA SALGUEIRO,"155,1",4,"146,0",160,160
875,152(...)90,DIOGO MANUEL MESQUITA CUNHA,"155,1",6,"146,0",160,160
877,307(...)98,LUÍS MIGUEL QUEIRÓS NUNES,"155,1",6,"133,0",167,167
878,150(...)17,GONÇALO CERQUEIRA DOS SANTOS,"155,0",1,"140,0",163,163
879,148(...)94,MARIANA FILIPA MAGALHÃES PERFEITO LEITÃO,"155,0",3,"127,0",170,170
880,159(...)60,TIAGO PEREIRA DE MELO,"155,0",1,"116,0",176,176
881,153(...)44,ANTÓNIO MIGUEL CUNHA MONTEIRO,"154,9",1,"151,0",157,157
882,305(...)49,AFONSO DIONÍSIO PEREIRA,"154,9",1,"138,0",164,164
883,313(...)64,ROBERTO AFONSO ALVES MOTA,"154,9",3,"136,0",165,165
884,152(...)57,JOÃO ANTÓNIO VON HAFE GARCIA DA CUNHA,"154,9",5,"110,0",179,179
885,307(...)13,RODRIGO JOSÉ FORTUNA ALVES,"154,8",4,"95,0",187,187
886,157(...)56,TIAGO RAFAEL LIMA CRUZ,"154,7",6,"128,0",169,169
887,154(...)49,RODRIGO SANTOS ARAÚJO,"154,6",1,"150,0",157,157
888,154(...)01,JORGE MIGUEL MONTEIRO COELHO,"154,6",1,"139,0",163,163
889,316(...)83,JOÃO FERNANDO MENDES DA FONSECA,"154,6",2,"126,0",170,170
890,150(...)13,FILIPE MOITOSO MARQUES,"154,5",2,"159,0",152,152
891,310(...)86,DAVID MARTINS CORREIA,"154,5",5,"120,0",173,173
892,307(...)76,GUILHERME DOMINGUES ANDRADE,"154,4",1,"170,0",146,146
893,153(...)34,DIOGO SANTOS CORREIA DE LACERDA,"154,4",1,"142,0",161,161
893,304(...)04,ANTÓNIO SÉRGIO SILVA FERREIRA,"154,4",1,"142,0",161,161
895,307(...)80,JOSÉ MIGUEL RIBEIRO PEREIRA,"154,3",2,"151,0",156,156
895,308(...)76,GONÇALO MONTEIRO BAILÃO GONÇALVES TEIXEIRA,"154,3",2,"151,0",156,156
897,151(...)01,HENRIQUE MIGUEL CARVALHO DIAS DE MATOS,"154,3",4,"140,0",162,162
897,302(...)07,MAFALDA SOFIA MIRANDA PINTO,"154,3",4,"140,0",162,162
897,305(...)74,VITOR HUGO MARQUES CARNEIRO,"154,3",1,"140,0",162,162
897,306(...)46,IVO MAXIMIANO ALBUQUERQUE REGUEIRAS,"154,3",6,"140,0",162,162
897,321(...)94,PATRICK DIAS MENDES DA COSTA,"154,3",1,"140,0",162,162
902,306(...)81,RICARDO CABRAL APARICIO,"154,3",2,"125,0",170,170
903,304(...)42,MATILDE MORAIS MARABUTO,"154,2",3,"123,0",171,171
904,150(...)79,RODRIGO CONROY NUNES,"154,1",1,"158,0",152,152
905,310(...)08,TIAGO JOÃO BRAGA PEREIRA,"154,1",2,"132,0",166,166
906,314(...)80,SEBASTIÃO JOSÉ MOTA AIRES FUTURO DA SILVA,"154,1",3,"106,0",180,180
907,304(...)15,RAFAEL ALVES DOS SANTOS,"154,0",4,"139,0",162,162
908,305(...)28,DIOGO ALEXANDRE MARTINS FRAGA,"153,9",1,"137,0",163,163
909,150(...)72,JOAO BERNARDO LAGO LIMA,"153,9",2,"135,0",164,164
910,152(...)70,RUI PEDRO QUEIROZ DE SOUSA,"153,9",5,"122,0",171,171
911,306(...)91,PEDRO DE SOUSA RUA SANTOS COSTA,"153,8",1,"170,0",145,145
912,152(...)71,DIOGO ALEXANDRE MARTINS LEAL,"153,8",1,"146,0",158,158
912,153(...)24,JOAO MIGUEL SOUSA DA SILVA VIANA,"153,8",1,"146,0",158,158
914,146(...)43,ANDRÉ MARTINS PEREIRA,"153,8",1,"131,0",166,166
915,150(...)06,MARIA JOSÉ FIGUEIREDO FONTE RAMOS,"153,7",1,"155,0",153,153
916,304(...)61,NUNO FILIPE BARROS DE SÁ,"153,7",1,"142,0",160,160
917,157(...)39,RÚBEN AMORIM BRAGA PEREIRA,"153,7",5,"129,0",167,167
918,306(...)15,CARLOS EDUARDO ARRAIS REIS,"153,6",5,"175,0",142,142
919,156(...)95,MIGUEL DA SILVA CORREIA,"153,6",1,"110,0",177,177
920,156(...)49,MARIA BEATRIZ VASQUES DE MAGALHÃES,"153,5",3,"95,0",185,185
921,313(...)21,BEATRIZ PINHEIRO OLIVEIRA,"153,4",1,"130,0",166,166
922,313(...)02,HÉLIA SOFIA RIBEIRO AMORIM,"153,4",1,"128,0",167,167
923,310(...)73,VITOR JORGE DE JESUS MAIO,"153,4",1,"117,0",173,173
924,304(...)78,PEDRO MIGUEL GONÇALVES SOARES,"153,3",1,"163,0",148,148
925,301(...)29,RÚBEN DA SILVA UTH,"153,2",2,"172,0",143,143
926,153(...)88,GONÇALO EMANUEL FERNANDES LOPES,"153,2",2,"146,0",157,157
926,331(...)51,MARCELO AUGUSTO CORREIA LIMA,"153,2",4,"146,0",157,157
928,154(...)90,MARTIM ANDRE CORREIA FERREIRA,"153,2",2,"135,0",163,163
929,312(...)35,RÚBEN MARINHO COSTA,"153,1",3,"168,0",145,145
930,307(...)76,RODRIGO ALEXANDRE PEREIRA DA SILVA FARIA,"153,1",1,"118,0",172,172
931,307(...)79,ANA BEATRIZ SOARES DUARTE,"153,0",1,"138,0",161,161
932,306(...)98,LUÍS PEREIRA OLIVEIRA FERREIRA,"153,0",5,"125,0",168,168
933,154(...)52,TIAGO SILVA RIBEIRO,"153,0",3,"99,0",182,182
933,303(...)27,GABRIEL TAVARES DE SOUSA,"153,0",1,"99,0",182,182
935,151(...)99,TOMÁS VIANA LIMA,"152,9",1,"147,0",156,156
936,304(...)91,JOAO PEDRO ALMEIDA PINTO,"152,8",1,"158,0",150,150
937,314(...)07,RICARDO MOREIRA DE ALMEIDA,"152,8",2,"143,0",158,158
938,305(...)67,ANTÓNIO PEDRO GUILHERME RAPOSO,"152,8",2,"130,0",165,165
939,155(...)03,MARTIM MENDES MONIZ,"152,8",1,"119,0",171,171
940,153(...)42,TOMÁS SANTOS CRUZ,"152,6",1,"148,0",155,155
941,306(...)48,JOÃO PEDRO PEREIRA NOGUEIRA,"152,6",6,"135,0",162,162
942,301(...)12,TIAGO MACEDO DE BRITO,"152,5",1,"146,0",156,156
943,309(...)83,NUNO DANIEL ABREU DA SILVA,"152,5",6,"131,0",164,164
944,310(...)63,JORGE DANIEL SAMPAIO MELO TEIXEIRA,"152,5",2,"120,0",170,170
945,154(...)05,MAURÍCIO GABRIEL BRANDÃO SARDINHA,"152,5",3,"107,0",177,177
946,307(...)77,MIGUEL MARTINS MOREIRA SILVA,"152,5",1,"105,0",178,178
947,158(...)49,RODRIGO ALEXANDRE RIBEIRO CARVALHO,"152,4",1,"129,0",165,165
948,153(...)22,ANDRÉ MALTEZ NUNES,"152,4",3,"127,0",166,166
948,159(...)00,DINIS MARINHO BILRO SOARES,"152,4",2,"127,0",166,166
950,300(...)16,AFONSO RODRIGO BARBOSA DE CASTRO,"152,3",1,"136,0",161,161
951,151(...)75,JOÃO PEDRO RODRIGUES FERREIRA,"152,3",2,"125,0",167,167
951,307(...)75,JOÃO MANUEL PINTO ALVES,"152,3",4,"125,0",167,167
953,304(...)57,BRUNO RAFAEL DE ALMEIDA SOUSA,"152,2",2,"119,0",170,170
953,308(...)15,CATARINA ALEXANDRA RIBEIRO OLIVEIRA,"152,2",1,"119,0",170,170
955,303(...)17,DIOGO COSTA ALVES,"152,2",2,"95,0",183,183
956,147(...)30,PEDRO CORREIA BARTOLO,"152,0",1,"98,0",181,181
957,304(...)49,MANUEL DE ALMEIDA TEIXEIRA,"151,9",2,"148,0",154,154
958,301(...)96,JOSÉ PEDRO PEREIRA DIAS MONTEIRO GRANJA,"151,9",1,"146,0",155,155
959,230(...)16,ANNA REJLEK,"151,9",3,"135,0",161,161
960,304(...)91,JOAO MOREIRA SEABRA,"151,9",2,"133,0",162,162
961,150(...)78,DINIS ALEXANDRE FERREIRA PINTO,"151,9",1,"122,0",168,168
962,300(...)24,JOÃO FILIPE TEIXEIRA MONTEIRO,"151,8",1,"155,0",150,150
963,303(...)45,JOAO FERNANDES DOS SANTOS,"151,8",1,"131,0",163,163
964,314(...)42,JOÃO PEDRO SOUSA DA SILVA,"151,8",1,"129,0",164,164
965,151(...)61,PEDRO GIL DA SILVA NOVAIS,"151,8",1,"118,0",170,170
966,313(...)37,CLÁUDIO ALEXANDRE ALVES COELHO,"151,7",1,"151,0",152,152
967,307(...)11,GUILHERME MONTEIRO SANTOS,"151,5",3,"117,0",170,170
968,156(...)80,PEDRO MIGUEL BARROSO DA SILVA,"151,4",2,"115,0",171,171
968,300(...)06,JOAO FILIPE GOUVEIA MESQUITA,"151,4",2,"115,0",171,171
968,302(...)09,EDUARDO EMANUEL CRAVO DA CUNHA,"151,4",1,"115,0",171,171
968,304(...)00,MIGUEL FUNDEVILA PINTO DA SILVA,"151,4",2,"115,0",171,171
972,230(...)02,LUCAS SANTANA ARAÚJO,"151,3",1,"135,0",160,160
973,302(...)75,LUIS CARLOS PIRES MARTINS,"151,3",1,"111,0",173,173
974,152(...)52,MIGUEL MARQUES SILVA,"151,3",1,"109,0",174,174
975,306(...)41,DIOGO MIGUEL FERNANDES ARAÚJO,"151,1",2,"142,0",156,156
976,153(...)77,JOSE PEDRO COSTA DO SANTOS,"151,1",6,"127,0",164,164
977,303(...)52,IVAN DE SOUSA LOURENÇO,"151,0",5,"162,0",145,145
978,150(...)80,TIAGO ALEXANDRE LOPES MENDES,"151,0",5,"138,0",158,158
978,151(...)10,MARCOS RAFAEL PONTES DE ALMEIDA SABINO,"151,0",4,"138,0",158,158
980,304(...)61,DIOGO ANDRÉ PEREIRA FERRAZ,"151,0",1,"123,0",166,166
981,153(...)43,JOSÉ PEDRO LEAL NETO,"150,9",2,"160,0",146,146
982,306(...)77,DIOGO ARAÚJO DA COSTA E SILVA,"150,9",5,"119,0",168,168
983,311(...)27,ARTUR GENTIL SILVA PINTO,"150,9",2,"108,0",174,174
984,152(...)24,FRANCISCA SIMÕES FIGUEIREDO,"150,9",2,"95,0",181,181
985,304(...)89,RAFAEL VAZ AFONSO,"150,8",6,"115,0",170,170
986,303(...)47,ISABEL DE OLIVEIRA CARDOSO MATIAS CLEMENTE,"150,7",1,"126,0",164,164
987,314(...)65,TOMÁS TEIXEIRA SILVA,"150,7",1,"124,0",165,165
988,230(...)71,ARPIT RAUT,"150,6",2,"133,0",160,160
989,301(...)69,CRISTIANO ONOFREI,"150,6",2,"120,0",167,167
989,309(...)12,ANDRÉ FILIPE DE SOUSA GONÇALVES,"150,6",1,"120,0",167,167
991,157(...)14,GUILHERME PEDRO ISIDORO,"150,5",2,"131,0",161,161
992,154(...)55,TOMÁS LOPES BARBOSA,"150,5",1,"118,0",168,168
993,310(...)40,EDUARDO JORGE COELHO FREITAS,"150,4",1,"151,0",150,150
994,304(...)76,ÂNGELO DUARTE LOPES PARENTE,"150,4",4,"138,0",157,157
995,307(...)68,HUGO DAVID LOURENÇO BLANCO PIRES,"150,3",1,"108,0",173,173
996,232(...)05,RÚBEN JOSÉ MARQUES BRAM,"150,2",6,"156,0",147,147
997,180(...)23,ERIC ALVES SENA,"150,2",1,"145,0",153,153
998,303(...)97,TIAGO SEQUEIRA GOMES,"150,2",1,"130,0",161,161
999,156(...)02,DIOGO FILIPE NUNES QUEIROZ,"150,2",1,"119,0",167,167
1000,305(...)72,FRANCISCO MORAIS DE OLIVEIRA,"150,1",1,"139,0",156,156
1001,306(...)24,SAMUEL ANTUNES MARTINS,"150,0",2,"137,0",157,157
1002,144(...)40,JOSÉ AFONSO RAMOS GOMES,"150,0",5,"122,0",165,165
1003,155(...)78,LUÍS FILIPE MAGALHÃES DUARTE,"150,0",1,"109,0",172,172
1004,305(...)39,PAULO FILIPE PESSOA SOARES,"149,9",1,"146,0",152,152
1005,154(...)91,HUGO SALÉ DE BARROS PEIXOTO,"149,9",3,"120,0",166,166
1006,148(...)51,DIOGO MATOS PINTO GOMES DE FARIA,"149,9",1,"105,0",174,174
1007,305(...)99,MIKAEL BRAUN,"149,8",2,"116,0",168,168
1008,301(...)43,NELSON CRISTIANO SOUSA LEMOS,"149,7",2,"125,0",163,163
1009,230(...)43,WILLKIE BIANCHI PARAHYBA FILHO,"149,6",2,"145,0",152,152
1010,230(...)10,LUCAS PAGNANO GOLOBOVANTE,"149,6",1,"108,0",172,172
1011,151(...)51,DAVID COSTA VENTURA,"149,6",1,"106,0",173,173
1012,150(...)83,TIAGO FILIPE PINTO DA SILVA,"149,6",1,"95,0",179,179
1012,306(...)40,TOMÁS OLIVEIRA CORREIA,"149,6",1,"95,0",179,179
1014,157(...)96,RODRIGO CASTRO DA COSTA TEIXEIRA,"149,4",3,"113,0",169,169
1015,150(...)31,VIOLETA NATÁLIA MAGUETA URBAEZ,"149,4",1,"111,0",170,170
1016,301(...)70,FRANCISCO JOSÉ FALCÃO DE OLIVEIRA,"149,3",2,"122,0",164,164
1017,156(...)51,BRUNO RAFAEL SILVA SOUSA,"149,2",4,"142,0",153,153
1018,304(...)19,RODRIGO NEVES OLIVEIRA HENRIQUES DE SOUSA,"149,2",1,"129,0",160,160
1019,309(...)99,ANA CATARINA TEIXEIRA CARVALHO,"149,1",1,"138,0",155,155
1020,306(...)36,GUSTAVO FILIPE MARTINS MACIEL,"149,1",1,"127,0",161,161
1021,300(...)63,NUNO BARBOSA PEREIRA,"148,9",1,"132,0",158,158
1022,313(...)20,DUARTE MIGUEL CARNEIRO MACHADO,"148,8",1,"128,0",160,160
1023,317(...)42,DAVID ZHU,"148,8",2,"115,0",167,167
1024,159(...)15,MARTIM JORGE MOREIRA DE SOUSA,"148,7",1,"109,0",170,170
1025,154(...)90,TIAGO GONÇALO PINTO DE OLIVEIRA GUIMARÃES,"148,5",1,"127,0",160,160
1026,312(...)46,JOÃO PEDRO SANTOS LEITE,"148,4",2,"125,0",161,161
1026,312(...)86,TIAGO FERNANDES OLIVEIRA SILVA LOPES,"148,4",2,"125,0",161,161
1028,305(...)31,GABRIEL TEIXEIRA DA SILVA,"148,4",1,"97,0",176,176
1028,306(...)20,FÁBIO ALEXANDRE PEREIRA FERNANDES,"148,4",5,"97,0",176,176
1030,152(...)08,BRUNO JOAO BARBOSA DE SOUSA,"148,3",1,"95,0",177,177
1030,312(...)45,NELSON DANIEL ARAÚJO SOUSA,"148,3",1,"95,0",177,177
1032,155(...)72,GUSTAVO HENRIQUE FRANÇA CAMPOS,"148,1",1,"139,0",153,153
1033,315(...)95,RAFAEL MACHADO FERREIRA,"148,1",1,"126,0",160,160
1034,300(...)65,IVO MATOS TEIXEIRA,"148,0",1,"107,0",170,170
1035,306(...)93,BEATRIZ GUEDES CASTELO,"147,9",3,"131,0",157,157
1036,148(...)83,GUY LISBOA CABRAL,"147,9",1,"129,0",158,158
1037,306(...)01,DAVID RAFAEL MENDES VIEIRA,"147,8",1,"125,0",160,160
1038,149(...)44,EDUARDO RAMALHO MESQUITA BORGES DOS SANTOS,"147,7",2,"160,0",141,141
1039,311(...)72,JOÃO DUARTE BARBOSA MAGALHÃES,"147,7",3,"136,0",154,154
1040,306(...)13,AFONSO PEREIRA FERNANDES,"147,7",1,"110,0",168,168
1041,147(...)09,DUARTE DANIEL NETO MACEDO SILVA,"147,7",1,"95,0",176,176
1041,307(...)11,TIAGO QUEIRÓS ROCHA,"147,7",2,"95,0",176,176
1043,301(...)03,RAFAEL OLIVEIRA CARVALHO,"147,6",2,"117,0",164,164
1044,304(...)75,MARIANA TEIXEIRA ALMEIDA,"147,6",3,"104,0",171,171
1045,154(...)43,DIOGO VIEIRA MONTEIRO,"147,5",1,"141,0",151,151
1045,310(...)63,CARLOS ALBERTO MARTINS FERREIRA,"147,5",1,"141,0",151,151
1047,155(...)54,ANTÓNIO MARIA FERREIRA VON HAFE,"147,5",5,"115,0",165,165
1048,310(...)20,MIGUEL ÂNGELO DA SILVA CERQUEIRA,"147,4",3,"137,0",153,153
1049,153(...)64,JOÃO PEDRO PEREIRA GARCIA,"147,4",1,"135,0",154,154
1050,301(...)67,VERÓNICA DUARTE GONÇALVES,"147,2",1,"129,0",157,157
1051,306(...)73,RICARDO SÁ BARBOSA,"147,2",4,"116,0",164,164
1052,149(...)73,AFONSO RIBEIRO FREITAS PINTO,"147,1",1,"112,0",166,166
1053,301(...)54,HUGO ALEXANDRE MARQUES SILVA,"147,1",6,"110,0",167,167
1054,154(...)74,DUARTE FERNANDES SANTOS,"147,0",1,"121,0",161,161
1055,303(...)39,MIGUEL PEDRO GOUVEIA MARTINS,"146,7",1,"120,0",161,161
1056,151(...)99,PEDRO GONÇALO FERNANDES RIBEIRO,"146,7",4,"109,0",167,167
1057,309(...)56,SOFIA NOGUEIRA RODRIGUES,"146,7",1,"96,0",174,174
1058,307(...)45,RUI EMANUEL SILVA GONÇALVES,"146,6",1,"103,0",170,170
1059,302(...)53,JOSÉ MIGUEL PEIXOTO SILVA,"146,5",5,"127,0",157,157
1060,309(...)35,FÁBIO MANUEL PINTO BARREIRO,"146,4",1,"136,0",152,152
1061,150(...)09,FRANCISCO MIRANDA GOUVEIA,"146,4",6,"108,0",167,167
1062,146(...)31,VASCO MIGUEL FERNANDES DOS SANTOS,"146,4",4,"95,0",174,174
1062,306(...)11,DIANA MARIA DE SÁ MATOS,"146,4",3,"95,0",174,174
1064,300(...)36,MANUEL EDUARDO DE ALMEIDA BRAGA SERRANO,"146,3",1,"143,0",148,148
1065,155(...)63,TIAGO LOPES DE MELO,"146,3",6,"106,0",168,168
1066,230(...)70,ARPAN RAUT,"146,2",2,"152,0",143,143
1067,303(...)94,PEDRO MIGUEL COSTA GONÇALVES,"146,2",3,"126,0",157,157
1068,155(...)77,FRANCISCO MARIA PRATA PINTO SERRANO BAPTISTA,"146,2",3,"115,0",163,163
1069,153(...)63,ANA SOFIA DE FIGUEIREDO FERREIRA E SILVA TOMÁS,"146,2",4,"100,0",171,171
1070,308(...)33,JOÃO MIGUEL FERREIRA AMENDOEIRA,"146,1",2,"135,0",152,152
1071,153(...)95,VASCO RODRIGUES DE SOUSA,"146,1",2,"124,0",158,158
1072,155(...)53,GABRIEL DA SILVA GONÇALVES,"146,1",1,"109,0",166,166
1073,304(...)73,FILIPE CONSTANTINO REIS,"145,9",1,"101,0",170,170
1074,308(...)83,DIOGO MARQUES ALMEIDA,"145,7",1,"134,0",152,152
1075,143(...)61,XAVIER JOSÉ SOARES KOOIJMAN,"145,7",1,"121,0",159,159
1076,313(...)88,JOAO PEDRO GOMES MILHEIRO,"145,7",1,"119,0",160,160
1077,303(...)10,JOÃO SANTOS ROCHA,"145,7",1,"108,0",166,166
1077,312(...)28,LEANDRO FRANCISCO MOREIRA GONÇALVES,"145,7",1,"108,0",166,166
1079,310(...)34,JOSÉ PEDRO MARQUES SILVA,"145,7",5,"95,0",173,173
1080,304(...)11,TIAGO JOSÉ BALDAIA MAGALHÃES,"145,6",2,"104,0",168,168
1081,150(...)74,AFONSO MARIA DA COSTA MOURA,"145,5",1,"150,0",143,143
1082,307(...)20,DIOGO ALMEIDA SIMOES,"145,5",1,"126,0",156,156
1083,311(...)20,RÚBEN FRANCISCO FERNANDES ALVES,"145,5",6,"100,0",170,170
1084,155(...)25,CATARINA SANTOS DA CUNHA,"145,4",1,"109,0",165,165
1085,301(...)09,FRANCISCO DIZ SIMÕES LOPES,"145,4",1,"107,0",166,166
1086,150(...)27,BRUNO RAFAEL BARROS ALVES,"145,3",1,"131,0",153,153
1087,303(...)23,PEDRO PINHEIRO FILIPE,"145,3",1,"118,0",160,160
1088,153(...)02,ALEXANDRE CORREIA DA SILVA,"145,3",1,"105,0",167,167
1088,312(...)63,HENRIQUE GONÇALVES DOS SANTOS,"145,3",2,"105,0",167,167
1090,308(...)02,CAROLINA GARCIA FERNANDES,"145,2",1,"112,0",163,163
1091,301(...)12,TIAGO MARTINS GUIMARÂES,"145,2",1,"99,0",170,170
1092,149(...)20,SOFIA SOUSA FURTADO,"145,1",2,"110,0",164,164
1092,152(...)82,RODRIGO BARROSO DA COSTA PINTO,"145,1",1,"110,0",164,164
1094,151(...)06,GONÇALO TEIXEIRA COUTO,"145,1",1,"95,0",172,172
1094,303(...)53,MIGUEL JOSÉ BARRIAS PINTO,"145,1",1,"95,0",172,172
1096,315(...)65,BERNARDO OLIVEIRA MALHEIRO DE MORAIS MOTA,"145,0",2,"145,0",145,145
1097,154(...)06,MARTIM REIS DE BASTOS,"145,0",1,"130,0",153,153
1098,310(...)15,DAVID JOSÉ TEIXEIRA VEIGA,"144,8",1,"98,0",170,170
1099,230(...)02,LUÍS EDUARDO ESTEVAM NANTES,"144,8",1,"96,0",171,171
1100,306(...)97,TIAGO JOSÉ VIEIRA PINHO,"144,7",1,"131,0",152,152
1100,313(...)44,DANIEL DELIU,"144,7",1,"131,0",152,152
1102,150(...)02,MIGUEL FELGUEIRAS AZEVEDO,"144,7",3,"107,0",165,165
1103,157(...)23,GONÇALO JOSÉ CADILHE RANGEL,"144,6",2,"116,0",160,160
1103,307(...)46,ANDRE LOUREIRO ARTILHEIRO,"144,6",1,"116,0",160,160
1105,300(...)52,GONÇALO MANUEL CARDOSO OLIVEIRA,"144,6",1,"114,0",161,161
1106,308(...)34,EDGAR JUNQUEIRA CORREIA,"144,5",4,"125,0",155,155
1107,312(...)54,NELSON MANUEL MOREIRA DA COSTA,"144,5",1,"110,0",163,163
1108,302(...)62,DIOGO MANUEL DUARTE OLIVEIRA,"144,4",2,"147,0",143,143
1109,154(...)51,RAFAEL COSTA PEREIRA,"144,4",1,"132,0",151,151
1110,152(...)42,JOÃO FARIA GONÇALVES MARQUES,"144,4",1,"106,0",165,165
1111,151(...)67,FRANCISCO MADUREIRA FERREIRA JACINTO,"144,2",1,"111,0",162,162
1112,150(...)98,BERNARDO ESPIRITO SANTO DE OLIVEIRA JACO,"144,1",4,"148,0",142,142
1113,312(...)09,JOANA ALEXANDRA BESSA SORTE PINTO,"144,1",1,"96,0",170,170
1113,313(...)04,JOSÉ MIGUEL MONTEIRO DA ROCHA,"144,1",1,"96,0",170,170
1115,302(...)43,RAFAEL FELICIANO SOARES,"144,0",1,"129,0",152,152
1116,306(...)26,DINIS DOS SANTOS FÉLIX,"144,0",1,"105,0",165,165
