377,154(...)71,GUILHERME GOIS PINHO,"144,5",2,"112,0",162,162
378,154(...)25,RODRIGO AUGUSTO FERREIRA CORREIA,"144,4",5,"141,5",146,146
379,303(...)40,FRANCISCO SOBRAL MESQUITA,"144,3",2,"141,0",146,146
380,313(...)63,SARA BEATRIZ DA SILVA CAPELA,"144,2",4,"137,0",148,148
381,306(...)33,JOÃO CLÁUDIO GASPAR DA SILVA,"144,2",6,"126,0",154,154
382,154(...)44,GONÇALO MARQUES CADILHE COSTA OLIVEIRA,"144,2",6,"111,0",162,162
382,304(...)99,MARIA LUÍS HORTA NETO,"144,2",3,"111,0",162,162
382,310(...)83,PEDRO MIGUEL PEREIRA MENDES,"144,2",5,"111,0",162,162
385,156(...)30,PEDRO RAFAEL CARVALHO TAVARES,"144,2",1,"98,0",169,169
386,148(...)07,RICARDO XAVIER MARTINS AMARO,"144,1",2,"133,0",150,150
387,303(...)46,RICARDO GONÇALVES RODRIGUES,"144,1",6,"120,0",157,157
388,152(...)70,NUNO ANTÓNIO BRITES GUIMARÃES,"144,0",2,"142,0",145,145
389,303(...)73,RITA ISABEL DA COSTA PEREIRA,"144,0",6,"129,0",152,152
390,300(...)45,MANUEL ANTONIO OLIVEIRA PINHO,"144,0",3,"116,0",159,159
391,158(...)45,ALEXANDRA SOFIA BARROS MADEIRA,"143,8",5,"95,0",170,170
391,306(...)19,EDUARDO MARTINS LIMA,"143,8",5,"95,0",170,170
393,153(...)68,GUILHERME JOSÉ CARDOSO FELIX,"143,7",5,"145,0",143,143
394,301(...)08,DIOGO MIGUEL FERREIRA GOMES,"143,7",3,"132,0",150,150
395,149(...)15,RODRIGO PEREIRA MACIEL,"143,7",3,"130,0",151,151
395,149(...)49,SIMÃO RAFAEL BURGAL NUNES,"143,7",5,"130,0",151,151
395,312(...)50,PEDRO GERAZ BOSOF,"143,7",6,"130,0",151,151
398,304(...)27,RAFAEL BARÃO DA SILVA,"143,7",2,"119,0",157,157
399,310(...)66,DIOGO GOMES CARDOSO,"143,7",2,"117,0",158,158
400,309(...)43,ANA BEATRIZ DE SOUSA VICENTE,"143,6",2,"139,0",146,146
401,156(...)69,BRUNA DOS SANTOS FERREIRA,"143,6",5,"126,0",153,153
402,302(...)61,DUARTE MARTINS VIEIRA,"143,6",2,"115,0",159,159
403,312(...)26,GONÇALO MIGUEL GODINHO MENDES,"143,5",2,"161,0",134,134
404,152(...)32,GUILHERME GASPAR MESTRE RAMALHO,"143,5",5,"150,0",140,140
404,155(...)93,RUBEN DINIS FREITAS LIMA,"143,5",1,"150,0",140,140
406,150(...)60,CARLOS FILIPE PAULINO PINTO,"143,5",5,"137,0",147,147
407,154(...)79,JOÃO FRANCISCO AQUINO CARDOSO SANTOS,"143,5",1,"135,0",148,148
408,303(...)95,JOÃO PEDRO GUEDES BARREIRA ESTEVES,"143,5",5,"118,5",157,157
409,153(...)41,ILDA CARVALHO MOTA DANTAS GUIMARÃES,"143,4",2,"120,0",156,156
410,305(...)63,MIGUEL PEREIRA LAMEIRAS,"143,3",3,"142,0",144,144
411,310(...)37,ANDRÉ SILVA PACHECO,"143,2",3,"138,0",146,146
412,153(...)19,TOMÁS MARTINS PINTO,"143,2",5,"136,0",147,147
413,303(...)97,DAVID JOSÉ DA SILVA FERNANDES,"143,1",4,"108,0",162,162
413,311(...)80,ALINA ROMANOVNA BOBKOVA,"143,1",3,"108,0",162,162
415,157(...)76,VÍTOR HUGO PEREIRA COUCEIRO,"143,0",2,"156,0",136,136
416,311(...)41,DIOGO MIGUEL SOUSA COELHO,"143,0",3,"130,0",150,150
417,307(...)49,JULIANA CATARINA DOS REIS,"142,9",1,"139,0",145,145
418,300(...)33,RODRIGO FERNANDO LEMOS SANTOS,"142,9",1,"133,5",148,148
419,312(...)56,DANIEL PANKRATAU,"142,9",3,"111,0",160,160
420,306(...)23,JOÃO GUILHERME DE OLIVEIRA E SILVA,"142,8",1,"127,5",151,151
421,303(...)15,JOSÉ MIGUEL SECO OLIVEIRA,"142,7",2,"155,0",136,136
422,308(...)92,ANTONIO D'ABRANTES MARQUES PRATA NEVES,"142,7",3,"105,0",163,163
423,306(...)73,FRANCISCO MARCELO DIAS MARTINS,"142,6",4,"166,0",130,130
424,153(...)30,RODRIGO MIGUEL MARQUES MATOS,"142,6",1,"125,0",152,152
424,319(...)49,BRYAN GONÇALVES DE OLIVEIRA,"142,6",4,"125,0",152,152
426,302(...)41,RICARDO JORGE OLIVEIRA SOARES,"142,4",3,"152,5",137,137
427,302(...)33,DANIEL FILIPE VENTURA SANTANA,"142,4",2,"119,0",155,155
427,314(...)21,DINIS SOKOLAN LEVCHENKO,"142,4",2,"119,0",155,155
429,305(...)79,PEDRO MIGUEL GASPAR SANTOS,"142,4",3,"117,0",156,156
430,301(...)89,DIOGO ALEXANDRE OLIVEIRA MARQUES,"142,3",6,"139,0",144,144
431,311(...)39,DIOGO ANDRÉ SANTOS PEREIRA,"142,3",5,"126,0",151,151
432,308(...)03,JOSÉ FRANCISCO MIRANDA NOGUEIRA,"142,3",2,"113,0",158,158
433,159(...)89,LEONARDO SANTOS PESSOA,"142,2",1,"150,0",138,138
434,157(...)10,BRUNO ALEXANDRE LIBERADO FERRAZ,"142,2",3,"137,0",145,145
435,149(...)76,TOMÁS DUARTE CARVALHO,"142,2",3,"109,0",160,160
436,152(...)62,FRANCISCO EMANUEL RODRIGUES E MOITA,"142,1",4,"146,0",140,140
437,306(...)18,TIAGO PIMENTA LOPES DOS SANTOS,"142,0",3,"153,0",136,136
438,153(...)52,MARIA DE JORDÃO MOÇO,"142,0",3,"116,0",156,156
439,153(...)18,ANDRÉ SEQUEIRA FILIPE,"141,9",2,"125,0",151,151
440,307(...)73,TIAGO FILIPE DA CUNHA FERNANDES,"141,8",3,"121,0",153,153
441,306(...)27,TOMÁS GASPAR RAMOS,"141,8",4,"119,0",154,154
441,311(...)72,JOÃO DUARTE BARBOSA MAGALHÃES,"141,8",4,"119,0",154,154
443,307(...)37,GUILHERME AFONSO FERREIRA GONÇALVES,"141,7",2,"141,0",142,142
444,150(...)95,FRANCISCO JOSÉ GRAÇA SANTOS,"141,7",3,"115,0",156,156
445,311(...)83,NUNO FILIPE SILVA FERREIRA,"141,5",1,"120,0",153,153
446,151(...)37,PEDRO TEIXEIRA AMORIM,"141,4",4,"129,0",148,148
447,149(...)71,HENRIQUE BOTELHO OLIVEIRA,"141,4",2,"118,0",154,154
447,310(...)52,DIOGO RAFAEL BRANDÃO DE BASTOS,"141,4",4,"118,0",154,154
449,307(...)00,IGOR MANUEL SILVA OLIVEIRA,"141,4",5,"116,0",155,155
450,306(...)11,PEDRO MANUEL MAIA GAMA,"141,4",4,"105,0",161,161
451,308(...)94,GABRIEL ANTÓNIO LOPES CRAVO,"141,2",1,"121,0",152,152
452,145(...)49,RUI PEDRO LOURENÇO GIL,"141,1",3,"132,0",146,146
453,306(...)10,RUI FILIPE FERREIRA DE ALMEIDA,"141,1",2,"104,0",161,161
454,303(...)43,DIOGO MARTIM GONÇALVES CADIMA,"141,0",1,"128,0",148,148
455,303(...)16,DIOGO SANTOS SAMPAIO,"141,0",1,"115,0",155,155
455,306(...)44,RODRIGO SOUSA GOMES,"141,0",1,"115,0",155,155
457,300(...)02,RUI MIGUEL COUTINHO LEAL ARAÚJO,"141,0",2,"102,0",162,162
458,155(...)29,SOFIA CUSTODIO DAS NEVES,"140,9",5,"122,0",151,151
458,159(...)11,LUIS PEDRO DOS SANTOS CORREDOURA,"140,9",2,"122,0",151,151
458,306(...)60,GUILHERME CORREIA LOPES PEDRINHO,"140,9",1,"122,0",151,151
461,151(...)75,GONÇALO RODRIGUES FIGUEIRA,"140,8",4,"146,0",138,138
462,312(...)95,TIAGO AFONSO MATOS NETO,"140,8",1,"133,0",145,145
463,307(...)72,DIOGO JOSÉ DA SILVA MESQUITA,"140,8",1,"120,0",152,152
463,310(...)21,RODRIGO GRAVE OLIVEIRA COSTA JORGE,"140,8",6,"120,0",152,152
465,301(...)72,JOÃO ANDRÉ LEITÃO RELVA,"140,8",6,"118,0",153,153
466,150(...)60,JOÃO PEDRO SILVA NEVES PEREIRINHA,"140,7",5,"140,0",141,141
467,150(...)42,FRANCISCO DA SILVA DIAS,"140,6",4,"138,0",142,142
468,153(...)33,AFONSO DOS REIS FERNANDES,"140,5",1,"95,0",165,165
469,152(...)49,AMINE ALBERTO FARHAT MARTINS,"140,3",6,"113,0",155,155
470,310(...)98,SIMÃO PEDRO DA ROCHA RODRIGUES,"140,2",2,"135,0",143,143
471,301(...)46,MIGUEL RODRIGUES SIMÕES DO AMARAL CAETANO,"140,1",4,"129,0",146,146
472,149(...)58,DIOGO FILIPE PEREIRA NICOLAU,"140,1",6,"116,0",153,153
472,302(...)22,FRANCISCO OLIVEIRA DA SILVA,"140,1",1,"116,0",153,153
474,153(...)45,VICENTE ANTUNES LISBOA MOTA,"140,1",3,"103,0",160,160
475,306(...)28,LUÍS FRANCISCO VIANA DA COSTA DE PINA CARVALHO,"140,0",6,"138,0",141,141
476,303(...)03,RODRIGO JOSÉ MINGACHOS DUARTE,"139,9",5,"136,0",142,142
477,312(...)40,TOMÁS AZEVEDO FERREIRA,"139,9",2,"97,0",163,163
478,152(...)30,RUI ALBERTO CABRAL JOÃO,"139,8",1,"158,0",130,130
479,155(...)09,FRANCISCO FRANÇA DA COSTA,"139,8",4,"119,0",151,151
480,301(...)61,DAVID DE JESUS GOMES CAETANO,"139,7",5,"126,0",147,147
481,303(...)82,RAFAEL QUESADO MONTEIRO ENES,"139,7",3,"115,0",153,153
482,153(...)52,NUNO RICARDO MATOS DA SILVA,"139,6",5,"116,5",152,152
482,314(...)84,GUILHERME SEABRA FERREIRA,"139,6",5,"116,5",152,152
484,156(...)69,TOMÁS MARINHO MENDES CALVÁRIO,"139,6",3,"98,0",162,162
485,157(...)75,JOSE MIGUEL NASCIMENTO SARAIVA TELES MENEZES,"139,5",5,"131,0",144,144
486,151(...)41,INÊS SOARES DE ALMEIDA,"139,5",2,"118,0",151,151
487,303(...)05,FREDERICO ANTÓNIO PACHECO RODRIGUES MAROCO QUELHAS,"139,5",4,"105,0",158,158
488,300(...)88,RAFAEL MENDEIROS FERNANDES,"139,4",3,"127,0",146,146
489,149(...)27,JOANA RITA JORGE MARTINS,"139,4",2,"114,0",153,153
490,310(...)51,RUI DA SILVA ALMEIDA,"139,3",4,"125,0",147,147
491,152(...)70,GUILHERME PEDRO SERRALHEIRO,"139,3",5,"110,0",155,155
492,310(...)88,GUILHERME JOSÉ FERNANDES PEREIRA MARQUES,"139,3",2,"99,0",161,161
493,154(...)39,JOÃO ANTÓNIO DOS SANTOS CONCHINHA,"139,2",3,"132,0",143,143
494,303(...)71,LEONARDO RODRIGUES DE ALMEIDA,"139,2",3,"106,0",157,157
495,312(...)59,EDUARDO LOUREIRO SOUSA,"139,1",3,"128,0",145,145
496,152(...)16,MIGUEL RODRIGUES GONÇALVES,"139,0",1,"137,0",140,140
496,220(...)01,OWEN JIN,"139,0",2,"137,0",140,140
496,305(...)55,FILIPA ALEXANDRA MARTINS MARQUES,"139,0",1,"137,0",140,140
499,302(...)68,JOÃO PEDRO CARDOSO CRUZ,"138,9",3,"161,0",127,127
500,301(...)69,RODRIGO FILIPE LOURENÇO HENRIQUES LEITÃO MEIRELES,"138,9",1,"135,0",141,141
501,307(...)64,JOÃO PAULO MESQUITA HENRIQUES,"138,9",1,"107,0",156,156
502,304(...)32,TIAGO MARTINS REBELO,"138,8",1,"116,0",151,151
503,300(...)13,RODRIGO MIGUEL MARTINS VENTURA,"138,6",4,"121,0",148,148
504,310(...)50,AFONSO PORTELA VALENTE SILVA,"138,5",2,"104,0",157,157
505,156(...)23,AFONSO JOSÉ SANTOS SIMÕES,"138,4",2,"128,0",144,144
506,305(...)97,DUARTE SILVANO PAREDES,"138,4",2,"115,0",151,151
507,158(...)10,TOMÁS TEIXEIRA FERREIRA,"138,3",5,"161,0",126,126
508,303(...)01,RODRIGO SOARES FERREIRA,"138,3",1,"109,0",154,154
509,148(...)97,AFONSO HENRIQUE JANEIRO LEMOS,"138,2",1,"133,0",141,141
510,152(...)03,HUGO LEANDRO MARQUES JERÓNIMO,"138,1",1,"140,0",137,137
511,151(...)15,FILIPE JOSÉ RODRIGUES RAMOS,"138,1",2,"129,0",143,143
512,159(...)03,LUÍS ANDRÉ ALMEIDA CARRILHO,"138,0",5,"125,0",145,145
513,305(...)80,MÁRCIO DANIEL DO CARMO BARBOSA,"138,0",1,"110,0",153,153
514,151(...)44,JOÃO PEDRO PINTO FREITAS,"137,9",4,"132,0",141,141
515,152(...)75,DIOGO SIMÕES OVA DOS SANTOS,"137,9",1,"119,0",148,148
516,158(...)72,DIOGO EIRAS MORAIS,"137,9",4,"106,0",155,155
517,157(...)49,JOÃO CARVALHO BARROS,"137,9",2,"95,0",161,161
517,314(...)29,PEDRO JESUS CARVALHO,"137,9",1,"95,0",161,161
519,303(...)79,RAFAEL RIBEIRO RODRIGUES,"137,8",5,"115,0",150,150
520,155(...)78,TIAGO MIGUEL LOPES CANEJO,"137,8",4,"104,0",156,156
520,304(...)51,ALEXANDRE BARRIAS DA SILVA FERNANDES,"137,8",5,"104,0",156,156
522,313(...)98,RÚBEN DAVID SOARES FONSECA,"137,7",1,"100,0",158,158
523,304(...)02,ALEXANDRE MOTA ARAUJO,"137,6",5,"109,0",153,153
524,309(...)88,LUÍS FILIPE ESTEVES DIAS,"137,5",4,"155,0",128,128
525,157(...)36,RODRIGO JOSÉ PEREIRA HENRIQUES,"137,4",1,"151,0",130,130
526,159(...)41,RODRIGO JOSÉ COSTA FURTADO,"137,4",5,"138,0",137,137
527,152(...)30,ANTÓNIO MARIA NASCIMENTO CRUZ MARTINHO CORREIA,"137,4",1,"106,5",154,154
528,305(...)55,GUILHERME LIRA CORDEIRO,"137,3",1,"147,0",132,132
529,151(...)27,MATEUS JOSÉ GONÇALVES DA SILVA,"137,3",3,"95,0",160,160
529,157(...)22,DIOGO CORREIA MARQUES,"137,3",1,"95,0",160,160
529,158(...)01,GUSTAVO CARVALHO CLEMENTE,"137,3",4,"95,0",160,160
532,150(...)64,GONÇALO MIGUEL ALFEIRÃO OLIVEIRA,"137,2",3,"130,0",141,141
533,303(...)86,MARTIM BRANCO LOURENÇO,"137,2",5,"119,0",147,147
534,313(...)57,MÁRIO MIGUEL NUNO PINA,"137,2",1,"104,0",155,155
535,150(...)34,RODRIGO PAULO SILVA,"137,1",3,"141,0",135,135
536,312(...)79,JOSÉ GUILHERME DE CAMPOS FERNANDES,"137,1",1,"115,0",149,149
537,151(...)29,RODRIGO MIGUEL OLIVEIRA CALISTO,"137,1",4,"100,0",157,157
538,159(...)69,PEDRO MIGUEL FERREIRA LOUREIRO,"137,0",2,"150,0",130,130
539,314(...)63,MIGUEL ALEXANDRE FERREIRA DA SILVA,"137,0",1,"135,0",138,138
540,148(...)53,TOMÁS MARIANO LOURO,"137,0",4,"122,0",145,145
541,310(...)29,JOAO GABRIEL MACHADO VIDAL,"136,9",5,"131,0",140,140
542,146(...)05,FILIPE ANDRÉ PEREIRA RODRIGUES,"136,9",3,"120,0",146,146
542,312(...)02,MARIANA PAIS JORGE MAGALHÃES,"136,9",1,"120,0",146,146
544,310(...)30,NUNO DANIEL DE ALMEIDA ENCARNAÇÃO,"136,9",3,"105,0",154,154
545,150(...)20,DANIEL AFONSO CALDEIRA VALENTE,"136,7",3,"138,0",136,136
546,304(...)14,JOAQUIM FILIPE FARIA,"136,7",1,"136,0",137,137
547,310(...)46,JOSÉ LUÍS TINOCO CAVACO,"136,7",3,"112,0",150,150
548,156(...)57,TOMÁS PEREIRA MATOS,"136,7",4,"97,0",158,158
549,304(...)25,FRANCISCO JOSÉ RIBEIRO VITORINO,"136,6",2,"108,0",152,152
550,157(...)06,RODRIGO MIGUEL SÁ RAMALHO,"136,6",2,"95,0",159,159
551,148(...)64,JOÃO ALVARO MELO DE MENDONÇA E SILVA,"136,5",3,"115,0",148,148
551,308(...)31,PEDRO MIGUEL GOMES DE SOUSA,"136,5",5,"115,0",148,148
553,306(...)27,BRUNO RAFAEL BARROS COSTA,"136,5",1,"102,0",155,155
554,312(...)80,ANDRÉ FILIPE ALMEIDA DA ROCHA,"136,4",2,"118,5",146,146
555,158(...)93,CARLOS MIGUEL ESPIRITO SANTO LIMA,"136,4",1,"111,0",150,150
556,148(...)68,DIOGO DIAS DUARTE,"136,4",4,"100,0",156,156
557,301(...)21,RODRIGO PESSOA DA GRAÇA,"136,3",3,"135,0",137,137
558,312(...)43,DANIEL MISEVICH,"136,1",1,"114,0",148,148
559,310(...)58,SAMUEL RODRIGUES MORENO DE SOUZA,"136,0",2,"147,0",130,130
560,307(...)63,PEDRO MIGUEL RODRIGUES PERALTA,"136,0",1,"110,0",150,150
560,309(...)52,RODRIGO FERNANDES BERNARDINO,"136,0",2,"110,0",150,150
562,149(...)17,ANDRÉ DANIEL RIBEIRO CARVALHO,"135,8",1,"128,0",140,140
563,158(...)90,DAVID JOSÉ CORTÊS SIMÕES,"135,8",1,"115,0",147,147
563,303(...)19,TIAGO FERREIRA DANTAS,"135,8",5,"115,0",147,147
565,149(...)64,DIOGO PINTO PEREIRA,"135,8",5,"109,5",150,150
566,145(...)27,RODRIGO GONCALVES GLORIA,"135,7",1,"137,0",135,135
567,308(...)44,BRUNO MIGUEL ALMEIDA HENRIQUES,"135,7",1,"98,0",156,156
568,154(...)90,JOÃO HUGO GONÇALVES MENDES,"135,6",1,"105,0",152,152
569,305(...)10,TIAGO ALBERTO TRISTÃO BORLIDO BAPTISTA,"135,4",5,"123,0",142,142
570,303(...)36,CARLOS XAVIER CORREIA DA SILVA,"135,3",3,"134,0",136,136
571,308(...)50,RODRIGO COIMBRA MENDES,"135,3",5,"121,0",143,143
572,309(...)87,DIOGO MANUEL TEIXEIRA ASCENSO,"135,3",2,"108,0",150,150
573,303(...)29,FRANCISCO MIGUEL LOPES VELHINHO,"135,3",3,"106,0",151,151
573,308(...)02,RICARDO LUÍS GOMES MÚRIAS,"135,3",4,"106,0",151,151
575,303(...)18,DIANA REGO FERNANDES,"135,3",1,"95,0",157,157
576,156(...)59,JOÃO MIGUEL RIBEIRO MARINHO DE FARIA,"135,2",3,"102,0",153,153
577,306(...)41,RUI MIGUEL RODRIGUES DUARTE,"135,1",1,"126,0",140,140
578,302(...)66,JOANA MARTINS SANTOS,"135,1",4,"111,0",148,148
579,307(...)89,GUILHERME BATISTA JORGE,"135,0",6,"133,0",136,136
580,304(...)23,BERNARDO MARIA DIAS TEIXEIRA,"135,0",2,"107,0",150,150
581,145(...)97,JOÃO HENRIQUES RIBEIRO,"134,9",3,"138,5",133,133
582,313(...)24,RUI PEDRO AREDE BARREIRA,"134,9",1,"105,0",151,151
583,301(...)64,GABRIEL LOPES DOS SANTOS,"134,9",2,"103,0",152,152
584,158(...)24,LUCAS NOVO GOMES,"134,8",5,"125,0",140,140
584,302(...)47,FRANCISCO MENDES GAMEIRO,"134,8",1,"125,0",140,140
586,149(...)98,JOÃO CARLOS DA SILVA CANAIS,"134,8",2,"99,0",154,154
587,149(...)90,JOÃO CARLOS GOMES LOPES,"134,7",1,"123,0",141,141
588,157(...)06,GUILHERME DUARTE LOPES,"134,7",1,"121,0",142,142
589,301(...)72,PEDRO OLIVEIRA MENDES,"134,7",5,"110,0",148,148
589,303(...)98,JOÃO PEDRO LOPES PIRES,"134,7",2,"110,0",148,148
591,154(...)40,AFONSO FERREIRA SOBREIRA,"134,6",3,"132,0",136,136
592,308(...)00,ANDRÉ MIGUEL DELGADINHO QUINTEIRO,"134,6",4,"130,0",137,137
593,302(...)15,JOÃO ALEXANDRE COSTA PIMENTA,"134,4",2,"109,0",148,148
594,303(...)03,DIOGO BRANCO PIRES COSTA,"134,4",3,"98,0",154,154
595,308(...)46,JOSÉ NUNO MENDES CARNAZ,"134,4",1,"96,0",155,155
596,150(...)78,DIOGO ALEXANDRE MATEUS CARDEIRA,"134,3",1,"118,0",143,143
597,310(...)25,TOMÁS NEVES REIGOTA,"134,3",2,"114,5",145,145
598,304(...)32,DANIEL FREITAS OLIVEIRA,"134,3",2,"105,0",150,150
599,151(...)27,JOSÉ GABRIEL VICENTE LIZ,"134,2",5,"116,0",144,144
600,149(...)07,GUILHERME ANTÓNIO CANICEIRO SARAIVA BENTO,"134,2",1,"101,0",152,152
601,302(...)27,GONÇALO DOS SANTOS PEREIRA,"134,1",3,"136,0",133,133
602,305(...)19,FILIPE JOSÉ RIBEIRO CAMPOS,"134,0",1,"115,5",144,144
603,156(...)80,CÉSAR FILIPE OLIVEIRA SILVA,"134,0",1,"95,0",155,155
603,306(...)46,NEUZA ALEXANDRA FERREIRA DA SILVA,"134,0",4,"95,0",155,155
603,308(...)49,JOSÉ AFONSO BARBOSA PINTO RIBEIRO LIMA,"134,0",1,"95,0",155,155
606,157(...)19,ANA MARGARIDA BRAZ NUNEZ,"133,9",5,"128,0",137,137
607,159(...)41,FRANCISCO PORTO XAVIER,"133,9",4,"115,0",144,144
608,300(...)30,LEONARDO MARQUES CABREIRA,"133,7",3,"109,0",147,147
609,310(...)04,RENATO PHILIPE ROLO ASSUNÇÃO MARIZ PEREIRA,"133,7",5,"107,0",148,148
610,158(...)51,HUGO BESSA PEREIRA,"133,5",5,"140,0",130,130
611,150(...)66,RÚBEN ANDRÉ RODRIGUES GIRÃO,"133,5",2,"125,0",138,138
611,307(...)60,GONÇALO DA SILVA CORREIA,"133,5",3,"125,0",138,138
613,156(...)89,LETÍCIA CRUZ LOUREIRO,"133,4",6,"95,0",154,154
614,157(...)94,RICARDO AUGUSTO LOMBA FERNANDES,"133,3",2,"117,0",142,142
614,302(...)22,RAFAEL DA SILVA CASALINHO,"133,3",2,"117,0",142,142
616,304(...)79,JOÃO TOMÁS CRISTO SOUSA,"133,3",2,"113,5",144,144
617,306(...)42,JORGE FILIPE CERQUEIRA ARAÚJO,"133,3",1,"111,5",145,145
618,311(...)63,MARGARIDA MARTINS MARQUES,"133,2",2,"120,5",140,140
619,305(...)58,GUILHERME DE OLIVEIRA SOEIRO,"133,2",2,"115,0",143,143
620,303(...)74,ANA CAROLINA FERREIRA CAVALEIRO,"133,2",4,"102,0",150,150
621,310(...)48,TIAGO FERNANDES LOBO,"133,2",2,"100,0",151,151
622,309(...)47,TIAGO DOS REIS MINISTRO,"133,0",4,"107,0",147,147
623,151(...)43,RICARDO GODINHO MECA LAVOS DE OLIVEIRA,"133,0",2,"105,0",148,148
623,314(...)03,MARGARIDA FRANCISCO CAMPOS,"133,0",1,"105,0",148,148
625,149(...)66,EDUARDO MANUEL DE OLIVEIRA FERNANDES,"132,9",1,"110,5",145,145
626,310(...)59,NAZARIY KAZARYAN,"132,8",3,"110,0",145,145
627,155(...)13,DANIEL SOUSA PAZ,"132,7",6,"95,0",153,153
627,159(...)01,BRUNO TIAGO RODRIGUES CUNHA,"132,7",2,"95,0",153,153
629,150(...)10,JOSÉ MARIA MENDES,"132,6",5,"141,0",128,128
630,308(...)98,PEDRO MANUEL MATOS MENDES,"132,6",2,"117,0",141,141
631,301(...)62,PEDRO MIGUEL PITA SEQUEIRA,"132,6",1,"115,0",142,142
632,156(...)13,FILIPE MIRANDA GARCIA,"132,5",4,"113,0",143,143
633,147(...)06,JOÃO PONCIANO CARDOSO OLIVEIRA DE BALDAIA MORAIS,"132,5",2,"111,0",144,144
634,147(...)09,FRANCISCO SOUSA LUÍS,"132,4",1,"122,0",138,138
635,312(...)53,JOSÉ PEDRO BARROS REIS,"132,3",2,"105,0",147,147
636,145(...)52,TOMÁS CASTANHEIRA MUACHO,"132,3",5,"103,0",148,148
637,314(...)43,GONÇALO PINA BICHO DUARTE PATRÍCIO,"132,2",4,"112,0",143,143
638,156(...)96,BERNARDO PINÉU LOPES FERNANDES,"132,2",1,"99,0",150,150
639,303(...)75,GUSTAVO CAETANO VIEIRA,"132,1",2,"102,5",148,148
640,310(...)19,ANDRÉ SANTOS FERREIRA,"131,9",5,"115,0",141,141
641,306(...)32,NUNO MIGUEL DE SOUSA OLIVEIRA FERNANDES,"131,9",4,"113,0",142,142
642,308(...)02,AFONSO MARIZ LUÍS,"131,8",1,"98,0",150,150
643,306(...)70,SOFIA FILIPA BARBOSA LEITE,"131,8",1,"96,0",151,151
644,305(...)50,FÁBIO ALEXANDRE FERNANDES GODINHO,"131,6",5,"127,0",134,134
645,304(...)80,GONÇALO MIGUEL SOUSA MENDES,"131,4",4,"106,0",145,145
646,310(...)73,JOÃO PEDRO DOS SANTOS MORAIS,"131,4",2,"95,0",151,151
647,157(...)74,MIGUEL RODRIGUES VIANA,"131,3",1,"143,0",125,125
648,300(...)39,RAUL JOÃO SARAIVA NADAIS,"131,2",4,"126,0",134,134
649,153(...)10,JOÃO CARLOS BARBOSA MOREIRA,"131,1",2,"109,0",143,143
650,301(...)43,MANUEL PINTO COSTA,"131,1",3,"107,0",144,144
650,302(...)12,LEONARDO GIL DOMINGOS,"131,1",1,"107,0",144,144
652,300(...)66,RODRIGO FILIPE ESTEVES,"130,9",5,"112,0",141,141
653,300(...)37,RAFAEL OLIVEIRA BORGES FERREIRA,"130,9",1,"99,0",148,148
654,147(...)10,TATIANA TAVARES HONÓRIO,"130,7",1,"119,0",137,137
655,307(...)94,RODRIGO BARBOSA SAMPAIO,"130,7",6,"104,0",145,145
656,159(...)82,MIGUEL FERREIRA MARQUES ANTUNES,"130,6",1,"102,0",146,146
657,151(...)02,JOAO ANDRE CELAVISA DUARTE MOURA,"130,6",1,"100,0",147,147
657,310(...)35,JOSÉ DIOGO MOLEIRINHO TOJEIRA,"130,6",3,"100,0",147,147
659,308(...)04,MICAEL ALEXANDRE VIEIRA JORGE,"130,4",1,"146,0",122,122
660,222(...)12,EUSÉCLIN AMBRÓSIO SIMÕES,"130,3",3,"103,0",145,145
661,220(...)06,RODRIGO AUGUSTO COTRIM,"130,2",1,"125,0",133,133
662,156(...)75,MARIA JOÃO GUARDADO LOPES,"130,2",3,"97,0",148,148
662,156(...)19,VALÉRIO LOURENÇO SANTOS PINHEIRO,"130,2",5,"97,0",148,148
662,313(...)45,SAÚL MANUEL SIMÕES MARQUES,"130,2",1,"97,0",148,148
665,309(...)86,FILIPE MIGUEL CID VAZ,"130,1",3,"119,0",136,136
666,309(...)29,DIOGO ALEXANDRE ARAÚJO DOS SANTOS,"130,1",2,"106,0",143,143
667,303(...)28,JOSÉ MIGUEL CARDOSO RODRIGUES LOUREIRO,"130,1",1,"95,0",149,149
668,145(...)63,GUILHERME DINIS CONFRARIA RODRIGUES,"129,8",2,"120,0",135,135
669,156(...)15,DANIELA GUEDES DA ASSUNÇÃO,"129,8",2,"96,0",148,148
669,157(...)29,JOÃO ANTÓNIO PAIS PAULINO,"129,8",4,"96,0",148,148
671,149(...)99,MIGUEL RAMALHO FAUSTINO,"129,6",2,"127,0",131,131
672,157(...)01,CRISTIAN ALBERTO DE FREITAS VIEIRA,"129,5",3,"95,0",148,148
672,313(...)43,NUNO MIGUEL LOPES FARIA,"129,5",4,"95,0",148,148
674,300(...)26,FÁTIMA INÊS ALVES FONSECA DA SILVA AUGUSTO,"129,3",3,"100,0",145,145
675,300(...)21,FILIPE GOMES SILVA,"129,2",3,"109,0",140,140
676,316(...)75,PEDRO NEVES CAVICHIOLLI,"129,2",1,"96,0",147,147
677,304(...)76,RODRIGO CONSTANTE SIMÕES,"129,1",2,"107,0",141,141
678,311(...)58,FRANCISCO RIBEIRO RODRIGUES,"129,1",1,"105,0",142,142
679,303(...)29,RAFAEL DA COSTA SARAIVA,"129,0",1,"129,0",129,129
680,311(...)70,MARTA CARDOSO LAGARTO FERREIRA VALENTIM,"128,6",1,"100,0",144,144
681,301(...)31,SIMÂO PEDRO MANSILHA GUEDES,"128,6",1,"98,0",145,145
682,144(...)19,RODRIGO PAIVA CALADO,"128,5",2,"122,0",132,132
683,304(...)57,SOFIA REIS FERREIRA,"128,4",3,"103,0",142,142
684,145(...)06,DUARTE LOURENÇO CALADO GOMES SANTO,"128,2",3,"95,0",146,146
684,302(...)21,JOÃO RAFAEL FREITAS FERNANDES,"128,2",1,"95,0",146,146
686,149(...)87,RODRIGO ALEXANDRE PEREIRA SALVADO,"128,1",1,"119,0",133,133
687,153(...)63,MARTIM DANTAS SILVA,"128,0",5,"128,0",128,128
688,153(...)75,GONÇALO FILIPE DE SOUSA GONÇALVES,"128,0",2,"109,5",138,138
689,306(...)69,BRUNO SOUSA GOMES,"127,9",1,"98,0",144,144
690,154(...)14,JOÃO PEDRO ALMEIDA BRAZ SILVA,"127,8",3,"120,0",132,132
691,148(...)59,GUILHERME SOUSA SILVA,"127,8",2,"105,0",140,140
692,148(...)39,TOMÁS DANIEL CARACITAS ABRUNHEIRO,"127,7",1,"116,0",134,134
693,305(...)54,BRUNO CARDEIRA DE ANDRADE,"127,7",4,"101,0",142,142
694,152(...)06,ANDRÉ DE JESUS SANTOS,"127,6",4,"99,0",143,143
695,148(...)93,BRUNO VIEIRA GORDO,"127,3",3,"113,0",135,135
695,149(...)76,KELVIN FRANCISCO DE CARVALHO VIEIRA DA FONSECA,"127,3",4,"113,0",135,135
697,158(...)90,ENZO MIGUEL DA FONSECA COSTA ASINELLI DO NASCIMENTO,"127,3",1,"98,0",143,143
698,303(...)54,FRANCISCO MIGUEL SIMÕES RODRIGUES,"127,2",1,"96,0",144,144
699,311(...)01,DAVID GOMES FIDALGO,"127,0",5,"112,0",135,135
700,151(...)17,AIRES PEDRO DA SILVA BARBOSA,"127,0",1,"99,0",142,142
701,220(...)10,NATACHA YING ZHANG,"126,9",1,"110,0",136,136
702,154(...)80,FÁBIO DANIEL CARVALHO,"126,7",3,"115,0",133,133
703,147(...)32,TIAGO BRUNO DE LOPES E FREITAS,"126,5",1,"107,0",137,137
704,314(...)37,ALÉXIO PSHEHORSKYY,"126,4",1,"101,0",140,140
705,313(...)03,PAULO RAFAEL TEIXEIRA MENDES,"126,3",1,"97,0",142,142
706,148(...)24,TIAGO TELES SANTOS,"126,2",1,"106,0",137,137
707,321(...)70,MARCELLO MASTROBUONO PORTUGAL,"126,0",1,"100,0",140,140
708,305(...)09,BERNARDO DE JESUS PEDRO MORAIS,"125,6",1,"121,0",128,128
709,300(...)89,FRANCISCO NOGUEIRA CARTAXO,"125,6",2,"110,0",134,134
710,156(...)93,TIAGO MIGUEL LOPES CAETANO,"125,6",1,"97,0",141,141
711,157(...)70,AFONSO GONÇALVES MARQUES,"125,6",3,"95,0",142,142
712,159(...)62,MARCO ALEXANDRE SANTOS MARQUES,"125,4",2,"120,5",128,128
713,301(...)66,MIGUEL CARREGUEIRO MIRANDA,"125,4",1,"115,0",131,131
714,148(...)08,DAVID ALEXANDRE MATIAS SANTIAGO CASALEIRO,"125,0",1,"112,0",132,132
715,309(...)96,JOAO FRANCISCO CANIÇO CRUZ,"124,7",4,"105,5",135,135
716,154(...)64,MARTIM TIAGO TEIXEIRA LAMEIRO,"124,4",1,"99,0",138,138
717,300(...)29,RICARDO ALEXANDRE CAPELO ESTEVES,"124,3",3,"110,0",132,132
718,153(...)61,TOMAS VAZ ALBUQUERQUE,"124,3",1,"95,0",140,140
718,159(...)88,PEDRO FERREIRA SIMÕES,"124,3",3,"95,0",140,140
720,309(...)73,ALEXANDRE ALMEIDA PIRES,"124,2",1,"100,5",137,137
721,300(...)83,RODRIGO COIMBRA FIGUEIREDO,"124,0",2,"98,0",138,138
722,147(...)64,RAFAEL SIMÕES RUSGA,"123,9",6,"105,0",134,134
723,152(...)08,DOMINGOS JOSÉ BARROSO PEREIRA,"123,8",4,"101,0",136,136
724,309(...)68,ARMANDO MARTINS OLIVEIRA,"123,6",1,"119,0",126,126
725,155(...)19,RODRIGO ALEXANDRE DA CUNHA TRAVASSOS,"123,6",1,"108,0",132,132
726,307(...)04,VASCO DUARTE PEDRO,"123,5",1,"130,0",120,120
727,313(...)93,JOÃO PEDRO FILIPE MANAIA,"123,3",1,"109,0",131,131
728,311(...)96,DUARTE BATISTA RAMOS,"123,3",1,"96,0",138,138
729,153(...)42,MANUEL CARVALHO GONÇALVES,"123,1",1,"99,0",136,136
730,303(...)13,JOSÉ MIGUEL FARIA CORTE REAL DUARTE,"123,0",1,"110,0",130,130
731,310(...)70,GUILHERME MARQUES SANTOS PESSOA,"123,0",1,"95,0",138,138
732,154(...)02,PEDRO MIGUEL PINTO DE FREITAS,"122,8",2,"100,0",135,135
733,305(...)91,GONÇALO GUERREIRO RODRIGUES,"122,6",2,"107,0",131,131
734,145(...)74,AFONSO LOURENÇO DA CUNHA PIMENTEL,"122,4",6,"99,0",135,135
735,306(...)12,BERNARDO RAFAEL SANTOS GÊGO,"122,3",1,"95,0",137,137
736,305(...)80,JOÃO PEDRO DE SOUSA PEREIRA,"122,1",2,"100,0",134,134
737,155(...)85,LUÍS CARLOS NOBRE FIGUEIRA,"122,0",3,"96,0",136,136
737,158(...)18,EMANUEL DIAS DOS SANTOS,"122,0",4,"96,0",136,136
737,306(...)06,DUARTE FERREIRA DE SOUSA,"122,0",1,"96,0",136,136
740,152(...)70,ANTÓNIO AURÉLIO VIEIRA CAMACHO,"121,7",6,"110,0",128,128
741,307(...)78,FRANCISCO DOS REIS PEREIRA,"121,5",2,"100,0",133,133
742,147(...)47,FRANCISCO VITORINO DE FIGUEIREDO,"121,3",3,"105,0",130,130
743,153(...)34,HENRIQUE ALMEIDA CORREIA,"121,2",3,"101,0",132,132
744,301(...)66,FRANCISCA SILVA RAMOS,"121,0",6,"121,0",121,121
745,310(...)90,GONÇALO ANTÓNIO PINTO NUNES BRITES RIBEIRO,"120,7",2,"96,0",134,134
746,306(...)64,HUGO RAFAEL TAVARES QUEIRÓS,"120,5",5,"101,0",131,131
747,303(...)76,RICARDO MARICATO SANTOS,"120,4",2,"95,0",134,134
748,158(...)75,GONÇALO MARTIM LARANJEIRA BRÁS,"119,9",1,"101,0",130,130
749,152(...)24,ANDRÉ LUÍZ LOURENÇO GONÇALVES,"119,1",1,"95,0",132,132
749,307(...)37,FRANCISCO AMORIM BARROS FERNANDES,"119,1",1,"95,0",132,132
751,151(...)98,ÁLVARO DUARTE SEVERIM AZEVEDO,"118,9",3,"102,0",128,128
