Order Number,Parcial Identification Number,Name,Applicant Grade,Option Number,Entrance Test Grade,12th year grade,Average of 11th and 10th grades
1,145(...)60,AXEL AMOROSO CARAPINHA,"178,4",3,"153,0",192,192
2,312(...)00,TOMAZ CARIAS SOBRAL,"171,7",4,"173,0",171,171
3,303(...)93,EDUARDO FIGUEIRA DE FREITAS FERNANDES,"170,7",6,"183,0",164,164
4,300(...)22,PEDRO MACHADO PACHECO,"164,0",6,"149,0",172,172
5,307(...)93,ARTUR RODRIGUES CORTEZÃO GONÇALVES,"161,7",6,"161,0",162,162
6,302(...)85,PAULO ANTÓNIO TAVARES ABADE,"160,7",1,"160,0",161,161
7,158(...)00,RICARDO DA FONSECA PEREIRA,"160,6",6,"117,0",184,184
8,314(...)85,MIGUEL FILIPE MARCOS RELIQUIAS,"160,4",1,"174,0",153,153
9,148(...)62,LUCAS MIGUEL FREITAS NEVES,"160,2",4,"140,0",171,171
10,300(...)30,DANIEL FILIPE AMARO AUGUSTO,"159,9",6,"141,0",170,170
11,147(...)86,RODRIGO BAJÉ SILVA,"159,5",2,"166,0",156,156
12,313(...)45,DINIS GONÇALVES DUARTE,"158,6",5,"156,0",160,160
13,158(...)46,GONÇALO DIAS RODRIGUES,"156,4",3,"172,0",148,148
14,152(...)88,LUÍS ALEXANDRE PINTO ROSA,"154,8",2,"145,0",160,160
15,303(...)40,RAFAEL FRAGOSO LOURENÇO,"151,2",4,"146,0",154,154
16,156(...)52,GONÇALO ANDRÉ FARÓFIAS ESPADA,"150,5",5,"118,0",168,168
17,159(...)93,DINIS PEDRO CARA LINDA BENGALINHA,"150,2",6,"132,0",160,160
18,300(...)45,PEDRO ALEXANDRE DIAS LIMPO,"148,3",4,"106,0",171,171
19,153(...)16,RAFAEL GOMES PINTO,"148,1",6,"150,0",147,147
20,152(...)01,HUGO MIGUEL DA SILVA CONCEIÇÃO,"146,7",6,"122,0",160,160
21,309(...)61,MIGUEL ANDRÉ VIEGAS GUERREIRO,"146,6",5,"155,0",142,142
22,159(...)60,JOÃO MIGUEL MANETA PEIXOTO,"146,5",5,"140,0",150,150
23,220(...)16,GABRIEL COSTA PAIVA,"146,1",5,"135,0",152,152
24,303(...)82,GUILHERME FILIPE PRATES BORBINHAS,"145,3",3,"142,0",147,147
25,151(...)26,RODRIGO MANUEL SILVA BAIÃO,"144,4",2,"119,0",158,158
26,308(...)66,INÊS GONÇALVES CORREIA COELHO,"142,8",3,"159,0",134,134
27,154(...)48,LEONARDO GUILHERME BARREIRAS,"142,5",5,"123,0",153,153
28,314(...)21,DINIS SOKOLAN LEVCHENKO,"142,4",5,"119,0",155,155
29,150(...)70,GUILHERME TOLEDO DO CARMO,"142,3",2,"115,0",157,157
30,149(...)60,MARIA GUERREIRO PAULINO,"141,4",5,"129,0",148,148
31,147(...)34,JOÃO JOSÉ GONÇALVES ABREU,"141,3",2,"125,0",150,150
32,159(...)98,JOÃO MIGUEL ESTEVENS PATRÍCIO,"141,0",1,"146,5",138,138
33,154(...)05,DIOGO JOSÉ GUERREIRO PATUSCA,"140,6",5,"110,0",157,157
34,149(...)34,ANDRE FILIPE SOUSA LOPES PINHO,"140,4",3,"130,0",146,146
35,314(...)04,AFONSO MIGUEL DE SOUSA AMADOR BITOQUE,"140,0",4,"125,0",148,148
36,157(...)69,GONÇALO SAROL PORTUGUES,"139,0",4,"137,0",140,140
37,302(...)41,RICARDO JORGE OLIVEIRA SOARES,"138,1",6,"140,0",137,137
38,305(...)71,TOMÁS FURTADO BOTELHO MACHADO,"137,9",6,"145,0",134,134
39,303(...)30,RODRIGO MIGUEL DA SILVA VAZ,"137,4",6,"127,0",143,143
40,300(...)04,AFONSO MIGUEL MOUTINHO CLAUDINO,"137,3",3,"123,0",145,145
41,311(...)99,JOÃO PEDRO CARAPINHA MACHADO,"136,7",4,"110,0",151,151
42,301(...)38,RENATO SIMAO GONÇALVES MAIA,"136,3",5,"135,0",137,137
43,157(...)64,INÊS BACALHAU PINTO JANEIRO,"135,4",1,"136,0",135,135
44,151(...)74,JORGE AUGUSTO CABRAL DE JESUS,"134,4",5,"109,0",148,148
45,150(...)28,DIOGO RAFAEL SOARES RODRIGUES,"134,0",2,"95,0",155,155
46,308(...)67,MARTINHO JOSÉ NOVO CAEIRO,"133,6",1,"103,0",150,150
47,302(...)66,DIOGO RODRIGUES MARQUES,"133,3",2,"119,0",141,141
48,301(...)95,JOÃO CARLOS ALVES FERNANDES,"131,8",4,"109,0",144,144
49,304(...)40,MIGUEL ÂNGELO CORREIA CAMPOS,"131,5",3,"97,0",150,150
50,148(...)88,DANIEL BRISSOS RAMOS MORENO,"131,4",2,"106,0",145,145
51,157(...)69,MIGUEL CAEIRO GUERREIRO,"131,3",5,"102,0",147,147
52,151(...)61,MIGUEL ANGELO CEBOLA DE CARVALHO,"131,0",6,"105,0",145,145
53,312(...)80,ANDRÉ FILIPE ALMEIDA DA ROCHA,"130,6",4,"102,0",146,146
54,147(...)32,XAVIER FARIA BOLOTINHA,"130,5",4,"109,0",142,142
55,220(...)06,RODRIGO AUGUSTO COTRIM,"130,2",5,"125,0",133,133
56,153(...)26,JOÃO GUILHERME TECHANA MARTINS,"129,8",5,"107,0",142,142
57,303(...)66,BEATRIZ PEREIRA RIJO LOPES,"129,0",4,"101,0",144,144
58,150(...)36,TIAGO FIGUEIREDO MARTINS,"128,9",3,"112,0",138,138
59,220(...)01,ALEXANDRE ISSAO SAMPAIO ATOJI,"128,2",4,"149,0",117,117
60,301(...)13,SEBASTIÃO TEIXEIRA NOGUEIRA,"128,1",1,"106,0",140,140
61,150(...)42,JOSÉ MIGUEL CAMPANIÇO SARGENTO,"126,3",2,"97,0",142,142
61,157(...)33,JOÃO FILIPE ROQUE DOS SANTOS SALGADO SILVA,"126,3",6,"97,0",142,142
63,313(...)79,BRUNO NASCIMENTO BENTO DA PALMA,"126,2",2,"106,0",137,137
64,152(...)78,JOÃO ANTÓNIO DIAS PAIXÃO,"125,8",4,"118,0",130,130
65,149(...)37,JOÃO JOSÉ CURVO REIS,"125,3",3,"135,0",120,120
66,152(...)44,RAFAEL ALEXANDRE RIBEIRO GRAÇA,"124,5",4,"105,0",135,135
67,159(...)52,GUILHERME DO CARMO E FIGUEIREDO,"123,9",5,"105,0",134,134
68,154(...)02,PEDRO MIGUEL PINTO DE FREITAS,"122,8",6,"100,0",135,135
69,150(...)88,JOAO EDUARDO SARA SOUSA,"122,6",3,"105,0",132,132
70,302(...)80,PEDRO MIGUEL DA FONSECA TRANSMONTANO FERNANDEZ DA SILVA,"120,7",5,"96,0",134,134
71,301(...)20,DUARTE MOREIRA RIBEIRO,"114,5",6,"95,0",125,125
72,303(...)31,PEDRO MIGUEL PADILHA DE CARVALHO,"113,7",4,"109,5",116,116
73,302(...)91,DIOGO JOSÉ PATINHA VIDAZINHA,"112,2",4,"105,0",116,116
74,149(...)88,DANIEL NÓBREGA DE SOUSA,"111,9",3,"95,0",121,121
75,149(...)02,JOÃO GOUVEIA DE BETTENCOURT,"105,0",5,"105,0",105,105
