752,313(...)61,TIAGO SOARES FERREIRA,"118,4",2,"95,0",131,131
753,149(...)82,TIAGO SILVA VIEIRA,"118,1",4,"96,0",130,130
753,220(...)11,BRUNO EDUARDO SILVA DE ANDRADE,"118,1",4,"96,0",130,130
755,154(...)54,FRANCISCO DOS SANTOS PEREIRA,"117,8",6,"95,0",130,130
756,153(...)27,OCTÁVIO PITA HENRIQUES,"117,6",5,"100,0",127,127
757,148(...)70,MIGUEL ÂNGELO PEREIRA SILVA,"115,9",2,"99,0",125,125
758,143(...)06,ALEXANDRE BRANCO DA CRUZ VIEIRA,"113,6",5,"111,0",115,115
759,310(...)79,JOEL HENRIQUE MONTEIRO SANTOS,"112,6",6,"95,0",122,122
760,149(...)02,JOÃO GOUVEIA DE BETTENCOURT,"105,0",6,"105,0",105,105
