1117,157(...)20,FRANCISCO JOSÉ DE ASSUNÇÃO AGANTE,"143,9",1,"125,0",154,154
1118,310(...)40,FÁBIO JOSÉ DA SILVA VIEIRA,"143,9",1,"99,0",168,168
1119,302(...)62,GUILHERME SÁ MONTEIRO DE LENCASTRE LUPI,"143,8",1,"147,0",142,142
1120,306(...)38,MIGUEL ALEXANDRE MARQUES CEREJO,"143,8",1,"123,0",155,155
1121,310(...)66,DIOGO GOMES CARDOSO,"143,7",1,"117,0",158,158
1122,312(...)64,DIOGO PAIVA VEIGA,"143,6",2,"128,0",152,152
1123,306(...)66,RÚBEN FILIPE TAVARES PEREIRA,"143,6",1,"102,0",166,166
1124,311(...)20,GABRIEL CORREIA ALVES,"143,6",1,"100,0",167,167
1125,149(...)46,GONÇALO PAIVA FERREIRA,"143,5",1,"98,0",168,168
1125,304(...)14,MARIANA RAQUEL OLIVEIRA SILVA,"143,5",2,"98,0",168,168
1127,153(...)11,LUÍS MIGUEL MARQUES RAFAEL,"143,4",1,"146,0",142,142
1128,300(...)52,VASCO SANTOS FERREIRA,"143,3",2,"127,0",152,152
1129,154(...)92,TOMÁS CARDOSO COSTA,"143,3",4,"103,0",165,165
1130,316(...)63,LUIS FELIPE DA CUNHA FLORES,"143,2",1,"112,0",160,160
1131,304(...)62,GONÇALO JOSE DE JESUS CORREIA MARQUES,"143,1",1,"145,0",142,142
1132,304(...)52,FRANCISCO LAPA OLIVEIRA COELHO,"143,1",1,"121,0",155,155
1132,305(...)25,CARLOS ALBERTO MOREIRA BARBOSA,"143,1",2,"121,0",155,155
1132,305(...)01,FRANCISCO NUNES MOREIRA,"143,1",1,"121,0",155,155
1135,302(...)33,DANIEL FILIPE VENTURA SANTANA,"143,1",4,"119,0",156,156
1136,151(...)12,ANA SOFIA MARTINS DE OLIVEIRA,"143,1",2,"108,0",162,162
1137,153(...)46,HENRIQUE VERDIAL MARTINS PEREIRA,"143,1",6,"106,0",163,163
1138,154(...)42,PEDRO DIAS GOMES,"143,0",1,"130,0",150,150
1139,310(...)31,INÊS DA ROCHA SANTOS CERVEIRA PATRÍCIO,"143,0",3,"102,0",165,165
1140,305(...)55,DANIEL TEIXEIRA CARDOSO,"142,9",5,"137,0",146,146
1141,157(...)71,RAUL MESSIAS MORGADO CHOUPINA,"142,9",1,"98,0",167,167
1142,152(...)55,GUILHERME FERNANDES OLIVEIRA,"142,8",1,"122,0",154,154
1142,310(...)70,JOSÉ MANUEL BARREIRO PERFEITO,"142,8",1,"122,0",154,154
1144,150(...)01,FRANCISCO PEREIRA LIQUITO,"142,8",2,"107,0",162,162
1145,304(...)02,MARTIM LUÍS RAMALHO ARAÚJO,"142,6",1,"125,0",152,152
1145,314(...)62,ALOÍSIO FERREIRA MOREIRA,"142,6",4,"125,0",152,152
1147,156(...)64,GUSTAVO LUIS MEIRELES DE JESUS,"142,5",1,"95,0",168,168
1148,152(...)72,JOÃO PEDRO ORNELAS FREITAS,"142,4",2,"145,0",141,141
1149,305(...)94,GONÇALO FILIPE CARVALHO NOGUEIRA,"142,4",1,"117,0",156,156
1150,157(...)77,JOAO PEDRO MINHOTO ALVES,"142,3",3,"128,0",150,150
1151,149(...)48,LOURENÇO SECCA FERNANDES DA SILVA,"142,3",1,"126,0",151,151
1152,308(...)09,JOSÉ ANTÓNIO DA SILVA MENDES,"142,3",1,"100,0",165,165
1153,306(...)93,PEDRO DAMIÂO SILVA HOMEM CARDOSO,"142,2",1,"122,0",153,153
1154,308(...)68,TIAGO FILIPE SOUSA MONTEIRO,"142,2",3,"98,0",166,166
1155,301(...)48,TOMAS DA JUSTA COUTO DA SILVA MATOS,"142,2",4,"96,0",167,167
1156,147(...)22,MARTIM ALEXANDRE BRANDÃO FERREIRA,"142,1",1,"107,0",161,161
1157,149(...)56,PEDRO EMANUEL FERNANDES FREITAS,"142,0",2,"127,0",150,150
1158,300(...)43,RÚBEN FILIPE SILVA FERREIRA,"141,9",1,"138,0",144,144
1159,314(...)85,MARIA INÊS RODRIGUES E RODRIGUES,"141,8",2,"121,0",153,153
1160,304(...)03,JOÃO SANTOS CARDOSO,"141,8",1,"95,0",167,167
1161,304(...)91,HENRIQUE DE SOUSA MENDONÇA,"141,6",1,"100,0",164,164
1162,309(...)66,FILIPE PINTO DOS SANTOS,"141,4",1,"118,0",154,154
1163,154(...)94,HUGO FILIPE TEIXEIRA LOUREIRO,"141,4",2,"105,0",161,161
1164,150(...)81,TOMÁS FRAGOSO BARREIRA,"141,2",4,"95,0",166,166
1165,149(...)49,AFONSO ALVES DAVID,"141,1",4,"106,0",160,160
1166,149(...)57,RAFAEL ALEXANDRE ARAÚJO PEREIRA DA SILVA,"141,0",2,"113,0",156,156
1166,303(...)44,SUSANA DANIELA TAVARES,"141,0",1,"113,0",156,156
1168,151(...)94,TOMAS BARBOSA MARQUES,"141,0",1,"102,0",162,162
1168,156(...)13,LUIS GUILHERME GIAO GUEDES,"141,0",4,"102,0",162,162
1170,152(...)68,TIAGO MIGUEL RODRIGUES DA COSTA DIAS,"141,0",4,"100,0",163,163
1171,159(...)11,LUIS PEDRO DOS SANTOS CORREDOURA,"140,9",1,"122,0",151,151
1172,152(...)65,HELDER FILIPE GOMES DE SOUSA,"140,9",1,"111,0",157,157
1173,307(...)78,TIAGO COSTA DA SILVA,"140,9",1,"98,0",164,164
1173,307(...)43,RUI MANUEL DE CASTRO FERREIRA,"140,9",1,"98,0",164,164
1175,154(...)85,JOÃO DA SILVA CASTRO RIBEIRO,"140,9",1,"96,0",165,165
1175,310(...)79,GUILHERME GONÇALVES PEREIRA,"140,9",1,"96,0",165,165
1177,157(...)08,AFONSO MIGUEL FERNANDES SALVADOR FRESCO FERREIRA,"140,8",1,"133,0",145,145
1178,301(...)19,MARIA JOÃO MORAIS SILVA,"140,8",3,"118,0",153,153
1179,154(...)80,MIGUEL DUARTE MACHADO DA COSTA MORAIS LEITÃO,"140,6",1,"110,0",157,157
1180,157(...)59,MARTIM DAVID CARVALHO MENDES,"140,6",1,"97,0",164,164
1181,153(...)84,DIOGO MANUEL MOREIRA ALVES,"140,5",1,"95,0",165,165
1182,310(...)92,GUSTAVO DANIEL MATOS PEREIRA,"140,4",1,"104,0",160,160
1183,314(...)98,LARA FILIPA SEMBLANO BASTOS,"140,3",2,"98,0",163,163
1184,150(...)54,MARTIM DAVID DE CARVALHO DOS SANTOS,"140,2",1,"135,0",143,143
1184,153(...)70,LUCAS DURÃES CERQUEIRA,"140,2",1,"135,0",143,143
1186,157(...)88,FRANCISCO JOÃO SÁ GOMES DE ARAÚJO,"140,1",1,"116,0",153,153
1187,313(...)18,RUI DANIEL FERREIRA MOREIRA,"140,0",4,"140,0",140,140
1188,304(...)44,JOSÉ RUI MACHADO LOPES NETO,"139,9",1,"110,0",156,156
1189,148(...)71,IURI MARTINS MOUTINHO,"139,9",6,"95,0",164,164
1190,312(...)42,MATILDE BARROS DE JESUS,"139,7",5,"115,0",153,153
1191,306(...)12,HUGO SIMÕES FERREIRA,"139,7",2,"100,0",161,161
1192,304(...)51,ALEXANDRE BARRIAS DA SILVA FERNANDES,"139,6",2,"109,0",156,156
1193,312(...)17,JOSÉ LUÍS SOUSA MOREIRA,"139,5",1,"118,0",151,151
1194,302(...)79,NUNO JOSÉ LOUREIRO SANTOS SILVA,"139,3",1,"125,0",147,147
1195,155(...)33,LEONARDO ARAUJO DE CASTRO,"139,3",5,"123,0",148,148
1196,312(...)03,RUBEN FILIPE SOUSA PINTO,"139,2",3,"119,0",150,150
1197,158(...)68,HUGO MIGUEL TATO RESENDE,"139,1",2,"115,0",152,152
1198,158(...)89,MARIA MIGUEL GOMES FERREIRA,"139,0",2,"111,0",154,154
1199,150(...)42,GUILHERME MARIA BAPTISTA REBELO DE SOUSA BARROS,"138,9",2,"122,0",148,148
1200,151(...)63,ANA LUÍSA SAMPAIO BARBOSA,"138,9",1,"96,0",162,162
1201,306(...)05,GABRIEL MOREIRA BEÇA,"138,7",2,"99,0",160,160
1202,156(...)15,LEONARDO TEIXEIRA PARCHÃO,"138,6",1,"110,0",154,154
1203,159(...)03,CLÁUDIO HENRIQUE DAMAS FERNANDES MOREIRA,"138,6",2,"97,0",161,161
1204,150(...)85,ALEXANDRE MENDONÇA CARDOSO DE MOURA,"138,4",1,"102,0",158,158
1205,157(...)73,SIMÃO SILVA LOPES,"138,3",1,"111,0",153,153
1206,152(...)33,RAFAEL ARAÚJO SEPÚLVEDA SEQUEIRA RIBEIRO,"138,3",1,"96,0",161,161
1207,150(...)84,FRANCISCO VIEIRA DA SILVA MANDIM PRIMAVERA,"138,0",1,"110,0",153,153
1208,230(...)18,BRUNO MESQUITA SANTOS DE ALBUQUERQUE,"138,0",1,"97,0",160,160
1208,301(...)15,TIAGO DOS SANTOS OLIVEIRA,"138,0",3,"97,0",160,160
1210,151(...)34,MIGUEL VAZ SILVA,"137,8",1,"115,0",150,150
1210,156(...)01,LEANDRO GOUVEIA RODRIGUES,"137,8",5,"115,0",150,150
1212,151(...)82,LUCAS FERREIRA ALVES,"137,6",2,"120,0",147,147
1213,307(...)38,DIOGO FILIPE DA COSTA CONCEIÇÃO,"137,6",2,"107,0",154,154
1214,150(...)82,MIGUEL MOREIRA GONÇALVES,"137,5",1,"105,0",155,155
1215,314(...)50,JOSÉ FELIZARDO SILVA PINTO,"137,3",1,"108,0",153,153
1216,151(...)98,BRUNO MIGUEL PEREIRA DE JESUS,"137,1",1,"100,0",157,157
1217,156(...)18,PEDRO ALEXANDRE RAMOS RIBEIRO,"137,0",1,"111,0",151,151
1217,157(...)11,FRANCISCO SIMÃO PERALTA,"137,0",3,"111,0",151,151
1219,149(...)12,GUILHERME DUARTE DE SOUSA RIBEIRO,"136,9",2,"105,0",154,154
1220,303(...)26,DIOGO MIGUEL VILAR MADUREIRA,"136,6",1,"106,0",153,153
1221,230(...)09,VICTOR SOBRAL DE CARVALHO FERREIRA,"136,4",4,"126,0",142,142
1222,151(...)55,MIGUEL SILVA DE PAULA,"136,4",1,"111,0",150,150
1223,316(...)35,SÉRGIO DANIEL GUIMARÃES FERNANDES,"136,0",1,"97,0",157,157
1224,153(...)32,LUÍS DA ROCHA ALÍPIO CERQUEIRA,"136,0",6,"95,0",158,158
1225,154(...)04,RODRIGO SILVA BESSA,"135,6",1,"131,0",138,138
1225,306(...)35,RICARDO MANUEL MAGALHÃES JESUS,"135,6",1,"131,0",138,138
1227,306(...)45,RAFAEL AGUIAR MADUREIRA,"135,5",2,"116,0",146,146
1228,312(...)29,BEATRIZ JOÃO SILVA FERNANDES GUEDES CASTRO,"135,5",1,"101,0",154,154
1229,154(...)63,PEDRO COSTA COELHO DOS SANTOS,"135,4",1,"123,0",142,142
1230,306(...)35,TOMÁS TEIXEIRA RODRIGUES,"135,4",1,"97,0",156,156
1231,151(...)19,DINIS ABREU FIGUEIREDO SILVA MIRANDA,"135,1",5,"111,0",148,148
1232,311(...)87,JOANA OLIVEIRA SEQUEIRA,"135,1",1,"100,0",154,154
1233,304(...)99,DIOGO SANTOS LEÃO,"134,7",5,"97,0",155,155
1234,148(...)83,PEDRO ANTÓNIO MARÇAL MARCOS SAMPAIO,"134,6",2,"106,0",150,150
1235,307(...)65,SÉRGIO GOMES PINTO,"134,5",2,"100,0",153,153
1236,303(...)37,JOÃO PAULO ALVES NUNES,"134,4",1,"109,0",148,148
1237,149(...)67,BEATRIZ ANCIÃES ALVES,"134,4",1,"98,0",154,154
1238,301(...)47,JOÃO PEDRO MOREIRA SANTOS,"134,4",4,"96,0",155,155
1239,303(...)99,EDUARDO MIGUEL MARTINS FRANCO,"134,2",2,"103,0",151,151
1240,150(...)27,GONÇALO FILIPE CUNHA ALMEIDA,"133,9",3,"130,0",136,136
1241,159(...)46,FRANCISCO CUSTÓDIO PINTO,"133,9",4,"115,0",144,144
1242,154(...)10,BRUNO MIGUEL TORRES RIBEIRO,"133,9",1,"102,0",151,151
1243,313(...)51,AFONSO ALMEIDA MIRANDA DE VILAS BOAS,"133,7",3,"96,0",154,154
1244,301(...)87,TOMÀS DE SOUSA E SILVA,"133,4",1,"95,0",154,154
1245,332(...)31,YAGO SENTIEIRO ALBA,"133,3",2,"158,0",120,120
1246,304(...)86,JOÃO MIGUEL GUEDES REBELO,"133,2",4,"126,0",137,137
1247,312(...)37,AFONSO DUARTE VILÃN PEREIRA,"133,2",5,"100,0",151,151
1248,153(...)06,DAVID ALEXANDRE ALMEIDA MOREIRA,"133,1",4,"96,0",153,153
1248,310(...)48,ANA MARTA MOURA SILVA,"133,1",2,"96,0",153,153
1250,150(...)59,NUNO MIGUEL RIBEIRO DA SILVA,"133,0",1,"118,0",141,141
1250,155(...)48,JORGE RODRIGUES OLIVEIRA,"133,0",2,"118,0",141,141
1252,305(...)44,FRANCISCO MONTEIRO MARTINS CARNEIRO,"132,7",1,"108,0",146,146
1253,157(...)64,EDUARDO ALEXANDRE ANTUNES CORREIA,"132,5",2,"100,0",150,150
1253,306(...)17,ABEL FERNANDES GOMES,"132,5",2,"100,0",150,150
1255,154(...)47,EGAS DAVID SANTOS COSTA,"132,3",2,"103,0",148,148
1255,157(...)46,LUKA CASTRO ROCA,"132,3",3,"103,0",148,148
1257,306(...)27,ANTÓNIO JORGE HENRIQUES ALMEIDA,"132,2",4,"99,0",150,150
1257,306(...)59,JOEL OLIVEIRA PINTO,"132,2",1,"99,0",150,150
1259,308(...)27,LUÍS RODRIGUES AMARAL TAVARES,"132,1",1,"108,0",145,145
1260,306(...)40,ANA LUISA CASTRO SANTOS COELHO,"132,1",1,"95,0",152,152
1261,149(...)63,SAMUEL ALEXANDRE FERNANDES FURTADO,"131,7",1,"105,0",146,146
1262,301(...)11,MARCELO JOSE MOREIRA CAMPOS,"131,3",1,"104,0",146,146
1263,328(...)14,FELIPE BUENO DE MORAES ARAUJO RAMOS,"131,2",2,"139,0",127,127
1264,148(...)72,EDUARDO SOUSA OLIVEIRA,"130,8",2,"95,0",150,150
1265,300(...)01,ANDRÉ FILIPE DELGADO FONTES,"130,6",2,"102,0",146,146
1266,150(...)39,VÍTOR HUGO OLIVEIRA,"129,9",1,"100,0",146,146
1266,153(...)39,AFONSO SÁ BASTOS BEZELGA LEAL,"129,9",4,"100,0",146,146
1268,159(...)99,VASCO ALEXANDRE CARVALHO ORGANISTA,"129,5",4,"123,0",133,133
1269,304(...)95,GUILHERME AMARO CABRAL ALA,"129,5",1,"97,0",147,147
1270,303(...)96,RICARDO DO VALE CARDOSO,"129,4",1,"119,0",135,135
1271,158(...)71,GABRIEL GARCIA MARQUES,"129,3",3,"100,0",145,145
1272,153(...)80,GABRIEL RAMOS SÁ,"129,0",1,"103,0",143,143
1273,150(...)09,MIGUEL FERNANDES GOMES AUGUSTO,"129,0",4,"101,0",144,144
1274,312(...)75,FILIPE DANIEL MOREIRA DIAS,"128,6",1,"113,0",137,137
1275,306(...)42,TIAGO PEREIRA CARVALHO DOS SANTOS PREGUIÇA,"128,3",3,"101,0",143,143
1276,150(...)91,JOAO PEDRO OLIVEIRA CORREIA,"128,2",1,"95,0",146,146
1277,150(...)32,ANA CAROLINA SÁ OLIVEIRA,"128,0",6,"100,0",143,143
1278,314(...)92,PEDRO MIGUEL COELHO RIBEIRO,"127,7",3,"101,0",142,142
1279,147(...)76,NICIA FILIPA SILVA JESUS,"127,4",2,"115,0",134,134
1280,308(...)82,ANDRE FILIPE FLORES RIBEIRO,"127,3",1,"98,0",143,143
1281,306(...)01,MARCO DANIEL PINTO DA SILVA,"127,2",1,"96,0",144,144
1282,300(...)55,RODRIGO MIGUEL AFONSO E PACHECO,"127,0",4,"99,0",142,142
1283,157(...)78,DIOGO HENRIQUE MOURA DA SILVA,"126,6",1,"124,0",128,128
1284,301(...)35,GONÇALO MOURA OLIVEIRA,"126,6",2,"96,0",143,143
1285,158(...)62,MÁRCIO FILIPE BORGES LIMA,"126,5",2,"107,0",137,137
1286,153(...)75,FILIPE PACHECO MOTA,"126,3",1,"99,0",141,141
1287,149(...)53,LUCAS DIAS NUNES VITAL DE ARAÚJO,"126,2",4,"119,0",130,130
1288,306(...)26,PETÚNIA SOFIA AFONSO DIAS,"126,2",1,"95,0",143,143
1289,149(...)51,TOMÁS GUERRA DA HORA ARAÚJO,"126,0",1,"98,0",141,141
1290,312(...)56,FRANCISCO QUEIROZ DA SILVA,"125,9",2,"96,0",142,142
1291,151(...)04,JOSÉ JOAQUIM ROSA DE JESUS,"125,8",5,"105,0",137,137
1292,146(...)76,RUI SALVADOR PACHECO E SOUSA,"125,6",1,"95,0",142,142
1293,303(...)05,JOÃO PEDRO NUNES PACHECO,"125,1",1,"103,0",137,137
1294,308(...)07,RODRIGO MIGUEL PONTES DUARTE,"124,3",4,"95,0",140,140
1295,148(...)45,TOMÁS MACEDO MORTE,"123,7",2,"97,0",138,138
1296,308(...)04,ALEXANDRE RAFAEL LOPES ROCHA,"123,5",1,"115,0",128,128
1297,309(...)56,VASCO FRAGA OUTEIRO,"123,4",4,"100,0",136,136
1298,302(...)29,DAVID RIBEIRO TAVARES E SILVA DE ARAÚJO,"123,0",4,"95,0",138,138
1299,149(...)60,JOSÉ PEDRO MARQUES DA COSTA GUEDES,"122,3",1,"95,0",137,137
1299,309(...)25,JOAO PEDRO LEITE COSTA SILVA RAMALHÃO,"122,3",2,"95,0",137,137
1299,312(...)68,EDUARDO ESCALEIRA FONSECA,"122,3",3,"95,0",137,137
1302,302(...)13,HUGO TIAGO BARROS DOS SANTOS,"121,7",1,"95,0",136,136
1303,305(...)95,TIAGO ANDRÉ OLIVEIRA LEAL,"121,6",2,"106,0",130,130
1304,312(...)84,CARLOS DINIS BORGES SOUSA,"121,5",1,"100,0",133,133
1305,310(...)75,DAVID ALEXANDRE COELHO MARTINS,"120,9",1,"102,0",131,131
1306,301(...)49,BERNARDO DE MORAES CUNHA,"120,8",1,"100,0",132,132
1307,149(...)44,DIOGO VILELA FERREIRA,"120,4",3,"95,0",134,134
1308,152(...)87,BERNARDO PORTILHO EMINA,"119,5",2,"100,0",130,130
1309,156(...)55,RODRIGO DA SILVA FERREIRA GONCALVES,"118,4",2,"108,0",124,124
1310,315(...)84,DIOGO ANDRÉ JESUS COELHO,"118,4",1,"95,0",131,131
